,title1,page_url,title2,first_paragraph
38,Bob Dylan in America,https://www.foreignaffairs.com/reviews/capsule-review/2011-01-01/bob-dylan-america,Bob Dylan in America,"The distinguished Princeton historian Wilentz lives a double life: he is also a well-known commentator on the work of Bob Dylan and has been nominated for a Grammy for his liner notes on a Dylan album. In Bob Dylan in America, Wilentz brings his professional historical skills together with his appreciation for Dylan's work and for the rich American musical traditions from which it emerged. The result is a daring and unconventional book that does not always succeed -- but that always provokes and challenges. It is both a deep historical exploration of American music, ranging from the Delta blues to Aaron Copland, and a close commentary on various aspects of Dylan's career. The essays on American music history are extraordinary for their depth and detail, but they often seem too far afield from Dylan's work to belong in the book. The material on Dylan himself is deeply felt and often powerfully presented, but there are times when the fan appears to beat out the historian. Nevertheless, readers (or listeners, as the audio edition of the book includes snippets of music to illustrate some of the arguments) will find their interest in American music and Dylan stimulated and enriched. Popular music is one of the United States' most distinctive and influential forms of expression; if more historians worked like Wilentz to integrate America's music into the American story, the national narrative might become richer, more comprehensive, and perhaps even a bit wiser."
39,At the Precipice: Americans North and South During the Secession Crisis.,https://www.foreignaffairs.com/reviews/capsule-review/2011-01-01/precipice-americans-north-and-south-during-secession-crisis,At the Precipice: Americans North and South During the Secession Crisis.,"The secession crisis that began 150 years ago with the election of President Abraham Lincoln and culminated in the American Civil War was not the first bitter struggle between the North and the South -- but it was the only one to end in war rather than compromise. Bowman attempts to identify the ideological, political, and cultural forces that made the crisis of 1860 impossible to resolve peacefully. Taking the unconventional yet persuasive route of looking in depth at the lives and thoughts of a diverse group of influential people in the North and the South, Bowman demonstrates the degree to which each side had come to view the other as a conspiratorial, ruthless power that would not stop until it had subjugated its rival. The South viewed the Republicans' strategy of ""containing"" the ""peculiar institution"" as a plan for its ultimate extinction. Northerners, meanwhile, were leery of the South's desire to secure slavery's future by extending its reach into new territories in the tropics and ensuring the right of slaveholders to take their human property into federal territory. They saw this as a plan that would imperil the ability of Northern states to keep ""the Slave Power"" and even slavery itself at bay. Readers of At the Precipice are likely to come away feeling both that the Civil War was largely inevitable and that the instinct of U.S. politics to find compromise solutions is so strong that only a conflict as stark as the one between slavery and human freedom could overcome it."
40,Big Girls Don't Cry: The Election That Changed Everything for American Women,https://www.foreignaffairs.com/reviews/capsule-review/2011-01-01/big-girls-dont-cry-election-changed-everything-american-women,Big Girls Don’t Cry: The Election That Changed Everything for American Women,"While many Americans remember the 2008 presidential election as the triumph of an African American, a number of others remember it as the defeat of two powerful women: Hillary Clinton in the Democratic primaries and Sarah Palin in the general election. Traister, one of the most powerful voices in a new generation of American feminist writers, explores the conflicted terrain on which many left-liberal American women found themselves first angered by what appeared to be unfair and even sexist treatment of Clinton at the hands of the press compared to the much softer coverage of her male rival -- and then feeling unaccustomed pangs of sympathy for Palin as much of the establishment press made her a figure of derision. Michelle Obama -- yet another dynamic professional woman, caught up in the contradictory expectations that surround a First Lady -- also, in Traister's view, had to navigate a treacherous path. Traister has a lot to say about what this series of events reveals about the state of American culture and American feminism, and her clear style and analytic bent make her both an entertaining and an enlightening guide. That Clinton, Palin, and Obama have all become more visible and more powerful since 2008 signifies something about the power and creativity of American women; Ginger Rogers is still dancing as deftly as Fred Astaire, and still doing it backward and in high heels."
41,Washington: A Life,https://www.foreignaffairs.com/reviews/capsule-review/2011-01-01/washington-life,Washington: A Life,"Chernow, a distinguished historian, takes on the most important and most difficult subject in American biography: the life of the extraordinary Virginia colonial who, with his force of character, political skills, patriotic commitment, marmoreal propriety, and iron will, did more than any other person to establish the independence of the United States and make its republic work. From John Marshall onward, George Washington's biographers have usually failed. Washington was the nation's first performance artist: virtually his entire public life was a carefully constructed act, and writers have generally been unable to find the man behind the mask. Chernow's study of the young Washington, before the mask settled firmly into place, brings readers close to an insecure man fiercely determined to win honor and respect -- traces of whom can still be seen beneath the general and the president. The attention Chernow pays to Washington's life as a slave owner is revelatory: the irresolvable moral and economic dilemmas of the institution gave Washington little satisfaction and no rest, and by setting out both what he did and what he did not do about it, the account offers a uniquely insightful view of the contradictions and human reality underneath that impressive façade."
42,Obama's Wars,https://www.foreignaffairs.com/reviews/capsule-review/2011-01-01/obamas-wars,Obama’s Wars,"Another president, another war, another fly-on-the-wall account by Woodward. A British politician once said that conducting foreign relations in a democracy is like playing bridge with a crowd of people behind you loudly discussing your hand and making suggestions about what cards to play. Public curiosity is certainly served by books of this kind; what is less certain is that the public interest benefits when the inner war councils of a serving U.S. president, complete with the hesitations and mental reservations that accompany any strategic discussion, are served out before an audience that necessarily includes U.S. enemies. Regardless, Woodward, as usual, has produced a riveting and at times revelatory read. Much attention has been paid to the book's insight into civil-military relations; some readers will be more interested in what can be learned about the quality of strategic thought in the White House and the Pentagon. The specter that haunts the war in Afghanistan is similar to the one that stalked Lyndon Johnson in Vietnam. Is this a war that an administration feels it cannot lose but does not know how to win? The answer to that cannot be determined from this book; one wishes the Taliban and Pakistan's Inter-Services Intelligence were blessed with Bob Woodwards of their own to give clues about how the current Afghan war will unfold."
43,The Dangers of a Nuclear Iran,https://www.foreignaffairs.com/articles/persian-gulf/2011-01-01/dangers-nuclear-iran,The Dangers of a Nuclear Iran,"What to do about Iran's nuclear program is one of the most vexing foreign policy challenges confronting the Obama administration. This debate is increasingly characterized both by growing pessimism about whether the international community's diplomatic efforts and economic sanctions can prevent Iran from acquiring nuclear weapons and by guarded optimism that the consequences a nuclear-armed Iran are manageable. Writing in these pages last spring, James Lindsay and Ray Takeyh, both of the Council on Foreign Relations, maintained that the United States could contain Iran even if it developed a nuclear arsenal by establishing clear ""redlines"" that Tehran would not be allowed to cross without risking some type of retaliation. For example, if Iran used its nuclear weapons, transferred them to a third party, invaded its neighbors, or increased its support for terrorist groups such as Hamas and Hezbollah, the United States would be compelled to respond, although the measures it chose to adopt would not be specified in advance. This argument reflects the public position of many senior U.S. and European officials, as well as a number of prominent academics and defense intellectuals."
44,The Evolution of Strategy: Thinking War From Antiquity to the Present; The Strategy Makers: Thoughts on War and Society From Machiavelli to Clausewitz,https://www.foreignaffairs.com/reviews/capsule-review/2011-01-01/evolution-strategy-thinking-war-antiquity-present-strategy-makers,The Evolution of Strategy: Thinking War From Antiquity to the Present; The Strategy Makers: Thoughts on War and Society From Machiavelli to Clausewitz,"Heuser's history of strategic theory and practice demonstrates extraordinary range, erudition, intelligence, and insight. She appears to have read everything, in many languages, about attempts to apply armed force effectively. The Evolution of Strategy will be the first port of call for those wanting to check up on the development of land strategy in the eighteenth century, maritime strategy in the nineteenth century, nuclear strategy in the twentieth century, or counterinsurgency strategy in the twenty-first century. She charts the continuing quest for reliable, even scientific, principles to guide the conduct of war and notes recurring themes, such as attempts to bridge the gap between war and ethics and the problems of translating battlefield victories into lasting peace. The book's great strength lies in the breadth of its author's reading. By paying attention not only to the broader political and cultural context but also to the writings of practitioners and some of the more secondary theorists, Heuser is able to show which ideas took root and why."
45,The Diffusion of Military Power: Causes and Consequences for International Politics,https://www.foreignaffairs.com/reviews/capsule-review/2011-01-01/diffusion-military-power-causes-and-consequences-international,The Diffusion of Military Power: Causes and Consequences for International Politics,"Horowitz has written a scholarly analysis of why some governments enthusiastically embrace military innovations while others miss out. He identifies two main factors that determine a state's capacity to upgrade: the ability to afford the improvements and the organizational capital to adopt them. Both factors are normally important, but their relevance can vary. To become a nuclear power requires a considerable financial outlay but not much organizational change. Aircraft carrier warfare is both expensive and organizationally demanding. Adopting suicide bombing is a cheap tactic for a terrorist group but requires major organizational changes. Horowitz has successfully built on existing theories of organizational change and military innovation, but he might have made more of strategic considerations, which provide the impetus to spend both financial and organizational capital. His consideration of suicide bombing as a military innovation is imaginative, but his suggestion that the Catholic Provisional Irish Republican Army, which had to beware of Protestant paramilitaries, somehow missed a trick by not adopting this tactic betrays a gap in his research. The book also suffers from the curse of American political science in its occasional use of complex statistics to make unremarkable points."
46,"Sex, Drugs, and Body Counts: The Politics of Numbers in Global Crime and Conflict",https://www.foreignaffairs.com/reviews/capsule-review/2011-01-01/sex-drugs-and-body-counts-politics-numbers-global-crime-and,"Sex, Drugs, and Body Counts: The Politics of Numbers in Global Crime and Conflict","It is nearly impossible to obtain reliable statistics about the human costs of conflict. Yet claims about casualties, in particular, are commonly used to demonstrate the inhumanity of belligerents or the urgent need for international action. Something expressed mathematically sounds more scientific than thoughts expressed in mere words. Andreas and Greenhill's book is not the first to warn of the misuse of statistics of conflict -- and given the deep-rooted nature of the tendency it addresses, it will not be the last -- but it does so comprehensively. The chapters forensically reconstruct the micropolitics of the production of seemingly trustworthy numbers about drug and human trafficking, atrocities, and casualties. When governments are being urged to act (as in Kosovo), the dark numbers get inflated; when they resist action (as in Darfur), they get deflated. The editors argue against the knee-jerk dismissal of all statistical claims, concluding instead that, as human constructs, these claims deserve careful scrutiny."
47,How Wars End: Why We Always Fight the Last Battle,https://www.foreignaffairs.com/reviews/capsule-review/2011-01-01/how-wars-end-why-we-always-fight-last-battle,How Wars End: Why We Always Fight the Last Battle,"The past decade has provided painful confirmation of the truism that it is easier to start wars than conclude them. The U.S. engagements in Afghanistan and Iraq have lasted longer than each of the two world wars, and neither promises anything as satisfying as a clear-cut victory. The classic conclusion of a war, with the enemy surrendering in the wake of the unequivocal defeat of its forces, appears to have given way to messier outcomes, dependent on managing complex political processes. Except that, as Rose points out in his review of 100 years of American experience, successfully ending wars has always involved far more than military victory. Starting with World War I and ending with the Iraq war (and with clear implications for the war in Afghanistan), Rose shows how confused political leaders often are about exactly what they are trying to achieve in the coming peace. This can create the conditions for future wars; there had to be two against Germany and two against Iraq. He also shows how leaders tend to correct for the mistakes of the previous war; in the Gulf War, for example, the goal was to avoid another Vietnam. As Rose is the new editor of this magazine, it is comforting to note that he writes extremely well and knows how to hold a reader's interest while never losing sight of his serious purpose."
48,The Globalization Paradox: Democracy and the Future of the World Economy,https://www.foreignaffairs.com/reviews/capsule-review/2011-01-01/globalization-paradox-democracy-and-future-world-economy,The Globalization Paradox: Democracy and the Future of the World Economy,"In this cogent, well-written book, Rodrik, a Harvard economist, critiques unalloyed globalization enthusiasts, taking aim at their desire to fully liberalize foreign trade and capital movements. While acknowledging that extensive engagement with the world economy can produce higher material standards of living, he worries that the unintended side effects may create unwanted and even unnecessary social distress. He is also offended by the empirical casualness of the arguments sometimes advanced in support of liberalization. There are in fact many paths to development, he argues, and democratic societies should be free to exercise their collective preferences without having the institutional and policy preferences of outsiders thrust upon them. (Nondemocracies should not necessarily be given the same latitude.) Unfortunately, Rodrik does not apply the same scrutiny to how decisions are actually made in democracies -- through, for example, the manipulation of public opinion by elites -- that he does to the arguments concerning different paths to development."
49,Globalization at Risk: Challenges to Finance and Trade,https://www.foreignaffairs.com/reviews/capsule-review/2011-01-01/globalization-risk-challenges-finance-and-trade,Globalization at Risk: Challenges to Finance and Trade,"The economists Hufbauer and Suominen make accessible much scholarly research on the economic effects of globalization in its various dimensions: trade, finance, foreign direct investment, and migration. They find that the balance of evidence strongly supports the claim that globalization has significantly raised standards of living for ordinary people around the world. But globalization, they emphasize, is not automatic; it needs to be nurtured continuously. Reversal is all too possible, especially given the widespread distress and political recrimination that have followed the recent global economic recession. Hufbauer and Suominen identify sources of emerging frictions, such as uncoordinated national climate-change measures, which complicate international trade, and state-owned enterprises and sovereign wealth funds, which complicate international investment. They also recommend policies to maintain globalization, some aimed specifically at the United States (introducing portable health insurance, extending unemployment benefits) and others that require international collaboration (agreeing on new trade rules, enacting greater financial regulation). The book contains many substantive and highly informative footnotes, too, which are worth reading apart from the text."
50,Food Politics: What Everyone Needs to Know,https://www.foreignaffairs.com/reviews/capsule-review/2011-01-01/food-politics-what-everyone-needs-know,Food Politics: What Everyone Needs to Know,"Going well beyond its title, Food Politics addresses key questions about agriculture, including consumers' concerns about food safety, producers' concerns about prices and volatility, and taxpayers' concerns about subsidies. Paarlberg organizes his material around a long list of questions about food policies and practices, such as ""Are genetically engineered foods safe?"" ""Why did food prices rise in 2008?"" and ""How do farm subsidies shape international agricultural trade?"" His answers to these and many other questions are accessible and nuanced."
51,"Diaspora, Development, and Democracy: The Domestic Impact of International Migration From India",https://www.foreignaffairs.com/reviews/capsule-review/2011-01-01/diaspora-development-and-democracy-domestic-impact-international,"Diaspora, Development, and Democracy: The Domestic Impact of International Migration From India","At the beginning of this century, an estimated 175 million people, nearly three percent of the world's population, lived outside their countries of birth, and this number has grown every year. This richly detailed study of Indian emigration reveals how this movement of people affects the countries left behind, with a special focus on the diverse impacts of the Indian diaspora -- an estimated 20 million people -- on the politics, economics, social attitudes, foreign policy, and modernization of India. The rapid growth of remittances from Indian emigrants now exceeds official foreign assistance to the country. But Indian emigrants also send (through letters) or bring (through visits) new attitudes and new ideas based on their international exposure. Some provide overseas anchors for Indian exports or investments; others return to start businesses in India, drawing not only on their experience abroad but at least as much on the self-confidence they have gained through success. Another benefit: emigration by Indian elites, the author argues, helps stabilize India's democracy by giving the disgruntled the option of exit. Loading...Please enable JavaScript for this site to function properly."
52,Banking on the Future: The Fall and Rise of Central Banking,https://www.foreignaffairs.com/reviews/capsule-review/2011-01-01/banking-future-fall-and-rise-central-banking,Banking on the Future: The Fall and Rise of Central Banking,"Davies and Green, two seasoned veterans of the United Kingdom's Financial Services Authority and the Bank of England, review the 2007-8 financial crisis -- and its antecedents -- for lessons in how central banks should be organized, what responsibilities they should be given, and how they should pursue those responsibilities. Not surprisingly, they find that central banks should assume more responsibility for the stability of the financial system, and they are inclined to favor inflation targeting as one method of their doing so. Discussing at length the merits and difficulties involved when central banks adopt a more supervisory role, the book contains noteworthy chapters on the special problems of central banking within Europe and in emerging-market countries, where financial systems are less well developed. Disappointingly, the authors devote little space to the challenges that large and potentially volatile international movements of capital pose for central banks."
53,"The Clash of Ideas in World Politics: Transnational Networks, States, and Regime Change, 1510-2010",https://www.foreignaffairs.com/reviews/capsule-review/2011-01-01/clash-ideas-world-politics-transnational-networks-states-and,"The Clash of Ideas in World Politics: Transnational Networks, States, and Regime Change, 1510-2010","Drawing masterfully on 500 years of international history, Owen reminds readers that the use of military force to change, construct, or preserve foreign regimes is hardly a new phenomenon. By his count, there have been 209 such attempts since 1500. A majority of these had an ideological agenda. Between 1510 and 1700, Catholic and Protestant rulers in central and western Europe used force to aid coreligionists in other countries. Efforts to spread republican regimes, constitutional monarchies, and absolute monarchies were common in Europe and the Americas between 1770 and 1870, whereas most regime-promotion attempts in the twentieth century sought to defend or defeat communism, liberalism, or fascism. Another such struggle continues today in the Muslim world, with secularism arrayed against Islamism. Owen explains that in periods of intensified ideological contestation, rulers have generally believed that ""birds of a feather"" lend one another legitimacy and adopt more consonant foreign policies. He also argues that forcible regime promotion has been an opportunistic strategic weapon -- directed chiefly at unstable or defeated states -- rather than a principled end in itself. The practice, moreover, reinforces the perception that alien ideologies are monolithic and dangerous, creating vicious circles of polarization and interventionism. The historical narratives Owen employs to test this theory are nuanced, illuminating, and a joy to read."
54,"The Fog of Law: Pragmatism, Security, and International Law",https://www.foreignaffairs.com/reviews/capsule-review/2011-01-01/fog-law-pragmatism-security-and-international-law,"The Fog of Law: Pragmatism, Security, and International Law","Glennon has long been an eloquent critic of traditional approaches to international law derived from idealistic, universalistic, and moralistic tenets. About the legality of the U.S. invasion of Iraq, for example, he has advanced a decidedly skeptical view of international law. In this landmark book, Glennon lays out his alternative take. As he sees it, international law is simply what states make of it, and it matters only to the extent that states want it to. Whereas law within states is ultimately upheld through coercion, international law is based on consent: states must choose to abide by the strictures and obligations of international law, and they can just as easily withdraw their consent. In Glennon's hands, international law is shorn of its transcendent characteristics and becomes more like the run-of-the-mill rules and agreements that make up international relations. Indeed, when Glennon turns to the thorny question of law and the use of force, his discussion will look familiar to political scientists who study international institutions, legitimacy, power, and the rational choices of states. In the end, Glennon argues that since the United States is a party to more treaties than any other state, it has a special stake in the continuity and stability of international agreements -- a view the traditional international legal thinkers would surely affirm as well."
