,title1,page_url,title2,first_paragraph
57,Mobilizing for Human Rights: International Law in Domestic Politics,https://www.foreignaffairs.com/reviews/capsule-review/2009-12-19/mobilizing-human-rights-international-law-domestic-politics,Mobilizing for Human Rights: International Law in Domestic Politics,"Over the last half century, the body of international law that enshrined the sovereign independence of states has given way to new legal understandings that obligate governments to protect human rights. But does this emerging framework really constrain states? Simmons says yes, and proceeds to offer an extraordinarily rich and sophisticated argument about why, when, and how. Skeptics argue that governments sign agreements that obligate them to follow principles to which they already adhere or that they can easily ignore. Simmons agrees that governments pick and choose treaties, but over the long term, she sees human rights agreements changing the politics inside countries. They influence legislative agendas, alter political coalitions, and define the terms of acceptable state action. Simmons marshals impressive empirical data to test her argument and to distinguish it from alternative stories, examining the record in areas such as civil rights, the equality of women, and the humane treatment of prisoners. Her pathbreaking book explains much about the relationship between international law and national politics, but it also provides an inspiring glimpse of human progress in action.  Loading...Please enable JavaScript for this site to function properly."
58,The Perils of Global Legalism,https://www.foreignaffairs.com/reviews/capsule-review/2009-12-19/perils-global-legalism,The Perils of Global Legalism,"This book is a spirited attack on ""excessive faith in the efficacy of international law."" Posner focuses on the thinking of American and European legal intellectuals who see international law as normatively good for the world regardless of whether it serves specific state interests. These ""global legalists,"" he claims, have ""long since dropped the conventional view that international law is based on the consent of states; international law transcends the interests of states and holds them in its grasp."" Posner sees global legalism as utopian -- built on unsustainable premises about human nature and the practicality of transferring domestic legal traditions to the international level. Several chapters take an interesting look at the proliferation of international courts and tribunals, arguing that these legal venues have performed better than other international bodies partly because they have limited jurisdictions that can be controlled by states. Posner may be right that international law matters when it serves nation-states' interests. But in a world of shared values and common problems, it should not be surprising that many states want to build global systems of laws and institutions that go beyond his minimalist vision."
59,The Best Defense?,https://www.foreignaffairs.com/articles/2010-01-01/best-defense,The Best Defense?,"After 9/11, U.S. President George W. Bush announced his determination to do whatever was necessary to prevent future terrorist attacks against the United States. Following the lead of several countries that had recently come to similar conclusions after their own bitter experiences -- including India, Israel, Japan, Russia, Spain, and the United Kingdom -- the United States tightened its immigration laws; increased the protection of its borders, ports, and infrastructure; criminalized providing ""material support"" for terrorist groups; and tore down the wall between the intelligence agencies and law enforcement agencies, which had crippled counterterrorist efforts for decades. Washington did not authorize preventive detention, as other countries had, but it used other measures to hold persons against whom criminal charges could not be brought -- thereby preventing terrorist attacks. The U.S. government also led or joined various international efforts aimed at warding off new dangers, such as the Proliferation Security Initiative, through which over 70 states cooperate to interdict the movement of nuclear materials across international borders."
60,The New Population Bomb,https://www.foreignaffairs.com/articles/2010-01-01/new-population-bomb,The New Population Bomb,"Forty-two years ago, the biologist Paul Ehrlich warned in The Population Bomb that mass starvation would strike in the 1970s and 1980s, with the world's population growth outpacing the production of food and other critical resources. Thanks to innovations and efforts such as the ""green revolution"" in farming and the widespread adoption of family planning, Ehrlich's worst fears did not come to pass. In fact, since the 1970s, global economic output has increased and fertility has fallen dramatically, especially in developing countries."
61,Nuclear Disorder,https://www.foreignaffairs.com/articles/pakistan/2010-01-01/nuclear-disorder,Nuclear Disorder,"The global nuclear order today could be as fragile as the global financial order was two years ago, when conventional wisdom declared it to be sound, stable, and resilient. In the aftermath of the 1962 Cuban missile crisis, a confrontation that he thought had one chance in three of ending in nuclear war, U.S. President John F. Kennedy concluded that the nuclear order of the time posed unacceptable risks to mankind. ""I see the possibility in the 1970s of the president of the United States having to face a world in which 15 or 20 or 25 nations may have these weapons,"" he forecast. ""I regard that as the greatest possible danger."" Kennedy's estimate reflected the general expectation that as nations acquired the advanced technological capability to build nuclear weapons, they would do so. Although history did not proceed along that trajectory, Kennedy's warning helped awaken the world to the intolerable dangers of unconstrained nuclear proliferation."
62,An Elegy for Journalism?,https://www.foreignaffairs.com/reviews/elegy-journalism,An Elegy for Journalism?,"The twenty-first century has been a traumatic one for journalism. Changes in how people consume news, combined with the great recession of 2007-9 and the business equivalent of reckless driving by some proprietors (such as the real estate mogul Sam Zell's steering the Tribune Company into bankruptcy), have produced an era that in retrospect will seem, at best, severely chastening and, at worst, catastrophic."
63,The Better Half,https://www.foreignaffairs.com/reviews/review-essay/2010-01-01/better-half,The Better Half,"When U.S. Secretary of State Hillary Clinton toured Africa in August 2009, she went out of her way to meet with women's groups -- female farmers in Kenya, rape victims in the Democratic Republic of the Congo, microfinance entrepreneurs across the continent. In South Africa, she spent twice as long visiting a women's housing project near Cape Town as she did meeting with the country's president, Jacob Zuma. Some quietly sniped that Clinton was devaluing her office by meeting with so many grass-roots female activists; others applauded the fact that a U.S. secretary of state had made women's rights a critical foreign policy issue. Clinton defended her agenda, noting that such attention serves to ""change the priorities"" of governments."
64,From Hope to Audacity,https://www.foreignaffairs.com/united-states/hope-audacity,From Hope to Audacity,"The foreign policy of U.S. President Barack Obama can be assessed most usefully in two parts: first, his goals and decision-making system and, second, his policies and their implementation. Although one can speak with some confidence about the former, the latter is still an unfolding process."
