,title1,page_url,title2,first_paragraph
0,Securing Justice in Kenya,https://www.foreignaffairs.com/articles/africa/2011-01-01/securing-justice-kenya,Securing Justice in Kenya,To the Editor:
1,The Case for Treatment,https://www.foreignaffairs.com/articles/africa/2011-01-01/case-treatment,The Case for Treatment,To the Editor:
2,Legalize It,https://www.foreignaffairs.com/articles/north-america/2011-01-01/legalize-it,Legalize It,To the Editor:
3,Talking To Hamas,https://www.foreignaffairs.com/articles/middle-east/2011-01-01/talking-hamas,Talking To Hamas,"Daniel Byman (""How to Handle Hamas,"" September/October 2010) correctly argues that peace between Israel and the Palestinians via a two-state solution requires the involvement and acceptance of Hamas. However, he overstates the difficulty of securing Hamas' agreement to a cease-fire and understates the problem of gaining Israel's agreement. Moreover, although Byman acknowledges the importance of Palestinian reconciliation, he does not identify a key reason for its failure."
4,Culture Matters,https://www.foreignaffairs.com/articles/americas/2011-01-01/culture-matters,Culture Matters,"Nearly two centuries after the countries of Latin America gained their independence from Spain and Portugal, not one of them is truly developed. Where have they gone wrong? Why have countries in other regions, once far behind, managed to achieve relatively quickly results that Latin American countries have aspired to for so long?"
5,Museveni's Uganda: Paradoxes of Power in a Hybrid Regime; The Lord's Resistance Army: Myth and Reality,https://www.foreignaffairs.com/reviews/capsule-review/2011-01-01/musevenis-uganda-paradoxes-power-hybrid-regime-lords-resistance,Museveni’s Uganda: Paradoxes of Power in a Hybrid Regime; The Lord’s Resistance Army: Myth and Reality,"After he came to power in 1986, Ugandan President Yoweri Museveni was hailed by the Washington establishment as part of Africa's ""new breed"" of leaders for his ability to restore stability to Uganda and achieve both political liberalization and economic growth. But his reputation has slowly eroded. As Tripp makes clear in her thoughtful study of the regime, the real, if limited, democratic progress of the 1990s has stagnated and in some cases been reversed. The government has committed serious human rights abuses, intimidated the press and the opposition, and become increasingly corrupt. Her most interesting argument is that Uganda's economic success and increases in foreign aid lessened the incentives for the regime to implement the political reforms it had promised. Instead, like many other African governments, it has sustained itself in an uneasy equilibrium of semiauthoritarian rule -- a hybrid that combines the trappings of democracy, such as regular multiparty elections and a tolerated opposition, with regular abuses of power to emasculate that opposition and ensure the regime's hold on power."
6,Successes in African Agriculture: Lessons for the Future,https://www.foreignaffairs.com/reviews/capsule-review/2011-01-01/successes-african-agriculture-lessons-future,Successes in African Agriculture: Lessons for the Future,"Per capita food production has declined across Africa for most of the postcolonial period, and exporters of cash crops have lost market share to Asian producers. These failures matter because a majority of Africa's poor still derive their incomes from agriculture. As the editors of this collection of insightful essays note, foreign aid to African agriculture has been cut in half since the early 1990s, the victim of changing donor fashions, and African governments too often neglect the needs of small-scale agriculture. Given the pervasive sense of failure in the sector, the book's novel approach is to examine success stories -- the introduction of improved varieties of cassava in central Africa and maize in southern and eastern Africa, cotton production in Mali, and the horticultural export booms in Côte d'Ivoire and Kenya. In each case, the authors credit agricultural research, technological breakthroughs, and incentives that increased productivity. In a sense, these insights are nothing new, which raises the question of why funding for African agricultural research has remained so woefully inadequate."
7,Pirate State: Inside Somalia's Terrorism at Sea,https://www.foreignaffairs.com/reviews/capsule-review/2011-01-01/pirate-state-inside-somalias-terrorism-sea,Pirate State: Inside Somalia’s Terrorism at Sea,"In the aftermath of the collapse of Somalia's central government in the early 1990s, the country has been engulfed in economic decay, lawlessness, and violence, as warlords compete for control of the few remaining sources of revenue. For a long time, these developments remained a local story that did not interest the Western public, but the combination of rising Muslim fundamentalism in the area and the emergence of piracy in the busy shipping lanes of the Gulf of Aden changed that. The attempt by Somali pirates to highjack the U.S. ship the Maersk Alabama in 2009 was featured prominently on cable news and introduced the Somalia problem to the American public. Eichstaedt's book tries to respond to this new interest, with a breezy account that, despite its often melodramatic prose and occasional lack of careful analysis, is often informative. Somali fishermen, he argues, turned to piracy when they found foreign fleets taking advantage of Somalia's anarchy to fish directly off the coast. The fishermen reacted to the challenge by holding passing ships for ransom. A journalist, Eichstaedt is most readable when he describes the way piracy is organized. The loosely structured and ill-disciplined small networks of young men that initially characterized Somali piracy have been overtaken by Somali warlords, including members of the Islamic fundamentalist militia al Shabab."
8,Famine and Foreigners: Ethiopia Since Live Aid,https://www.foreignaffairs.com/reviews/capsule-review/2011-01-01/famine-and-foreigners-ethiopia-live-aid,Famine and Foreigners: Ethiopia Since Live Aid,"Ethiopia's economy is one of the fastest growing in the world, even though Ethiopia remains one of the poorest countries in the world. Its strongman prime minister, Meles Zenawi, is a darling of the West, and his country is now one of the world's largest recipients of aid, taking in some $3 billion a year. Gill, in his sympathetic account of Ethiopia's last three decades, largely ignores broad economic trends and rarely mentions statistics, instead structuring his narrative around the country's recurrent droughts and famines and the international community's efforts to help avert future catastrophes. He has crisscrossed the country since the mid-1980s, and his book includes compelling vignettes of Ethiopians doing their best to improve desperate conditions and of donor organizations grappling with the country's complexities. Gill's account of the Meles government is generally positive, although his tone is never explicitly judgmental. A thoughtful chapter on the failed elections of 2005 makes clear the repressive nature of the regime, but it also seems to take seriously the government's view of greater democratization as a dangerous frivolity."
9,Living With the Dragon: How the American Public Views the Rise of China,https://www.foreignaffairs.com/reviews/capsule-review/2011-01-01/living-dragon-how-american-public-views-rise-china,Living With the Dragon: How the American Public Views the Rise of China,"Public opinion provides U.S. policymakers with what the scholar Daniel Yankelovich called the ""boundaries of the permissible."" Page and Xie argue that these boundaries -- they call them ""dikes"" -- help account for Washington's basically stable China policy from Richard Nixon to Barack Obama. Americans give primacy to security and then economic concerns, wanting to pursue goals related to human rights and democratic transformation only to the extent that doing so is not too costly. ""Caricatures of an ignorant American public,"" Page and Xie conclude, "". . . have been grossly exaggerated."" Indeed, Americans have generally articulated more stable and moderate policy-relevant views of China than has Washington discourse. The U.S. public has consistently supported engagement, economic cooperation, and leadership exchanges. Cooperative by inclination, Americans are paying close attention to whether or not China becomes more reassuring as its power grows. ""Most Americans,"" Page and Xie write, ""are prepared to live peacefully and cooperatively with the Chinese dragon."" Living With the Dragon has multiple virtues: clearly stated conclusions, balance, voluminous data crisply presented, and policy relevance."
10,In Defense of Japan: From the Market to the Military in Space Policy,https://www.foreignaffairs.com/reviews/capsule-review/2011-01-01/defense-japan-market-military-space-policy,In Defense of Japan: From the Market to the Military in Space Policy,"In a shift little noticed outside professional military circles, in the last decade Japan has quietly developed a suite of cutting-edge military space technologies -- rockets, satellites, and spacecraft -- that were originally designed for commercial applications. The subject of this book is highly technical: the list of acronyms is 14 pages long, and some passages are hard going for a nonspecialist. But the bottom line is clear enough: Japan's capabilities are widely underestimated, all the more so in space. The strategic logic for Japan's space program is obvious, with a growing naval, space, and nuclear power across the East China Sea and a second nuclear power even closer, on the Korean Peninsula. The emphasis of In Defense of Japan, however, is on the industries that pushed military applications when they could not make money from commercial projects. Today, in addition to ballistic missile defense capabilities developed in cooperation with the United States, Japan is working on reusable launch vehicles (that is, space planes); satellites that detect missiles and help with navigation, communication, and targeting; warhead reentry technologies that can advance the use of missiles in warfare; unmanned aerial vehicles; and technologies for ""space situational awareness,"" which reveal a concern about possible future conflict in space. It is too soon to count Japan out in the arms race in Asia."
11,"Nucleus and Nation: Scientists, International Networks, and Power in India",https://www.foreignaffairs.com/reviews/capsule-review/2011-01-01/nucleus-and-nation-scientists-international-networks-and-power,"Nucleus and Nation: Scientists, International Networks, and Power in India","Anderson explores the untold stories of the 30 or so key scientists behind the Indian nuclear program, from its roots in the formation of an Indian scientific community in the 1920s, through the exploration of peaceful uses of nuclear energy in the late 1940s, to the decision to explore designing a bomb after the first Chinese nuclear test in 1964, and then to the first Indian explosion in 1974. The fruit of nearly 50 years of research and interviewing, the detailed narrative brings the men to life with personal details and a rich understanding of the historical and institutional context. The key figures are physicists such as Homi Bhabha, a multi-talented member of the extended Tata family and first chair of India's Atomic Energy Commission, and his successor, Vikram Sarabhai. Feuding and politicking as scientists do, this elite built up institutes, recruited young scientists, imported equipment and uranium, maintained ties with a global network of peers, and gained the support of wealthy businesspeople and political leaders, especially Prime Ministers Jawaharlal Nehru and Indira Gandhi. Most of the expertise, equipment, and material needed to build a bomb circulated more or less normally in the scientific community. Taking the next step required only a political decision: once made, cosmopolitan men carried out a nationalist project."
12,"Changing Media, Changing China",https://www.foreignaffairs.com/reviews/capsule-review/2011-01-01/changing-media-changing-china,"Changing Media, Changing China","The commercialization of media, the professionalization of journalism, and the rise of the Internet are usually seen as forces that challenge party control in China. But this collection of essays shows that they can also strengthen the regime. As media grow more diverse and professional, they provide a more credible channel for government propaganda. As they compete for audience attention by exposing selected scandals that are not placed off-limits by censors, they help the higher-level authorities rein in corrupt local officials. And by giving voice to citizens' concerns, they allow the government to respond before problems become acute. To be sure, these factors also raise the risk that fast-spreading news might provide a focal point for mass mobilization at a moment of crisis. But so far, the Internet police and Propaganda Department censors have managed to keep most citizens ignorant of topics that might inflame serious opposition. The Chinese and foreign contributors to this book provide a nuanced, clear analysis of the fluid relationship among the Communist Party, the media, and the public."
13,When a Billion Chinese Jump: How China Will Save Mankind -- or Destroy It,https://www.foreignaffairs.com/reviews/capsule-review/2011-01-01/when-billion-chinese-jump-how-china-will-save-mankind-or-destroy,When a Billion Chinese Jump: How China Will Save Mankind -- or Destroy It,"As The Guardian's environmental correspondent in Asia, Watts has traveled all over China to report on the myriad ways in which development there is ruining the environment -- through the accumulation of rubbish, the extermination of wildlife, the damming and diversion of rivers, the electrocution of fish, the confiscation and poisoning of farmland, the acidification of rain, and the dumping of wastewater into rivers and lakes. A lot of the dross dumped in China is effluent from factories producing for Western markets or garbage sent back from the West. Well-meaning government regulation is too weak to counter the pent-up lust for wealth. China may be ahead of the West when it comes to renewable energy and ""green"" buildings, but these advances are still in their nonage. By portraying the yin of pollution along with the yang of economic dynamism, the book renders a broad-gauge picture of China today. The country contributes in many ways to global warming -- through deforestation, overgrazing, wasteful consumption, and, of course, emitting carbon in the manufacturing process. The subtitle may exaggerate -- China by itself will neither destroy mankind nor save it -- but the book brings home how the environmental impact of China's growth affects everyone."
14,Behind the Killing Fields: A Khmer Rouge Leader and One of His Victims,https://www.foreignaffairs.com/reviews/capsule-review/2011-01-01/behind-killing-fields-khmer-rouge-leader-and-one-his-victims,Behind the Killing Fields: A Khmer Rouge Leader and One of His Victims,"This book recounts the never-before-told story of ""Brother Number Two,"" Nuon Chea, who, at age 84, awaits trial for the crimes he committed during the Cambodian auto-genocide of the late 1970s. It details the growth and ideology of the Khmer Rouge movement, the dynamics among its leaders, and its tortured relations with Vietnam. Having spent six years conducting about a thousand hours of interviews, the authors have produced a rare look inside the psyche of a mass killer. They find a faithful son and loyal husband, an idealist, ascetic, and moral purist who blames the Cambodian people for being too corrupted by imperialism and capitalism to implement the pure-minded plans of the Angka (""organization""). Nuon Chea insists that the two million who died were Vietnamese agents, exploiters, wreckers, enemies of the revolution, and hidden traitors -- as well as a few killed by honest mistakes in the course of trying to renovate Khmer society and others who died because local cadres incorrectly implemented the leaders' guidelines. None of it was his fault. This important story -- told with a restraint that makes it all the more effective -- confirms the banality of evil."
15,The ETIM: China's Islamic Militants and the Global Terrorist Threat; The Uyghurs: Strangers in Their Own Land.,https://www.foreignaffairs.com/reviews/capsule-review/2011-01-01/etim-chinas-islamic-militants-and-global-terrorist-threat-uyghurs,The ETIM: China’s Islamic Militants and the Global Terrorist Threat; The Uyghurs: Strangers in Their Own Land.,"Among the many Uighur organizations that the Chinese government labels as terrorist is one that the U.S. government placed on its own terrorist blacklist after 9/11: the East Turkistan Islamic Movement (ETIM). Some analysts viewed that listing as a grant of U.S. support for Chinese repression in exchange for help in the war on terrorism. The counterterrorism analysts Reed and Raschke review the open-source evidence (much of it from China) that they believe shows ETIM to be a true terrorist force, with an ideology that is both separatist and fundamentalist. They track its changing names, logos, and leaders and locate it in the context of other Uighur militant groups. They make a strong case that although it is small and has not accomplished much, the organization practices terror."
16,The Berlin-Baghdad Express: The Ottoman Empire and Germany's Bid for World Power,https://www.foreignaffairs.com/reviews/capsule-review/2011-01-01/berlin-baghdad-express-ottoman-empire-and-germanys-bid-world,The Berlin-Baghdad Express: The Ottoman Empire and Germany’s Bid for World Power,"This is the story of Germany's plans to bring the Ottomans into World War I and then to play the jihad card against the Allies, which held most of the Muslim world in colonial thrall. It is good, old-fashioned history as biography. Kaiser Wilhelm II, the mercurial archaeologist Max von Oppenheim, and ""the Three Pashas,"" Cemal, Enver, and Talat, loom large. But many others -- friends, foes, and would-be Muslim recruits to jihad -- are also well delineated. In telling the story of the Central Powers' less-than-successful recruitment of locals, from Libya to Arabia to Afghanistan, McMeekin demonstrates the fragility of this jihadist dream. And his accounts of the victory over the Allies at Gallipoli and the failure to complete the Berlin-Baghdad rail line nail down the greater importance of military skill and geopolitical givens in determining outcomes. A secondary theme is Germany's contradictory flirtation with Zionism, which McMeekin returns to in his epilogue, ""The Strange Death of German Zionism and the Nazi-Muslim Connection."""
17,The Israel-Palestine Conflict: Contested Histories,https://www.foreignaffairs.com/reviews/capsule-review/2011-01-01/israel-palestine-conflict-contested-histories,The Israel-Palestine Conflict: Contested Histories,"For more than three decades, Caplan has been producing meticulous studies of different periods of the Israeli-Palestinian conflict. In this book, he goes beyond the basic chronological narrative to analyze the self-images and images of the other that the Israelis and the Palestinians have brought to their long-standing confrontation. In such ""contested histories,"" each party sees itself as an innocent victim; Israel views itself as the product of a noble national movement, whereas the Palestinians think of it as an egregious example of colonialism. After attemping to define the conflict -- addressing ""loaded terminology,"" periodization,"" and ""core arguments"" -- Caplan recounts the confrontation from the rise of Zionism and the early stirrings of Arabism to today. He also discusses Israel's ""new historians"" and the understandably more muted historical revisionism from the Palestinian side -- and reflects on the need to transcend ""nationalist"" history. A whopping 28-page bibliography and a chronology complete what is surely one of the most accessible, coherent, and balanced accounts available of this very contested history."
18,A Privilege to Die: Inside Hezbollah's Legions and Their Endless War Against Israel,https://www.foreignaffairs.com/reviews/capsule-review/2011-01-01/privilege-die-inside-hezbollahs-legions-and-their-endless-war,A Privilege to Die: Inside Hezbollah’s Legions and Their Endless War Against Israel,"In the summer of 2006, Israel launched a devastating incursion into Lebanon that badly mauled, but failed to knock out, Hezbollah. In the last days of 2008 and early 2009, Israel moved with equal fury against Hamas in Gaza, in a short war that Hezbollah opted to stay out of. Cambanis' intimate account of this recent history, enhanced by stories of a handful of Hezbollah's true believers and sympathizers, paints a gripping portrait of this radical religio-political movement. In an often discursive, largely first-person narrative, Cambanis presents an impressive organization, bearing the awesome title ""Party of God,"" that is virtually a state within the state of Lebanon. Hezbollah provides social services. Its leaders live modestly and level with their followers, thereby earning the group tactical flexibility. Hezbollah proudly acknowledges receiving support from Iran and Syria and would be weaker without it, but the group is too deeply rooted in Lebanon to be the tool of any outsider. Cambanis stresses equally Hezbollah's radical militancy, which makes a more accommodating arrangement within Lebanon or vis-à-vis Israel unlikely to emerge. Indeed, a depressing theme of A Privilege to Die is the way that less organized, less fervent, and more corrupt moderates have lost out to radicals since the 1970s."
19,America's Misadventures in the Middle East,https://www.foreignaffairs.com/reviews/capsule-review/2011-01-01/americas-misadventures-middle-east,America’s Misadventures in the Middle East,"An award-winning career diplomat, Freeman was U.S. ambassador to Saudi Arabia at the time of the Gulf War. Retiring from the Foreign Service in 1994, he remained no less involved in international affairs, being active in the U.S. Institute of Peace and the Middle East Policy Council, among others. A seemingly ideal candidate for a return to government service, Freeman was asked to serve as chair of the National Intelligence Council in early 2009 but faced a campaign that forced him to withdraw his name. From the charges against him and those making them, it is clear that he was deemed too close to Saudi Arabia and too far from Israel. This collection of 23 short papers and speeches produced from the late 1990s to 2010 puts the lie to such charges and demonstrates instead a broad-ranging critique of recent U.S. foreign policy in the Middle East. Freeman's is a foreign policy of national interests, not friends or favorites. He is prudent about seeking monsters to destroy (or bringing the blessings of democracy) and believes that any military intervention must have in place an adequate postconflict policy. He argues that an acceptable settlement between Israel and its Arab neighbors is a priority and that Washington needs to work with Arab states. Loading...Please enable JavaScript for this site to function properly."
20,"The Sixth Crisis: Iran, Israel, America, and the Rumors of War",https://www.foreignaffairs.com/reviews/capsule-review/2011-01-01/sixth-crisis-iran-israel-america-and-rumors-war,"The Sixth Crisis: Iran, Israel, America, and the Rumors of War","As Iran, disclaiming an intention to build a bomb, seemingly moves toward a nuclear capability and Israel states that this will be unacceptable, the United States tries to halt Iran's nuclear program and forestall Israeli military action. This three-way confrontation is even more complicated. Any settlement or military action must involve other countries, including European states, Russia, China, and Arab states that fear Iran's expanding power but are reluctant to line up with Israel, which is seen as suffocating the Palestinians. In the midst of this ticking-bomb crisis, Allin and Simon have organized all these complexities and produced a readable, short book that fairly presents the positions of all involved, evokes the historical context, details the intertwining of domestic politics with the ongoing international crisis, and even takes on what might be dubbed ""the psychology of leadership"" in the final chapter, ""Obama's Words."" Not only is the book the best description available of ""the sixth crisis"" that Washington has faced in the Middle East since World War II; it also suggests a U.S. policy: given the likely failure to reach a negotiated settlement, a regional variant of the Cold War containment policy might be the best default position."
