,title1,page_url,title2,first_paragraph
21,"Realism, Tolerance, and Liberalism in the Czech National Awakening: Legacies of the Bohemian Reformation",https://www.foreignaffairs.com/reviews/capsule-review/2011-01-01/realism-tolerance-and-liberalism-czech-national-awakening,"Realism, Tolerance, and Liberalism in the Czech National Awakening: Legacies of the Bohemian Reformation","This book is a meticulous history; the footnotes are two-thirds the length of the text. In locating the wellsprings of modern national consciousness in the Czech Republic, and by extension its liberal political culture, David credits the ideas of the Bohemian Reformation in the fifteenth century, which were resuscitated and embraced during the Austro-Bohemian Catholic Enlightenment in the eighteenth century. More precisely, he traces the intellectual impulses inspiring the ""national awakening"" in the late eighteenth to early nineteenth century to the liberal, tolerant, and ""nonaristocratic"" thought characteristic of the Bohemian Catholic Church set up by the followers of the theologian Jan Hus in the sixteenth century. In a long-standing historical debate, David lines up against those who focus less on the lineage of ideas and more on linguistic-ethnic particularities and the sociology of identity associated with German Romanticism and idealism. But he is not only uncovering the roots of Czech political culture; he is also following an important stage in the development of analytic philosophy. Hence, the reader needs to be prepared to follow the fundamental philosophical quarrel that the early-nineteenth-century Czech scholar Bernhard Bolzano had with Immanuel Kant, Johann Gottlieb Fichte, Friedrich Wilhelm Joseph von Schelling, and, above all, Georg Wilhelm Friedrich Hegel."
22,Lonely Power,https://www.foreignaffairs.com/reviews/capsule-review/2011-01-01/lonely-power,Lonely Power,"Long one of Russia's premier political analysts, Shevtsova has grown sharper and more charged as Russia has edged deeper into the Putin era. The country's self-seeking power elite has ""used the West in order to save an anti-Western system,"" and many in Russia and the West who should know better have either wittingly or unwittingly played along. She calls Russia's system ""bureaucratic capitalism"" spliced to ""imitation democracy,"" created by ""personalized power"" in the Yeltsin era and taken to its warped extreme in Vladimir Putin's. She applies her sensitive fingertip feel less to the country's deadened political pulse than to the system's interior dynamic, which she fears is unpredictable and imperiled by a regime that generates self-serving ambitions while blocking essential answers. Most of all, however, the book is a poignant appeal to the policymakers and analysts who have, as the Russian expression goes, ""looked through their fingers"" as Russia has passed from one lost opportunity to another. She identifies with those experts who have been most critical of her country, but when it comes to action, she aligns herself with those who want to engage Russia and give it constructive options, provided strict conditions are attached."
23,Twilight of Impunity: The War Crimes Trial of Slobodan Milosevic,https://www.foreignaffairs.com/reviews/capsule-review/2011-01-01/twilight-impunity-war-crimes-trial-slobodan-milosevic,Twilight of Impunity: The War Crimes Trial of Slobodan Milosevic,"Armatta, a lawyer, journalist, human rights activist, and expert on the Balkans, sat through three years of excruciating testimony in The Hague for the first trial of a head of state since Admiral Karl Dönitz at Nuremburg -- the trial of Slobodan Milosevic for 66 counts of war crimes, crimes against humanity, and genocide. By her own confession, she was scarcely an impartial observer, having witnessed much of what served as the basis for the charges, but she provides more than a fair analysis of the proceedings' fumblings and ill-advised decisions. Hers is the front-row view of a first-rate court reporter, giving the reader a TiVo-like version, culled of dead space and repetition, that is still exhausting in its arduous pace and detail. Diligently, she watched and recorded as the court probed all three charges from Kosovo, back through the Croatian and Bosnian wars, tediously piling up the evidence as Milosevic bobbed and weaved. One comes away half heartened by the effort to answer unspeakable cruelty and suffering with justice but, in a way, more saddened by Milosevic's slippery success in persuading his partisans and many of his countrymen that they, not he, were on trial, the victims of great power bullies. And then there is the whimper with which it was all ended, by a heart attack that left him prosecuted but unjudged."
24,Building States and Markets After Communism: The Perils of Polarized Democracy,https://www.foreignaffairs.com/reviews/capsule-review/2011-01-01/building-states-and-markets-after-communism-perils-polarized,Building States and Markets After Communism: The Perils of Polarized Democracy,"Frye brings a particularly rigorous approach to explaining the speed and constancy of postsocialist economic reform and the creation of state institutions conducive to it. Count him among those who see the state -- at least a state capable of efficient regulation -- as crucial to the development of a proper market. Particularly in democratic and semidemocratic settings, he finds that the degree of partisan discord between the executive and legislative branches of government to be the decisive factor. Democratic states blessed with little partisanship make reforms more rapidly and consistently; as partisanship increases, reform suffers. Frye reaches this simple but original proposition through exceedingly painstaking argumentation -- first by establishing a statistical correlation between political polarization and its seeming effects, next by using a survey of business attitudes in 23 countries to establish causal links, and then by rounding out the analysis with a finely textured comparison of outcomes in Bulgaria, Poland, Russia, and Uzbekistan."
25,The Victims Return: Survivors of the Gulag After Stalin,https://www.foreignaffairs.com/reviews/capsule-review/2011-01-01/victims-return-survivors-gulag-after-stalin,The Victims Return: Survivors of the Gulag After Stalin,"Most nonfiction books are written from a sense of intellectual challenge; this one is written as much from a sense of duty. Over more than 35 years, since he first met Nikolai Bukharin's widow, Anna Larina, Cohen has developed a deep relationship with the widows and offspring of many of the gulag's celebrated and uncelebrated victims. By interviewing them, reading their memoirs, and digging through secret police archives, he collected material for a book he first planned to write in 1983. It tells the story of how survivors experienced liberation, what happened when they reentered society, and how, with varying degrees of success, they came to terms with what they had suffered. Misery was common, but, as Cohen stresses, its meaning and effects varied widely from individual to individual. This is not the thick, detailed book he originally intended to write, and it is all the better for that. It is also all the better for the graceful, pellucid writing."
26,The Return: Russia's Journey From Gorbachev to Medvedev,https://www.foreignaffairs.com/reviews/capsule-review/2011-01-01/return-russias-journey-gorbachev-medvedev,The Return: Russia’s Journey From Gorbachev to Medvedev,"The ""return"" of this book's title is of Russia and its people to the world. Treisman argues that in crossing the rocky road of the last 25 years, Russia has emerged from the hermitic life of socialism to join in the normal process of international politics and Russians have joined the modern scramble of global travel, communications, and consumption. In a breezy and elegant account of these years, he tackles big questions: Why did Mikhail Gorbachev's reforms fail? Why did the Soviet Union collapse? What accounts for the dramatic twists and turns marking Russian politics from Gorbachev to Dmitry Medvedev? The common thread running through the answers to all these questions is economic trends -- particularly, economic decline. Economic changes, often affected by policy choices, eroded (or sometimes boosted) each regime's popular legitimacy and thus dictated the way each leader chose to play his hand. Other factors were also at work, including how the United States behaved toward Russia. All of this Treisman brings together by staying clear of abstractions and working with a rich assemblage of concrete, fascinating detail."
27,"""Cuba-Estados Unidos: Tan lejos, tan cerca,"" Special issue, Temas, April-September 2010",https://www.foreignaffairs.com/reviews/capsule-review/2011-01-01/cuba-estados-unidos-tan-lejos-tan-cerca-special-issue-temas-april,"“Cuba-Estados Unidos: Tan lejos, tan cerca,” Special issue, Temas, April-September 2010","The appearance of this collection of essays in the prestigious Cuban quarterly Temas is itself a small signal that Havana is ready for modest steps toward rapprochement with Washington. The common message of the Cuban, U.S., and Canadian contributors is that both the United States and Cuba bear some responsibility for the decades of tensions and that although neither society is prepared for sudden full normalization, there is much room for mutually advantageous cooperation. Indeed, despite the hostile atmosphere, the two contending states' bureaucracies are already working together on a range of specific matters. The brilliant essay by Temas editor Rafael Hernández, although rooted in a historically informed pessimism, nevertheless proposes enhanced bilateral interactions that, he asserts, need not compromise Cuba's national sovereignty (read: the hegemony of the Cuban Communist Party), a theme echoed by the former senior diplomat Carlos Alzugaray Treto in another essay. Similarly, the economist Jorge Mario Sánchez Egozcue outlines an enticing agenda for future exchanges in the biotechnology, telecommunications, and energy sectors. Hal Klepak, a Canadian, persuasively argues that Washington's and Havana's security establishments -- seeking regional stability -- are agents driving bilateral détente. Harvard's Jorge Domínguez ponders the potential implications for Cuba's internal evolution. (An English translation of the collection, titled Debating U.S.-Cuban Relations, is now available.)"
28,Electing Chávez: The Business of Anti-neoliberal Politics in Venezuela,https://www.foreignaffairs.com/reviews/capsule-review/2011-01-01/electing-chavez-business-anti-neoliberal-politics-venezuela,Electing Chávez: The Business of Anti-neoliberal Politics in Venezuela,"The firebrand Hugo Chávez was elected president of Venezuela in 1998, when oil prices were low and Venezuela's population was steeply rising. This meant that there were millions of dissatisfied and disorganized poor people -- a ready constituency for an antiestablishment soldier like him. Gates argues that the business class threw more fuel into this volatile mixture, contributing to its own demise in two ways. First, business had become closely associated with ineffective governments widely perceived as corrupt, so voters rejected traditional candidates. (Gates does not judge whether these media-generated perceptions were accurate.) Second, ""outlier"" business owners, opportunistically seeking future access to a likely winner, betrayed their class and funded Chávez's campaign. So it not just the rejection of free-market ""neoliberal"" policies that elevated Chávez to power; it was also popular perceptions of business corruption and internal divisions among the business elite."
29,The Eastern Stars: How Baseball Changed the Dominican Town of San Pedro de Macorís,https://www.foreignaffairs.com/reviews/capsule-review/2011-01-01/eastern-stars-how-baseball-changed-dominican-town-san-pedro-de,The Eastern Stars: How Baseball Changed the Dominican Town of San Pedro de Macorís,"The author of charming, best-selling books on cod and salt, the incurably curious Kurlansky asks in this book, How is it that a small, impoverished Dominican town produced 79 Major League Baseball players between 1962 and 2008? (The list includes the Hall of Fame pitcher Juan Marichal, the slugger Sammy Sosa, and the rising star of the New York Yankees Robinson Cano.) The answer begins with sugar: the long off-season allowed plenty of time for sports, and the sugar mills sponsored baseball teams. The children could only afford baseballs made of rolled up socks, which have an uneven trajectory, a replacement that turned out to be excellent training for aspiring hitters. Then the Dominican Republic got its big break: the Cuban Revolution shut down the flow of Cuban players, driving baseball scouts to San Pedro de Macorís. Now, the industry tradition is deeply engrained: the Dominican Republic has a high-quality winter league, an organized array of baseball academies and stadiums, and leading baseball families (such as the Alous and the Canos). Today, Dominican players account for about one-quarter of all minor leaguers -- and that excludes New Yorkers of Dominican origin, such as Alex Rodriguez."
30,Even Silence Has an End: My Six Years of Captivity in the Colombian Jungle,https://www.foreignaffairs.com/reviews/capsule-review/2011-01-01/even-silence-has-end-my-six-years-captivity-colombian-jungle,Even Silence Has an End: My Six Years of Captivity in the Colombian Jungle,"In February 2002, Betancourt, a senator running for president of Colombia, was kidnapped by the Revolutionary Armed Forces of Colombia, or FARC. A dual Colombian-French national, she is feted in France as a courageous activist who took great risks in the pursuit of peace but provokes controversy in Colombia. Was her kidnapping the result of her government's purposeful security lapses or a consequence of her own reckless political grandstanding? In captivity, did Betancourt behave with undaunted dignity, as she asserts, or did she take advantage of her celebrity to gain privileged treatment, as other hostages have alleged? Surprisingly, in this memoir, her politics come off as somewhat superficial; her allegiances, unstable. Looking back on her six and a half years of torment, she makes a virtue of ambiguity: ""I have become a complex being. . . . I am torn between opposing emotions. . . . I can accept my inconsistencies without worrying about other people."" And her assertions, à la Nelson Mandela, that she has exorcised the urge for revenge and seeks only Christian love do not quite ring true. Nevertheless, the book succeeds as an intimate confessional memoir. It is a moving exploration of self-discipline and resilience on the part of captives and captors battling to survive, in body and soul, under the most extreme conditions."
31,The New Brazil,https://www.foreignaffairs.com/reviews/capsule-review/2011-01-01/new-brazil,The New Brazil,"For the corporate executive facing his or her first long flight to São Paulo, here is the perfect briefing book. A seasoned student of Brazilian politics, Roett swiftly and expertly reviews the country's Portuguese past, twentieth-century strife, and more recent triumphs. Without ignoring Brazil's many remaining challenges, Roett views the glass as more than half full. He is confident that the continental giant of 190 million citizens is finally on the path to democratic prosperity, regional leadership, and global influence. Especially admirable are Roett's assessments of the successful presidencies of Fernando Henrique Cardoso and Luiz Inácio Lula da Silva; the four-page concluding chapter is a gem of tight historical interpretation. Roett is a fan of Brazilian foreign policy -- ""tough but pragmatic"" -- even as he criticizes Brazil's failed policies toward Honduras and Iran. But he probably underplays the anti-U.S. currents in the Brazilian Foreign Ministry and its tendency in international policy forums to prefer clever maneuvers to constructive contributions. In that immaturity, Brazil has company from China, India, and Russia, all emerging-market economies that must learn that with power comes responsibility."
32,Italy Today: The Sick Man of Europe,https://www.foreignaffairs.com/reviews/capsule-review/2011-01-01/italy-today-sick-man-europe,Italy Today: The Sick Man of Europe,"The scandals, speeches, sex, and partisan scheming of Italian political life have always grabbed media attention. Yet the central question of Italian politics often goes unasked: How did the most successful country in postwar Europe become a basket case? In 1987, with much fanfare, Italy's per capita income overtook that of the United Kingdom; in 20 years, if current trends continue, it will be overtaken by Romania's. The interdisciplinary group of authors in this collection sets aside short-term factors and explores long-term structural reasons for Italia malata (ailing Italy). They offer new insights into well-known problems: the poor productivity of small firms, a lethargic legal system, weak universities, rampant corruption, the absence of meritocratic advancement, and the continued underdevelopment of the south. They also highlight problems known only to experts: little government support for families, the spread of organized crime outside of Naples and Sicily, low levels of social trust, and anti-immigrant sentiment."
33,1939: Countdown to War,https://www.foreignaffairs.com/reviews/capsule-review/2011-01-01/1939-countdown-war,1939: Countdown to War,"Overy argues that ""nothing in history is inevitable"" -- not even the outbreak of World War II. This concise, clearheaded text seeks to prove the point by describing 11 days in 1939, from August 24, when the Nazi-Soviet Pact was signed, to September 3, when France and the United Kingdom declared war on Germany. With events and information moving faster than they could be processed and decision-makers suffering from exhaustion and stress, both sides acted with ""growing irrationality."" Hitler believed the assurances of Joachim von Ribbentrop, his foreign minister, that the French and British were bluffing, and so expected to prevail quickly against the Poles alone. French and British leaders sought to redeem their ""national honour"" by extending a guarantee to Poland and deterring Hitler, and so gave little thought to how that guarantee might have to be honored in practice. Overy's narrow focus willfully obscures the legacy of World War I, Hitler's unbounded ambitions, the failed strategy of appeasement, and other complex causes that perhaps made war inevitable. Still, it makes for provocative reading."
34,The European Union and Democracy Promotion: A Critical Global Assessment,https://www.foreignaffairs.com/reviews/capsule-review/2011-01-01/european-union-and-democracy-promotion-critical-global-assessment,The European Union and Democracy Promotion: A Critical Global Assessment,"Some consider Europe's democracy-promotion policies to be a model for the world. Others consider the EU's efforts -- and perhaps all such policies -- ineffective. This slim volume is the newest among many assessments of Europe's attempts to promote good governance, human rights, and democracy. Even if the book lacks rigor in establishing comparative standards and metrics, it is informed by scholarly literature and provides useful case studies of EU efforts in Iraq, Morocco, Ukraine, and elsewhere. The result is sobering. Local domestic political structures, geostrategic concerns, and energy policy tightly constrain European policymakers. They have to be pragmatic, accepting the inherently limited and secondary role of any international intervention. Europe tends to compromise, the book suggests, by focusing on improving governance at the expense of improving democracy."
35,Facts Are Subversive: Political Writing From a Decade Without a Name,https://www.foreignaffairs.com/reviews/capsule-review/2011-01-01/facts-are-subversive-political-writing-decade-without-name,Facts Are Subversive: Political Writing From a Decade Without a Name,"Oxford's Garton Ash is no dusty don producing authoritative tomes grounded in archival sources, statistical charts, or revisionist reinterpretations of the past. His virtues are journalistic -- most notably, a brilliant eye for spotting a memorable detail in an exotic locale -- yet his vision is broader than most reporters or columnists. He knows his history and literature, and he combines reportage with passionate political commitment. To be sure, these 48 short essays published over the last decade indulge some journalistic vices. They were written in the moment, and some have thus been overtaken by events: there are ruminations over the proper response to weapons that Iraq did not have, criticisms of an ""Enlightenment fundamentalism"" that Garton Ash now admits is illusory, and confident predictions about the spread of Ukraine's Orange Revolution that never came true. Moreover, the essays are selective, focusing on flashy subjects that make for engaging interviews: heroic revolutionaries, sordid politicians, and exotic nationalists. Economic interests and electoral calculation, the bland bread and butter of modern politics, play little role. Still, one would like to think this is how history is lived, and the result is engaging. These vignettes are highly recommended for those who cannot wait for the proverbial owl of Minerva to spread its wings."
36,A Journey: My Political Life,https://www.foreignaffairs.com/reviews/capsule-review/2011-01-01/journey-my-political-life,A Journey: My Political Life,"This book is nearly unique among modern political memoirs in that the author is said to have written it. The resulting prose is at best cloying and chatty, at worst cliché-ridden and convoluted. It recounts few political events that recent British memoirs have not already described. On Iraq it is evasive. Yet it is worth the read because it reveals, better than any book of its kind, how modern politics really works. To judge from Blair's frank and surprisingly cynical admissions, politicians are often ignorant, scared, and burdened by the past. Their environment is hostile, as illustrated by Blair's blunt asides on the small-mindedness of nongovernmental organizations, the hypocrisy of the Tory opposition, and the antagonistic incompetence of his buddy Gordon Brown. To achieve anything, leaders must corner electoral opponents with clever rhetoric that manipulates, even misleads, the public. In the end, many historically important matters are decided on little more than gut instinct and personal morality. No one can win at this game forever. This helps explain why a man who entered office with the reputation of being an instinctive politico, able to read the public mind with uncanny clarity, ended up -- for all his achievements -- a deeply disliked public figure."
37,Bloodlands: Europe Between Hitler and Stalin,https://www.foreignaffairs.com/reviews/capsule-review/2011-01-01/bloodlands-europe-between-hitler-and-stalin,Bloodlands: Europe Between Hitler and Stalin,"This magisterial work chronicles in horrifying detail the mass murder of civilians by the Soviet Union and Nazi Germany from 1930 to 1945 in the ""bloodlands"" that lay between them: Poland, the Baltic republics, Belarus, and the Ukraine. Snyder's account is engaging, encyclopedic --  and controversial. Whereas many accord Hitler more blame than Stalin for such atrocities, Snyder treats the two as comparable. The numbers are similar. Hitler is customarily thought of as pioneering systematic extermination, but Stalin predates him by nearly a decade. German concentration camps are often referred to as a uniquely calculated, even ""industrial,"" form of butchery. Yet camps account for only a few million of the 14 million deliberate and systematic civilian deaths carried out by the two countries. Most victims of both governments were shot or driven into the wilds to die of starvation and disease. Many still insist that Stalin, believing that communist transformation would falter in the face of opposition from national minorities and rich kulaks, espoused more pragmatic views than his maniacal German counterpart. Yet Hitler was just as results-oriented, believing that military victory and fascist rule would elude Germany unless minorities were eliminated. For Snyder, what mattered most in the end was the commonality that both leaders sacrificed millions to grandiose totalitarian projects."
