,title1,page_url,title2,first_paragraph
55,In War's Wake: International Conflict and the Fate of Liberal Democracy,https://www.foreignaffairs.com/reviews/capsule-review/2011-01-01/wars-wake-international-conflict-and-fate-liberal-democracy,In War’s Wake: International Conflict and the Fate of Liberal Democracy,"The most profound effects of war are often felt far from the battlefield. In the mobilization for war and in its aftermath, states have expanded government powers, extended voting rights, reorganized political coalitions, and in many other ways transformed the very character of the state. This groundbreaking book brings together distinguished academics who explore the ways that the wars of the last two centuries have affected democracy. Scholars have long noted that major wars tend to cause states to expand political participation -- that the demands of raising mass armies during World War I and World War II, for example, resulted in new voting rights and social welfare provisions. Some authors here confirm this view, but the book as a whole tends to find more complex and uncertain linkages between war and democracy. One author shows that the conscription of mass citizen armies leads to more political participation within warring societies, whereas voluntary professional armies tend to have the opposite effect. Another finds that the growth of intrusive policing authority and government secrecy is tied more to domestic threats to political order than to international conflict. Several chapters focus on the bigger picture -- whether war has an impact on the very emergence of democracy. Edward Mansfield and Jack Snyder find no direct causal connection, but others see instances in which defeat bolstered democratic forces. Miguel Centeno raises perhaps the most ominous point: that the new type of war -- the ""war on terror"" -- has none of the democracy-enhancing effects of the mass-army sort. Instead, it reinforces the segregation of the military from the rest of society and undermines civil liberties."
56,"The New Dynamics of Multilateralism: Diplomacy, International Organizations, and Global Governance",https://www.foreignaffairs.com/reviews/capsule-review/2011-01-01/new-dynamics-multilateralism-diplomacy-international,"The New Dynamics of Multilateralism: Diplomacy, International Organizations, and Global Governance","More than ever before, states conduct their business -- economic, political, security -- in or around multilateral forums. Institutions such as the United Nations, the World Trade Organization, and NATO are not only locations where states can negotiate but also repositories of widely shared rules and norms. Drawing on the views of scholars and practitioners, this study tracks the way multilateralism has moved beyond the state system to include nonstate actors and an expanding array of issues. Several of the chapters outline the deep shifts in thinking about anarchy and order, arguing that multilateralism is increasingly a value-laden norm about the virtues of rule-based global governance. Other chapters look at the actual operation of multilateral systems of rules, as states grapple with rogue regimes, nuclear proliferation, economic crises, and human rights abuses. The book's most interesting theme is that multilateralism -- as a form of organization -- has evolved from its origins as a set of principles for the conduct of diplomacy among sovereign states into a set of tools used to gain some control over a dangerously ungovernable world that exists beyond the state system."
57,A Leaner and Meaner Defense,https://www.foreignaffairs.com/articles/united-states/2010-01-01/leaner-and-meaner-defense,A Leaner and Meaner Defense,"The United States faces a watershed moment: it must decide whether to increase its already massive debt in order to continue being the world's sheriff or restrain its military missions and focus on economic recovery. Military power has dominated the United States' global engagement over the last decade, but it is now clear that the country overreached. Americans are questioning whether pursuing a defense strategy focused on counterinsurgency and nation building, supported by a defense budget that is growing continuously, makes sense at a time of severe economic and fiscal challenges. As the Obama administration enters the second half of its term and a new Congress assembles, the U.S. government must make difficult choices about which defense missions to undertake, exercise restraint in defense planning and budgeting, and bring tough management practices to the Pentagon."
58,Great Powers and Strategic Stability in the Twenty-first Century: Competing Visions of World Order,https://www.foreignaffairs.com/reviews/great-powers-and-strategic-stability-twenty-first-century-competing-visions-world-order,Great Powers and Strategic Stability in the Twenty-first Century: Competing Visions of World Order,"There is widespread agreement that the world is moving from unipolarity to a multipolar system, in which a handful of great powers will hold sway. What is debated is whether this return to multipolarity will be peaceful. This collection of essays does not give a clear answer, but the authors do provide a useful survey of the geopolitical landscape. Several of them explore the security threats and functional challenges that will be the focus of great-power politics in the years to come, including terrorism, nuclear proliferation, and energy security. Others look at the grand strategies of rising powers such as China, India, and Russia. The volume highlights the tension at the heart of twenty-first-century-style multipolarity. On the one hand, power and authority will be more decentralized and the inevitable struggles for influence between the United States and emerging non-Western powers will make cooperation more difficult. On the other hand, the challenges that the great powers will confront in the coming decades will be problems of interdependence, such as the environment and weapons proliferation, and so will require intensified cooperation."
59,Women and States: Norms and Hierarchies in International Society,https://www.foreignaffairs.com/reviews/capsule-review/2011-01-01/women-and-states-norms-and-hierarchies-international-society,Women and States: Norms and Hierarchies in International Society,"Ever since the suffrage movement in the early twentieth century, governments around the world have enacted far-reaching reforms that have brought women into political life -- as voters, officials, and politicians. This fascinating book explores the logic of these historic changes, focusing on three advancements: women's suffrage, government bureaus mandated to address women's issues, and, more recently, gender quotas for national legislatures. In detailed empirical chapters, Towns untangles the complex ways in which states have adopted new practices. They have done so in ""waves"" of legislation among ""clusters"" of states. Women's suffrage, for example, first broke through in small western U.S. states and then spread to the rest of North America and western Europe; this was followed by movements in eastern Europe and Latin America, which then moved into Africa and Asia after states in those regions gained national independence. These patterns, Towns argues, reveal much about how states compare, rank, and compete with one another and how sudden shifts in notions of legitimacy can trigger transnational social movements."
60,Sudan's Secession Crisis,https://www.foreignaffairs.com/articles/east-africa/2011-01-01/sudans-secession-crisis,Sudan’s Secession Crisis,"Under the Comprehensive Peace Agreement, the 2005 deal that ended the lengthy civil war between the north and the south of Sudan, voters in the south are supposed to vote on January 9, 2011, to decide whether their region should secede and form the world's newest country. The civil war, which lasted 22 years and during which an estimated 2.5 million southerners died, was fought over several issues: the central government's long-standing neglect of Sudan's periphery; the excessive concentration of jobs, wealth, and public services in the region known as the Arab triangle, along the northern part of the Nile River valley; the government's brutal attempts to impose Arab culture and Islam on the south, where Christianity and traditional religions prevail; its persistent refusal to grant the south any autonomy (except for a brief period in the 1970s); and its exploitation of the south's resources, particularly its oil, to fill government coffers. The Comprehensive Peace Agreement, which was signed by Omar al-Bashir, the president of Sudan, and John Garang, the leader of the southern rebellion, who was killed in a helicopter crash soon after the deal, was intended to correct some of these problems. It gave the south its own semiautonomous government and an independent standing army and required the upcoming referendum on secession. But now Khartoum's stalling tactics are threatening to delay the vote, with potentially disastrous consequences."
61,The Softer Side of War,https://www.foreignaffairs.com/reviews/review-essay/2011-01-01/softer-side-war,The Softer Side of War,"When U.S. forces invaded Iraq in 2003, the U.S. military was not particularly concerned about the impact of culture on its operations. U.S. leaders believed that the assault would play out as a high-tech conventional conflict and would be followed by a stabilization effort only slightly more difficult than the one U.S. troops had encountered in Kosovo a few years before. As the commander of the U.S. Army's First Brigade, First Armored Division, in Baghdad during the first crucial year after the fall of Saddam Hussein's regime, I quickly discovered not only that this assumption was incorrect but also that sectarian and ethnic identities, the role of tribes in Iraqi society, and the U.S. Army's own internal culture would weigh heavily on the course of the conflict, influence our approach to waging the war, and impact our interactions with our coalition allies."
62,Why the Rich Are Getting Richer,https://www.foreignaffairs.com/reviews/review-essay/2011-01-01/why-rich-are-getting-richer,Why the Rich Are Getting Richer,"The U.S. economy appears to be coming apart at the seams. Unemployment remains at nearly ten percent, the highest level in almost 30 years; foreclosures have forced millions of Americans out of their homes; and real incomes have fallen faster and further than at any time since the Great Depression. Many of those laid off fear that the jobs they have lost—the secure, often unionized, industrial jobs that provided wealth, security, and opportunity—will never return. They are probably right."
63,Enforcing the Peace,https://www.foreignaffairs.com/articles/israel/2011-01-01/enforcing-peace,Enforcing the Peace,"In late August and September 2010, when direct negotiations seemed at last on the verge of replacing proximity talks between the Israelis and the Palestinians, speculation ran high in the Obama administration that face-to-face meetings between the two negotiating teams, hosted by U.S. Secretary of State Hillary Clinton, could at last produce an accord of enduring substance. Among several veterans of Middle East diplomacy, Martin Indyk, a former U.S. ambassador to Israel, was explicit in his optimism that the breakthrough moment was at hand, writing in The New York Times that ""the negotiating environment is better suited to peacemaking today than it has been at any point in the last decade."" In view of Israel's on-and-off settlement construction in the West Bank, however, and the frequent postponements of the Israeli-Palestinian dialogue, it is fair to ask if such optimism is really warranted."
64,Why Moscow Says No,https://www.foreignaffairs.com/articles/russia-fsu/2011-01-01/why-moscow-says-no,Why Moscow Says No,"Russia's international behavior during the last decade has puzzled many U.S. observers. As seen from Washington, the greatest challenges of the moment—terrorism, nuclear proliferation, climate change—are global ones that threaten all states. The United States has been trying to organize multilateral responses. Yet the Kremlin has proved singularly unhelpful. For years, Russian negotiators have stalled efforts to compel Iran and North Korea to give up their nuclear weapons programs. Meanwhile, Moscow has applied economic and diplomatic pressure to keep nearby states from joining NATO or letting U.S. troops use their bases to fight the Taliban in Afghanistan. And in August 2008, Russia invaded Georgia and effectively detached two mountain enclaves from its territory."
65,"Small Arms, Big Problems",https://www.foreignaffairs.com/articles/south-asia/2010-01-01/small-arms-big-problems,"Small Arms, Big Problems","In late 2001, in the early days of the war in Afghanistan, Western military planners worried about two types of dated weapons that were the legacies of the Soviet-Afghan war: shoulder-fired antiaircraft missiles and land mines. The United States had provided anti-Soviet forces with Stinger missiles in the 1980s, and the prospect that the Taliban or al Qaeda might have retained these weapons fueled fears that they would use them against Western military aircraft or, more menacingly, against commercial passenger jets worldwide. Land mines inspired a different but just as persistent unease: even after U.S. and Afghan forces chased the Taliban from Kabul, how could a country said to be littered with millions of mines develop at any kind of hopeful pace?"
66,The Good News About Gas,https://www.foreignaffairs.com/world/good-news-about-gas,The Good News About Gas,"Good news about energy is rare. Energy use and its cost are rising worldwide, most countries remain dependent on oil imports, and little progress has been made toward curbing climate change. So the world should take notice of the recent dramatic increase in estimates of unconventional sources of natural gas in North America and elsewhere, perhaps the greatest shift in energy-reserve estimates in the last half century. In the past few years, thanks to technological advances, vast amounts of natural gas -- particularly gas trapped in underground shale basins -- have become economically viable."
67,The Political Power of Social Media,https://www.foreignaffairs.com/political-power-social-media,The Political Power of Social Media,"On January 17, 2001, during the impeachment trial of Philippine President Joseph Estrada, loyalists in the Philippine Congress voted to set aside key evidence against him. Less than two hours after the decision was announced, thousands of Filipinos, angry that their corrupt president might be let off the hook, converged on Epifanio de los Santos Avenue, a major crossroads in Manila. The protest was arranged, in part, by forwarded text messages reading, ""Go 2 EDSA. Wear blk."" The crowd quickly swelled, and in the next few days, over a million people arrived, choking traffic in downtown Manila."
68,West Is Best?,https://www.foreignaffairs.com/reviews/review-essay/2010-12-16/west-best,West Is Best?,"In the 1940s, Joseph Needham, a British academic, began cataloging China's achievements in science and technology in an effort to understand why they were inferior to the West's. In his 40 years of study, he found that even though China may have seemed behind in such achievements at the moment, it had led the world in science a millennium before. He concluded that Confucianism and Taoism made a Chinese scientific revolution less likely because they allowed for only slow, incremental innovation, rather than overnight breakthroughs. Still, he recognized that this was only a partial explanation. Religions are not fixed, and if China's loss of scientific leadership stemmed from its religious attitudes, then what could account for the emergence and persistence of those attitudes?"
69,Less Than Zero,https://www.foreignaffairs.com/world/less-zero-0,Less Than Zero,"Once again, a global movement is afoot to free the world of nuclear weapons. Unlike the Easter marches of the 1950s and 1960s or the nuclear freeze movement of the 1980s, however, this time around, the policy elites themselves are leading the charge. The list of supporters of Global Zero, the new campaign's flagship organization, reads like a Who's Who of international strategy: from Zbigniew Brzezinski and Lawrence Eagleburger to Strobe Talbott and Philip Zelikow, from Carl Bildt and Hans-Dietrich Genscher to Igor Ivanov and David Owen."
70,Finish the Job,https://www.foreignaffairs.com/articles/afghanistan/2010-12-13/finish-job,Finish the Job,"Pessimism abounds in Afghanistan. Violence, NATO casualties, corruption, drug production, and public disapproval in the United States are at record levels. Ahmed Rashid, a prominent Pakistani journalist and an expert on the region, declared the U.S. mission in Afghanistan a failure in his scathing 2008 book, Descent Into Chaos. Seth Jones, the leading U.S. scholar on the Taliban insurgency, has argued that the United States had an opening to make a difference in Afghanistan after 2001, but that it ""squandered this extraordinary opportunity."" U.S. Secretary of Defense Robert Gates attempted to manage expectations when he testified before the Senate Armed Services Committee in January 2009. ""If we set ourselves the objective of creating some sort of Central Asian Valhalla over there, we will lose,"" he argued, ""because nobody in the world has that kind of time, patience, and money."" U.S. policymakers and the public increasingly doubt that the war can be won. These assessments are based on real and credible concerns about the rising insurgency, the drug trade, endemic corruption, and perennial government weakness."
71,Plan B in Afghanistan,https://www.foreignaffairs.com/articles/afghanistan/2010-12-13/plan-b-afghanistan,Plan B in Afghanistan,"Current U.S. policy toward Afghanistan involves spending scores of billions of dollars and suffering several hundred allied deaths annually to prevent the Afghan Taliban from controlling the Afghan Pashtun homeland -- with little end in sight. Those who ask for more time for the existing strategy to succeed often fail to spell out what they think the odds are that it will work in the next few years, what amount of casualties and resources they think the attempt is worth, and why. That calculus suggests that it is time to shift to Plan B."
72,A Third Way to Palestine,https://www.foreignaffairs.com/articles/israel/2010-12-16/third-way-palestine,A Third Way to Palestine,"This past September, as Palestinian President Mahmoud Abbas and Israeli Prime Minister Benjamin Netanyahu sat down in Washington to dine with U.S. President Barack Obama, a barely noticed event took place in Ramallah. With little fanfare, the 13th Palestinian Authority (PA) government, headed by Salam Fayyad, issued its one-year countdown to independence. This brief and understated document is likely to prove far more significant for the future of Palestine than the White House dinner and reflects nothing short of a revolutionary new approach to Palestinian statehood."
