,title1,page_url,title2,first_paragraph
23,Negotiating With Iran: Wrestling the Ghosts of History,https://www.foreignaffairs.com/reviews/capsule-review/2009-12-19/negotiating-iran-wrestling-ghosts-history,Negotiating With Iran: Wrestling the Ghosts of History,"Using four crises spread over four decades, from just after World War II to the 1980s, Limbert appraises the negotiating style of Iran and of those it confronts. The 1945-47 Azerbaijan crisis pitted Iran against the Soviet Union, with the United States playing a limited role. The 1951-53 oil nationalization crisis and the overthrow of Iranian Prime Minister Mohammad Mosaddeq marked the moment the United States replaced the United Kingdom as the dominant Western power in Iran. The last two crises -- the 1979-81 Iranian hostage crisis and the U.S. effort throughout the 1980s to free Americans held hostage in Lebanon -- were bilateral confrontations between Washington and Tehran. Drawing on these four cases and more, Limbert offers advice on negotiating with Iran and addresses the need to overcome ""mutual myth-perceptions"" in U.S.-Iranian relations. Now serving as a senior official on Iran in the State Department, Limbert was one of those held hostage in Tehran from 1979 to 1981. Yet as this splendid study of U.S.-Iranian relations demonstrates, he emerged from that bitter experience with an ability to bring to his appraisal a rare combination of insight, dispassion, and empathy. Loading...Please enable JavaScript for this site to function properly."
24,"Israel and Palestine: Reappraisals, Revisions, Refutations",https://www.foreignaffairs.com/reviews/capsule-review/2009-12-19/israel-and-palestine-reappraisals-revisions-refutations,"Israel and Palestine: Reappraisals, Revisions, Refutations","This collection of 30 articles by Shlaim that have appeared over the past two decades in journals such as the London Review of Books and the Journal of Palestine Studies ranges chronologically from the Balfour Declaration of 1917 to the present and topically from individuals to governments and from wars to peace processes. That many of the articles are book reviews gives the book the bonus of also offering a historiographical survey. Shlaim, a pioneer of the revisionist school of ""new historians"" that emerged in the 1980s, provides a realpolitik reading of the history, demolishing the heroic and innocent image of Israel in its relations with the Palestinians. In his accounting, up to the June 1967 war, Israel acted much like other struggling new nations -- no better, no worse. After 1967, Israel became a colonialist power occupying others and steadily taking over their lands. The Israeli side of the story (viewed critically) is dominant in most of the articles, but"
25,The Arabs: A History,https://www.foreignaffairs.com/reviews/capsule-review/2009-12-19/arabs-history,The Arabs: A History,"The title of this big book evokes memories of Philip Hitti's History of the Arabs, which first appeared 82 years ago, and Albert Hourani's A History of the Arab Peoples, which was published in 1991. But whereas Hitti and Hourani traced Arab history from earliest times, Rogan tackles a mere half millennium. His is the story of Ottoman rule throughout Arab lands from early in the"
26,Hijacked Justice: Dealing With the Past in the Balkans,https://www.foreignaffairs.com/reviews/capsule-review/2009-12-19/hijacked-justice-dealing-past-balkans,Hijacked Justice: Dealing With the Past in the Balkans,"How the blood-soaked states that emerged from the horrors that befell the Balkans in the 1990s should go about reconciling victims, punishing victimizers, and coming to terms with their pasts has become a sad challenge in the post-Cold War world. Alas, Subotic argues, the progress made in moving from an-eye-for-an-eye politics to due process in international and national courts and truth commissions is deceptive. It turns out, as her Serbian, Croatian, and Bosnian cases show, that local political actors, rather than dealing with history, have used the exercise for their own more immediate ends: to dispose of political opponents, secure economic assistance, or grease the way into the European Union. How this has happened and what those committed to making the new norms stick should do about it drive this book. Subotic goes about her study in an exceedingly clearheaded fashion; not only is she in full command of the relevant theoretical literature, but she deploys and then extends it in compact, crystal-clear paragraphs. The writing and argumentation are a model of what social science should be.Loading...Please enable JavaScript for this site to function properly."
27,Lenin’s Brother: The Origins of the October Revolution,https://www.foreignaffairs.com/reviews/capsule-review/2009-12-19/lenins-brother-origins-october-revolution,Lenin’s Brother: The Origins of the October Revolution,"Lenin's older brother, Alexander Ulyanov, is only a footnote in history. Hence, this book's subtitle seems an overly large claim. Pomper justifies it in a dual sense: Ulyanov's political and intellectual milieu contained important antecedents of the movement to follow, and his life's twisted tragic-heroic turn heavily shaped Lenin's personal psychology. In March 1887, on a date timed to mark the successful assassination of Tsar Alexander II six years earlier, Ulyanov and 14 others plotted the same fate for Tsar Alexander III. They never got to throw their bombs at the target, and Ulyanov was hanged two months later. The psychological reading that Pomper renders -- that Lenin, in some significant degree, made the revolution to avenge what the tsarist regime had done to his brother and his family -- may not be entirely convincing in the absence of direct testimony from Lenin or those who knew him. But the canvas that Pomper so richly fills with the details of Ulyanov's precocious teenage intellectual interests and his path from a preoccupation with zoology to revolution and, ultimately, to terrorism makes for very engaging reading.Loading...Please enable JavaScript for this site to function properly."
28,Children of Armenia: A Forgotten Genocide and the Century-Long Struggle for Justice,https://www.foreignaffairs.com/reviews/capsule-review/2009-12-19/children-armenia-forgotten-genocide-and-century-long-struggle,Children of Armenia: A Forgotten Genocide and the Century-Long Struggle for Justice,"Much has been written about the deportation and slaughter of the Armenians by the Ottomans in 1915, but much less has been written about what followed in the years after -- which is odd given that the event is so deeply seared into the memories of Armenians everywhere and remains an immense burden on modern Armenian-Turkish relations. At every turn, Bobelian argues, from the post-World War I peace to the failure of the U.S. Congress to pass genocide resolutions in the 1990s, the Armenian cause has fallen victim to broken Western promises and been sacrificed to the priorities of others. He carefully unwinds three entwined threads, starting with the hopes for an independent homeland that were dissolved when Armenia was absorbed into Soviet Russia. The second thread emerges from the 1920s onward, when Atatürk's Turkey made denial of the episode an element of the country's emergent nationalism. The third thread is the quest to have the events of 1915 recognized as genocide, efforts that have been thwarted by U.S. administrations concerned with protecting relations with a NATO ally. Loading...Please enable JavaScript for this site to function properly."
29,Russia and the Arabs: Behind the Scenes in the Middle East From the Cold War to the Present,https://www.foreignaffairs.com/reviews/capsule-review/2009-12-19/russia-and-arabs-behind-scenes-middle-east-cold-war-present,Russia and the Arabs: Behind the Scenes in the Middle East From the Cold War to the Present,"No living Russian knows more about Soviet and Russian policy in the Middle East than Primakov, and none has known more key figures from the region better. From his days as a Pravda correspondent in Cairo in the mid-1960s through his time as Russian foreign minister and then prime minister in the 1990s -- a career stretching from Leonid Brezhnev to Vladimir Putin -- he has been personally involved in every major Middle Eastern event, from the wars of 1967 and 1973 to the U.S. invasion of Iraq in 2003, and in between the turmoil in Lebanon, Sudan, and Yemen. He has interviewed and negotiated with every major Middle Eastern leader, from Syria's Hafez al-Assad to Iraq's Saddam Hussein. Much of the book is, indeed, ""behind the scenes,"" as he lets the reader in on his conversations with Yassir Arafat (whom he admired), Golda Meir (he led secret negotiations with the Israelis from 1971 to 1977), Saddam, and many others. But he also inserts these accounts into thoughtful reflections on the sources of the Arab-Israeli conflict, Arab nationalism, the failure of communism in the Middle East, and the many missed opportunities to break the cycle of violence."
30,Trotsky: Downfall of a Revolutionary; Trotsky: A Biography,https://www.foreignaffairs.com/reviews/capsule-review/2009-12-19/trotsky-downfall-revolutionary-trotsky-biography,Trotsky: Downfall of a Revolutionary; Trotsky: A Biography,"In the recent profusion of books on Stalin's Soviet Union, Leon Trotsky has seemed almost forgotten, but now along come two new biographies -- one a full-life study, the other a detailed tale of his Mexican exile. To a large degree, the same man emerges from both: in each account, he is a figure more of fascination than admiration -- quite in contrast to earlier biographies written by his devotees. He is a compelling crowd rouser but remote and cold personally, puritanical but more than a little lascivious, and the object of fervid political devotion yet ruthless in the pursuit of his compassionless notion of revolution. Service deals with Trotsky's life from boyhood to the end but concentrates on the critical period from his days as a youthful revolutionary and foe of Bolshevism through the 1920s and the dramatic arc from his ascendancy to his defeat. The writing is trim and unadorned, allowing Service to march expeditiously over new ground: Trotsky's early political affinity with Stalin, the smug self-confidence that worked against him in the post-1923 maneuvering, and his moments of striking political insight, which were matched by those of disastrous misjudgment."
31,Consolidating Mexico’s Democracy: The 2006 Presidential Campaign in Comparative Perspective,https://www.foreignaffairs.com/reviews/capsule-review/2009-12-19/consolidating-mexicos-democracy-2006-presidential-campaign,Consolidating Mexico’s Democracy: The 2006 Presidential Campaign in Comparative Perspective,"Political-campaign junkies will relish this numbers-rich review of the last Mexican presidential election, in which the conservative candidate, Felipe Calderón, overcame the early lead of the populist Andrés Manuel López Obrador, to the great relief of Washington. Leading U.S. and Mexican political scientists, with National Science Foundation funding, ran a series of preelection polls whose results provide the fodder for each of the volume's 15 smartly argued essays. Unsurprisingly, the analysts concur that the winner ran a sharper campaign, successfully identifying himself with competence and prosperity while deploying negative advertising to tarnish the image of his opponent. With far-reaching implications, Alberto Diaz-Cayeros, Federico Estevez, and Beatriz Magaloni find that conditional cash transfers to very poor households (requiring that their children attend school) helped the incumbent party; paradoxically, the ""right-wing"" Calderón won as a result of antipoverty programs. The collection's authors dispute the degree to which ideological cleavages continue to divide Mexican voters, even as there is general agreement that the Mexican left faces difficult times ahead. Overall, these top experts paint a reasonably optimistic picture of a gradually maturing Mexican democracy.Loading...Please enable JavaScript for this site to function properly."
32,Feminist Agendas and Democracy in Latin America,https://www.foreignaffairs.com/reviews/capsule-review/2009-12-19/feminist-agendas-and-democracy-latin-america,Feminist Agendas and Democracy in Latin America,"Women's movements in Latin America have recently suffered a certain loss of momentum following their success in obtaining greater legal equality, enlarged political representation, and better social services. This welcome update on the current state of the feminist agenda in the region is full of strong contributions. Marcela Ríos Tobar skillfully describes the enduring contradictions of women's lives in the social democratic Chile of President Michelle Bachelet. Flávia Piovesan explains how Brazilian women leveraged the legitimacy of international institutions -- by successfully appealing to the Organization of American States -- to alter national laws and practices regarding violence within families. Well worth the price of admission is the brilliant concluding chapter, in which Jaquette champions professional women working within their democratic political systems -- to build bridges to government agencies, win legal redress through the courts, and provide life-sustaining social services. ""Feminists must be committed to the institutional means, as well as the utopian ends, of social justice,"" Jaquette soberly declares.Loading...Please enable JavaScript for this site to function properly."
33,Mexico: Narco-Violence and a Failed State?,https://www.foreignaffairs.com/reviews/capsule-review/2009-12-19/mexico-narco-violence-and-failed-state,Mexico: Narco-Violence and a Failed State?,"No, the United States' southern neighbor, with its many sophisticated institutions and complex social networks, is not the next Afghanistan. But as the veteran Mexico watcher Grayson documents in lurid and depressing detail, powerful drug traffickers have corrupted the country's political and law enforcement establishments at all levels. The cartels simply have too much money, and the U.S. government, despite four decades of waging its ""war on drugs,"" has utterly failed to stem the cross-border drug flows and the distribution networks that continuously replenish criminal coffers. Grayson seems to approve of recent U.S. programs transferring equipment and technology to Mexican security forces, and he respects Mexican President Felipe Calderón's bold, forceful counterattacks against the criminal gangs. But Grayson's bottom line is pessimistic: ""It is extremely difficult -- probably impossible -- to eradicate the cartels. They or their offshoots will fight to hold on to an enterprise that yields Croesus-like fortunes."" More out of desperation than desire, Grayson proposes that the United States begin ""thinking about the unthinkable: decriminalization.""Loading...Please enable JavaScript for this site to function properly."
34,"Growing Pains in Latin America: An Economic Growth Framework as Applied to Brazil, Colombia, Costa Rica, Mexico, and Peru",https://www.foreignaffairs.com/reviews/capsule-review/2009-12-19/growing-pains-latin-america-economic-growth-framework-applied,"Growing Pains in Latin America: An Economic Growth Framework as Applied to Brazil, Colombia, Costa Rica, Mexico, and Peru","Latin America's volatile mix of deepening democracy and chronic inequality is a fertile breeding ground for unscrupulous populists. To build a stout analytic framework for the next generation of market-oriented reforms that will secure and continue past progress, the Center for Global Development has pooled the talents of some of the hemisphere's leading social scientists in this cutting-edge synthesis of ""lessons learned."" The contributors seek a reasonable middle ground between simplistic one-size-fits-all prescriptions and a circumstance-specific ""it all depends"" approach, and between a paralyzing laundry list of proposals and a narrowly focused single-constraint diagnosis. The volume singles out five solid foundations for growth: sustained macroeconomic stability, a more equitable sharing of benefits, secure property rights, equal opportunities, and economic and political competition. Sophisticated country chapters explain what must be done to support political constituencies that favor market reform and encourage more rapid, sustainable growth. Tough institutional reforms -- of judiciaries, regulatory bodies, civil-service systems -- feature prominently.Loading...Please enable JavaScript for this site to function properly."
35,The Silence and the Scorpion: The Coup Against Chávez and the Making of Modern Venezuela,https://www.foreignaffairs.com/reviews/capsule-review/2009-12-19/silence-and-scorpion-coup-against-chavez-and-making-modern,The Silence and the Scorpion: The Coup Against Chávez and the Making of Modern Venezuela,"On April 11, 2002, a massive peaceful opposition march in downtown Caracas suddenly veered from its authorized route and headed toward the presidential palace. In response, as Nelson painstakingly documents, government gunmen opened fire. Fearing further bloodshed, the military high command deposed President Hugo Chávez. But the improvised civilian government blundered while key generals vacillated -- allowing Chávez's more decisive military and civilian loyalists to quickly engineer his dramatic return. Nelson's minute-by-minute reporting vividly re-creates the infectious excitement of mass participation, and his well-sketched mini-portraits illuminate the deeper currents of Venezuela's polarized politics. Was the United States involved in the coup? On the contrary, concludes Nelson, the U.S. embassy was caught off-guard and was ineffective -- there was a ""complete lack of U.S. policy toward Venezuela."" Once the smoke cleared, the big winner was Chávez, who rewrote the history of the march as a skirmish between two equally matched groups of armed extremists. He seized the opportunity to purge opponents from the military and the metropolitan police and consolidate his grip over other national institutions.Loading...Please enable JavaScript for this site to function properly."
36,The European Court’s Political Power: Selected Essays,https://www.foreignaffairs.com/reviews/capsule-review/2009-12-19/european-courts-political-power-selected-essays,The European Court’s Political Power: Selected Essays,"Over the last half century, with little or no black-letter mandate, the European Court of Justice has single-handedly asserted the supremacy of European Community law over national law, the right of individuals to invoke European Community law in court, and its own ultimate responsibility to adjudicate that law's meaning. What is surprising is not that the ECJ handed down these decisions but that national courts -- and with them the nation-states of Europe -- assented to them, even though they were often seen as undermining national sovereignty. Alter is a hardheaded political scientist who recognizes the centrality of traditional factors such as economically self-interested litigants and politicians who support integration, yet she is also a keen legal analyst who acknowledges the ways in which lawyers and judges have forged a limited autonomy for the law. No social scientist has done more to probe the reasons why this evolution has occurred as it has.Loading...Please enable JavaScript for this site to function properly."
37,Europe as the Would-Be World Power: The EU at Fifty,https://www.foreignaffairs.com/reviews/capsule-review/2009-12-19/europe-would-be-world-power-eu-fifty,Europe as the Would-Be World Power: The EU at Fifty,"The EU has been a remarkable success in recent years, enlarging to 27 members, establishing a single currency, removing border controls, moving toward a unified foreign policy, and now, finally, ratifying the Treaty of Lisbon. Majone, among the most knowledgeable and insightful analysts of EU regulatory policy, remains unimpressed. The EU, he believes, has become a self-perpetuating Brussels-centered system of elitist governance that privileges further integration over sound policy and democratic representation. The evidence of inadequacy lies in referendum defeats, slower economic growth, tensions within the Eurozone, and the failure to further liberalize regulation. Majone's solution is to renounce the rhetoric of ""ever-closer union"" and encourage issue-specific ""coalitions of the willing"" among EU members -- which might even spark greater regulatory competition. Some will disagree with the diagnosis; others will counter that the EU has already, in practice, renounced ambitious plans in favor of a constitutional settlement akin to what Majone prescribes. No matter what one's view, however, this provocative, sophisticated, and informed book must be confronted.Loading...Please enable JavaScript for this site to function properly."
38,The Narcissism of Minor Differences: How America and Europe Are Alike,https://www.foreignaffairs.com/reviews/capsule-review/2009-12-19/narcissism-minor-differences-how-america-and-europe-are-alike,The Narcissism of Minor Differences: How America and Europe Are Alike,"Whether considering health care, human rights, the death penalty, or government regulation, Americans often look to the ""European social model"" as a point of comparison. Depending on one's partisan predilection, Europe is held up as an example either of just and generous state intervention or of un-American socialism. In this provocative polemic, Baldwin, an economist, claims that the European social model does not exist. In most things, he says, the United States resembles, at least in statistical terms, an average European state. Yet a surprising amount of Baldwin's evidence actually supports the stereotype: the United States has a free-market system with little labor protection, an adversarial legal system, high murder rates and plenty of guns, an enormous prison population, inequitable and expensive health care, and widespread poverty. The book is a must-read nonetheless -- and not just because it is filled with intriguing facts that add nuance to what can often be a black-and-white debate. Baldwin is right to point out that although the distance between the European left and the American right is extreme, the difference between the average positions of Europe and the United States is less than is often believed. Yet he all but ignores that the U.S. government is far less equitable than its European counterparts. It is often surprisingly active in social matters, yet its policies benefit primarily the middle and upper classes. In the end, the old question remains: Why is there no socialism in the United States?Loading...Please enable JavaScript for this site to function properly."
39,Why the Dreyfus Affair Matters,https://www.foreignaffairs.com/reviews/capsule-review/2009-12-19/why-dreyfus-affair-matters,Why the Dreyfus Affair Matters,"L'Affaire Dreyfus was the most widely debated European political event of the generation before World War I. Alfred Dreyfus, a French artillery captain and a Jew, was falsely accused of spying for Germany, for which he spent over four years in solitary confinement on the remote and tropical Devil's Island. To this end, top French military officers forged documents, suppressed information, perverted the military tribunal system, and abused their subordinates. They were backed by right-wing and clerical anti-Dreyfusards, who mobilized anti-Semitic riots, spread nationalist propaganda, marshaled conservative obstruction -- even planned a political assassination. Liberal and socialist Dreyfusards, sparked by Émile Zola's heroic polemic ""J'Accuse,"" supported the innocent man with an ultimately successful press campaign to pressure government officials and civilian courts to intervene. Begley, a lawyer, novelist, and historian, struggles to make it all relevant today. He dwells on anti-Semitism, which is less relevant to Western politics now than then. He invokes analogies to the Iraq war and the George W. Bush administration's policies on human rights, but in an oddly disconnected manner. All this misses the deeper point: the Dreyfus Affair cast the ""red-versus-blue"" mold of much modern politics, pitting conservative nationalists, soldiers, farmers, and religious interests in a partisan ideological battle against liberal journalists, academics, civilian professionals, urbanites, and cosmopolitans. In thousands of political battles -- including those over the Iraq war -- Western publics have relived the Dreyfus Affair ever since.Loading...Please enable JavaScript for this site to function properly."
