,title1,page_url,title2,first_paragraph
0,Banned Aid,https://www.foreignaffairs.com/reviews/review-essay/2010-01-01/banned-aid,Banned Aid,"Dead Aid: Why Aid Is Not Working and How There Is a Better Way for Africa. By Dambisa Moyo. Farrar, Straus & Giroux, 2009, 208 pp. $24.00."
1,The Long Road to Zero,https://www.foreignaffairs.com/united-states/long-road-zero,The Long Road to Zero,"Over the past three years, a remarkable bipartisan consensus has emerged in Washington regarding nuclear security. The new U.S. nuclear agenda includes renewing formal arms control agreements with Russia, revitalizing a strategic dialogue with China, pushing for ratification of the Comprehensive Nuclear Test Ban Treaty, repairing the damaged nuclear nonproliferation regime, and redoubling efforts to reduce and secure fissile material that may be used in weapons. During the 2008 presidential campaign, the veteran foreign policy experts Henry Kissinger, Sam Nunn, William Perry, and George Shultz successfully encouraged both major-party candidates, Barack Obama and John McCain, to embrace the idea of a world free of nuclear weapons. In the past year, President Obama has made this goal a priority for his administration, although he admits that it is not likely to occur in his lifetime."
2,Not So Dire Straits,https://www.foreignaffairs.com/articles/china/2010-01-01/not-so-dire-straits,Not So Dire Straits,"Since 2005, Taiwan and China have been moving into a closer economic and political embrace -- a process that accelerated with the election of the pro-détente politician Ma Ying-jeou as Taiwan's president in 2008. This strengthening of relations presents the United States with its greatest challenge in the Taiwan Strait since 1979, when Washington severed ties with Taipei and established diplomatic relations with Beijing."
3,Against the Grain,https://www.foreignaffairs.com/world/against-grain,Against the Grain,"In the late eighteenth century, the English political economist Thomas Malthus took a look at two sets of numbers and had an unnerving vision: with food supplies increasing arithmetically while the number of people grew geometrically, the world population would eventually run out of food. ""By that law of our nature which makes food necessary to the life of man,"" he wrote in 1798, ""the effects of these two unequal powers must be kept equal. This implies a strong and constantly operating check on population from the difficulty of subsistence. This difficulty must fall some where and must necessarily be severely felt by a large portion of mankind."""
4,A Few Dollars at a Time,https://www.foreignaffairs.com/articles/africa/2010-01-01/few-dollars-time,A Few Dollars at a Time,"Starting in this quarter, hundreds of millions of people will have an unprecedented opportunity to help the world's most unfortunate inhabitants. When purchasing airline tickets through most major reservation Web sites or through a travel agent, consumers will be asked if they want to make a direct contribution to the fight against the world's three deadliest epidemics: HIV/AIDS, malaria, and tuberculosis. Part of a movement called innovative financing, the project is a new kind of aid that could fundamentally change the relationship between the rich and the poor throughout the world, a few dollars at a time."
5,The New Energy Order,https://www.foreignaffairs.com/articles/liechtenstein/2009-12-21/new-energy-order,The New Energy Order,"The last decade has seen an extraordinary shift in expectations for the world energy system. After a long era of excess capacity, since 2001, prices for oil and most energy commodities have risen sharply and become more volatile. Easy-to-tap local fuel supplies have run short, forcing major energy consumers to depend on longer and seemingly more fragile supply chains. Prices have yo-yoed over the last 18 months: first reaching all-time highs, then dropping by two-thirds, and after that rising back up to surprisingly high levels given the continuing weakness of the global economy. The troubles extend far beyond oil. Governments in regions such as Europe worry about insecure supplies of natural gas. India, among others, is poised to depend heavily on coal imports in the coming decades. For these reasons, governments in nearly all the large consuming nations are now besieged by doubts about their energy security like at no time since the oil crises of the 1970s. Meanwhile, the biggest energy suppliers are questioning whether demand is certain enough to justify the big investments needed to develop new capacity. Producers and consumers, each group unsure of the other, cannot agree on how best to finance and manage a more secure energy system."
6,Mind Over Martyr,https://www.foreignaffairs.com/articles/saudi-arabia/2009-12-21/mind-over-martyr,Mind Over Martyr,"Is it possible to deradicalize terrorists and their potential recruits? Saudi Arabia, a pioneer in rehabilitation efforts, claims that it is. Since 2004, more than 4,000 militants have gone through Saudi Arabia's programs, and the graduates have been reintegrated into mainstream society much more successfully than ordinary criminals. Governments elsewhere in the Middle East and throughout Europe and Southeast Asia have launched similar programs for neo-Nazis, far-right militants, narcoterrorists, and Islamist terrorists, encouraging them to abandon their radical ideology or renounce their violent means or both."
7,Thaksin on Trial,https://www.foreignaffairs.com/articles/southeast-asia/2009-12-20/thaksin-trial,Thaksin on Trial,To the Editor:
8,Cooling the Climate,https://www.foreignaffairs.com/articles/commons/2009-12-20/cooling-climate,Cooling the Climate,To the Editor:
9,Bosnia on the Brink?,https://www.foreignaffairs.com/articles/southeastern-europe/2009-12-20/bosnia-brink,Bosnia on the Brink?,To the Editor:
10,Poverty in Africa: Analytical and Policy Perspectives,https://www.foreignaffairs.com/reviews/capsule-review/2009-12-20/poverty-africa-analytical-and-policy-perspectives,Poverty in Africa: Analytical and Policy Perspectives,"This collection of essays by leading development economists provides an excellent introduction to the causes and effects of poverty in sub-Saharan Africa. Although some of the papers are dated, they remain useful. One section of the book includes several contributions about the nature of poverty in the region, with a particularly informative chapter on poverty in the African countryside. Another section questions the conventional wisdom that economic reforms in the 1980s and 1990s aggravated poverty, painting a more nuanced picture. Although poverty in the region worsened during this period, it does not appear to have increased more in countries that implemented reforms than in those that did not. Because the available economic data on Africa are mired by low quality and major gaps, however, the conclusions of several chapters are limited. Loading...Please enable JavaScript for this site to function properly."
11,Legislative Power in Emerging African Democracies,https://www.foreignaffairs.com/reviews/capsule-review/2009-12-20/legislative-power-emerging-african-democracies,Legislative Power in Emerging African Democracies,"Most observers would concur with Barkan's view that democracy cannot thrive without an effective and influential legislature to balance the power of the executive. Since most of the recent defects in governance in Africa can be blamed on unaccountable leaders, this view seems particularly germane to democracy there. Yet, oddly, the evolution and current state of legislatures in Africa have attracted little attention. This collection of case studies of the legislatures in Benin, Ghana, Kenya, Nigeria, South Africa, and Uganda begins to rectify this oversight. Barkan's central empirical thesis is that all over Africa, a young, educated, and professional class of parliamentarians has begun to advance the power of legislatures, pressuring presidents to accept more democratization. As the case studies show, this has meant that legislatures have begun asserting their constitutional prerogatives -- notably, the oversight of government spending and activities. It also appears to have meant that legislators have voted themselves salary increases and other perks, and the experiences of Kenya and Nigeria, for instance, certainly suggest that legislators' commitment to democratic values is uneven at best. The book's real lesson is that the legislative branch can balance the power of the executive branch even when the former's members are not particularly virtuous.Loading...Please enable JavaScript for this site to function properly."
12,The Dynamics of Violence in Central Africa,https://www.foreignaffairs.com/reviews/capsule-review/2009-12-20/dynamics-violence-central-africa,The Dynamics of Violence in Central Africa,"A longtime observer of the Great Lakes region of Africa, Lemarchand has conducted an incisive study of the Hutu-Tutsi violence in Rwanda and Burundi and the conflict it helped propagate in the Democratic Republic of the Congo in the mid-1990s. He emphasizes the evolution of the region's ethnic conflicts over long periods of time, revealing a dynamic in which episodes of violence force certain groups to migrate, which then puts them in conflict with other groups. That, in turn, eventually creates another cycle of violence and forced migration. Quite convincingly, Lemarchand argues that the Tutsi army's now-forgotten slaughter of Hutu civilians in Burundi in 1972, which resulted in between 150,000 and 300,000 casualties, was a watershed event that forever shaped Hutu-Tutsi relations. His analysis of the civil wars in the Democratic Republic of the Congo since 1996 skillfully untangles the web of shifting ethnic alliances and explains how the very real grievances of desperately poor communities are exploited by rapacious patrimonial warlords and their militias.   Loading...Please enable JavaScript for this site to function properly."
13,The Dragon’s Gift: The Real Story of China in Africa,https://www.foreignaffairs.com/reviews/capsule-review/2009-12-20/dragons-gift-real-story-china-africa,The Dragon’s Gift: The Real Story of China in Africa,"Brautigam situates the current relationship between China and Africa within a historical framework that goes back to the 1960s. Bucking the conventional wisdom that China's substantial increases in aid to the region are motivated by short-term commercial and strategic interests, Brautigam's lively and thoroughly documented account emphasizes that Chinese motivations are broader and more long term. The book starts with a revealing history of Chinese involvement in the region, beginning with agricultural and infrastructure projects in the 1960s. It outlines China's current aid activities and investments in the region, providing the most authoritative data available on both. The book's most intriguing argument is that China is genuinely interested in extending to Africa the lessons it learned from its own development and that what may appear to be crass commercial moves are actually the result of careful thinking about mutually beneficial activities. Brautigam is clearly impressed with what she views as the breadth and sophistication of China's Africa policy and contrasts it with the self-serving and nearsighted thinking of the West's. Loading...Please enable JavaScript for this site to function properly."
14,It’s Our Turn to Eat: The Story of a Kenyan Whistle-Blower,https://www.foreignaffairs.com/reviews/capsule-review/2009-12-20/its-our-turn-eat-story-kenyan-whistle-blower,It’s Our Turn to Eat: The Story of a Kenyan Whistle-Blower,"Wrong has written a perceptive and deeply troubling account of corruption in Kenya and of one anticorruption crusader's failed attempts to curtail it. John Githongo became permanent secretary for governance and ethics after the democratically elected president Mwai Kibaki took office in 2002 promising great change. Naive, but persistent and principled, Githongo soon uncovered massive corruption at the apex of the state, within a Kikuyu ethnic mafia around the presidency whose members believed that, after years out of power, it was time for their ethnic group to benefit. A fellow Kikuyu, Githongo had been expected to play along, and when he went public with detailed evidence, he was fired, discredited, and threatened. (He fled the country in 2005.) In the process of telling this story, Wrong covers a wide swath of contemporary Kenya with great precision and telling details, from the dynamics of ethnicity to the grinding poverty of the Nairobi slums and the cushy lifestyle of the country's establishment. The book trenchantly analyzes the complacency of Western donors and accuses the World Bank of actual complicity in Kenya's corruption. Amazingly, successive country representatives from the bank rented a house from and shared a garden with Kibaki in Nairobi, which was maintained at taxpayers' expense. For his troubles, Githongo was briefly feted in various feel-good international forums, but the Kibaki regime was barely admonished, and aid continued to flow into the country. Loading...Please enable JavaScript for this site to function properly."
15,China and the Transformation of Global Capitalism,https://www.foreignaffairs.com/reviews/capsule-review/2009-12-20/china-and-transformation-global-capitalism,China and the Transformation of Global Capitalism,"This symposium uses the Marxist-inflected theory of globalization known as world-systems theory to view some familiar topics through a fresh lens, although it is often blurred by jargon. Subjects addressed include how China's engagement with global capitalism has contributed to the rise of far-flung production networks, the shift of manufacturing to the East, the growing Asian resource hunger, and new geopolitical rivalries. Richard Appelbaum argues that the market power of mega-retailers, such as Wal-Mart, is counterbalanced by less well-known but similarly gigantic suppliers owned by enterprises from Hong Kong, Taiwan, and South Korea that command integrated production facilities. Stephanie Luce and Edna Bonacich explore nascent opportunities for the U.S. labor movement to cooperate with Chinese workers instead of treating them exclusively as competitors. And Beverly Silver and Lu Zhang suggest, with more hope than evidence, that labor unrest in China might invigorate the labor movement worldwide.Loading...Please enable JavaScript for this site to function properly."
16,Burma/Myanmar: What Everyone Needs to Know,https://www.foreignaffairs.com/reviews/capsule-review/2009-12-20/burmamyanmar-what-everyone-needs-know,Burma/Myanmar: What Everyone Needs to Know,"Steinberg gives a pointed briefing on what ails Myanmar (also called Burma) and finds the causes mostly in history. The kingly past bequeathed a zero-sum concept of power; the colonial era, irrational borders and a toxically unequal distribution of wealth among ethnic groups; and postindependence military rule, a decline in state capacity and a turn to predation. The international environment is also damaging: as former Prime Minister U Nu said, the country is ""hemmed in,"" between China, India, and the distant but looming United States, ""like a tender gourd among the cactus."" This has caused successive leaders to close off Myanmar from the West and lean toward China. As in other predatory states, an advantaged military caste, in this case comprising four percent of the population, lives off everyone else. Many want to join, but few are chosen; once admitted, the price of survival is loyalty. The layering of ethnic, economic, and legitimacy crises has trapped the country in a tragedy with no near-term resolution, to which the U.S. policy of unremitting sanctions has contributed nothing productive.Loading...Please enable JavaScript for this site to function properly."
17,"Honorable Survivor: Mao’s China, McCarthy’s America, and the Persecution of John S. Service",https://www.foreignaffairs.com/reviews/capsule-review/2009-12-20/honorable-survivor-maos-china-mccarthys-america-and-persecution,"Honorable Survivor: Mao’s China, McCarthy’s America, and the Persecution of John S. Service","John Service was one of several China hands fired from the U.S. State Department for questionable loyalty in the early 1950s. His trouble started when he got entangled in the inquiry  into the leaking of classified documents by federal employees to the academic journal  Amerasia, a spy case that turned out to be more about FBI misconduct than Soviet espionage. He was not indicted, but the investigation led to his interrogation before a series of State Department and congressional committees and to his firing. The deeper cause of his downfall was that he had challenged more powerful officials by arguing that Chiang Kai-shek's Kuomintang was too corrupt to survive -- and he turned out to be right. (Less correct was his view that Mao's Communists were potentially pro-American pragmatists.) Service was eventually vindicated by the Supreme Court, but his diplomatic career had been ruined. Joiner traces the story in engrossing political and personal detail, based on interviews with Service and his wife and files from the State Department and the FBI obtained through the Freedom of Information Act. It is a cautionary tale about the harm of persecuting diplomats who tell the truth as they see it, but also, as Joiner acknowledges, about the dangers of a security culture so lax that extensive leaking had become habitual even for honorable officers."
18,The Art of Not Being Governed: An Anarchist History of Upland Southeast Asia,https://www.foreignaffairs.com/reviews/capsule-review/2009-12-20/art-not-being-governed-anarchist-history-upland-southeast-asia,The Art of Not Being Governed: An Anarchist History of Upland Southeast Asia,"Scott has put rural and marginal people at the center of his previous studies, and here he offers a history of the estimated 100 million people who live in a vast hill and mountain zone that runs across southwest China, northeast India, and parts of five Southeast Asian countries. These populations fled into the hills over the course of two millennia, he argues, to avoid the imposition of slavery, indentured labor, and taxes by expanding states. There they evolved languages, economies, and ways of life designed to keep the state at bay. Outside of Asia, too, such fugitive populations define the ""ungovernable"" territories and ""minority"" or ""tribal"" identities usually thought of as exceptions to the norm. Scott often returns to the complex example of Myanmar (also called Burma) to explain how states mapped terrain, classified populations, and acquired resources as they expanded -- and to show how the Kachins, the Hmong, and others resisted. He believes that the uplanders' strategies of avoidance are approaching an endgame as new technologies give the modern state a longer reach. But the news from Afghanistan and Pakistan, as well as from Myanmar, suggests that these ungoverned groups may hold out longer than Scott thinks. Loading...Please enable JavaScript for this site to function properly."
19,Challenge and Strategy: Rethinking India’s Foreign Policy; India and the United States in the Twenty-first Century: Reinventing Partnership,https://www.foreignaffairs.com/reviews/capsule-review/2009-12-20/challenge-and-strategy-rethinking-indias-foreign-policy-india-and,Challenge and Strategy: Rethinking India’s Foreign Policy; India and the United States in the Twenty-first Century: Reinventing Partnership,"India's interests stretch far beyond its immediate periphery, covering several wide arcs from the Middle East through Central Asia, China, and Southeast Asia all the way to Japan, and they intersect at every point with the interests of Russia and the United States. No wonder New Delhi aspires to great-power status -- and has begun to earn it with economic growth, a naval buildup, and smarter diplomacy. Sikri, a retired Indian diplomat, expresses the Indian perspective straightforwardly. The major obstacles to India's ambitions, he says, are an unjust suspicion of its motives on the part of its immediate neighbors and the rise of China. Blaming Afghanistan's ungovernability on Pakistan, he recommends pressuring Islamabad by announcing construction projects that would cut the flow of desperately needed water from the Indus River. He counsels cooperation with Beijing even while suggesting how India might weaken its acknowledgment of Chinese sovereignty in Tibet, where the Chinese presence constitutes a permanent threat to Indian security. India's ambitions in every theater encounter other actors already present. In this sense, Sikri is right to say that India is not a status quo power, even though its goal is to join, not overturn, the great-power system."
20,Japan’s Remilitarisation,https://www.foreignaffairs.com/reviews/capsule-review/2009-12-20/japans-remilitarisation,Japan’s Remilitarisation,"For 40 years, Japan has incrementally raised its defense budget, extended its security perimeter, improved its armaments, and raised the bureaucratic status and operational ambit of the Self-Defense Forces. Do these trends, which accelerated after 2001, represent remilitarization or just the maintenance of a defensive posture in a more challenging security environment? Hughes argues for the former interpretation, based not just on data about budgets and weapons but also on contextual factors, such as the erosion of civilian control over the military, the strengthening of the military-industrial complex, the Liberal Democratic Party's promotion of constitutional changes, and Japan's acceptance of new tasks within the U.S.-Japanese defense alliance. Such trends validate the wariness of Japan's neighbors, such as China. But as Hughes acknowledges, Japan is nowhere near having the capacity to go to war without support from the United States. With Japan's government now under a new ruling party, this book provides a useful baseline from which to measure the future evolution of Japanese defense policy.Loading...Please enable JavaScript for this site to function properly."
21,Political Liberalization in the Persian Gulf,https://www.foreignaffairs.com/reviews/capsule-review/2009-12-19/political-liberalization-persian-gulf,Political Liberalization in the Persian Gulf,"This multiauthored survey of all the Persian Gulf states begins with a regionwide appraisal, followed by short country studies. The separate chapters treating those oil-rich and small Persian Gulf monarchies whose citizens are a minority of those living in each country -- Bahrain, Kuwait, Oman, Qatar, and the United Arab Emirates -- show the considerable liberalization and institution building that is taking place, but without disrupting the ruling families' holds on power. The portrayal of the United Arab Emirates as more like a corporation than a state is suggestive for the others as well. Of the chapters on the three big Persian Gulf states, two focus narrowly on the role of the ulama (Islamic clergy). The chapter on Saudi Arabia paints a bleak appraisal of the Wahhabi ulama, whereas the one on Iran sees much more ideological nuance, concluding that ""democracy has a better chance in Iran"" than in Sunni countries. The chapter on Iraq, after setting out the differing ""visions"" of democracy there, concludes that Iraq is no longer a nation-state but a ""diffuse"" country whose contending entities ""have yet to take their final shape."""
22,Jewish Terrorism in Israel,https://www.foreignaffairs.com/reviews/capsule-review/2009-12-19/jewish-terrorism-israel,Jewish Terrorism in Israel,"Jewish Terrorism in Israel, the second book to appear in the Columbia Studies in Terrorism and Irregular Warfare series, sets a high bar for subsequent works. After a brisk treatment  of terrorism in ancient Israel (which often inspires today's terrorism), it moves to modern times, documenting not just the well-remembered examples, such as the 1948 assassination of Count Folke Bernadotte, Baruch Goldstein's 1994 mass murder in Hebron, and the 1995 assassination of Yitzhak Rabin but seemingly every terrorist act by Israeli Jews realized or aborted from 1948 to 2007. Avoiding the pitfalls that generally confront the study of terrorism -- either expressing outrage at such inhumane behavior or dismissing one man's terrorist as another man's freedom fighter -- the authors dispassionately study the backgrounds, social networks, and motives of the terrorists. Several of these case studies are based on interviews with perpetrators quaintly labeled as ""retired."" Comparing Jewish terrorism to that of Islamists, the authors show that ""religious terrorism is not a one-faith phenomenon."""
