,title1,page_url,title2,first_paragraph
37,My Share of the Task: A Memoir,https://www.foreignaffairs.com/reviews/capsule-review/2013-05-01/my-share-task-memoir,My Share of the Task: A Memoir,"McChrystal, a retired four-star U.S. Army general, is a great American soldier and has written one of the best memoirs of life in the U.S. military. The U.S. Army that McChrystal joined after graduating from West Point in 1976 was a wounded organization, filled with anxiety, widely unpopular in the country at large, and struggling painfully with the complex experience of the Vietnam War. McChrystal vividly describes his significant role in restoring the army and reinventing the military as a more flexible, flatter, faster, and more information-driven organization. Those changes, McChrystal argues, allowed the military to snatch something like victory from the jaws of defeat in Iraq, despite facing enormous pressures, making many errors, and encountering many obstacles. McChrystal also offers a concise description of the strategy he proposed when he commanded the U.S. and international forces in Afghanistan, arguing persuasively that it represented a reasonable approach to a difficult conflict. McChrystal resigned his command in 2010 after a Rolling Stone article quoted his aides criticizing officials in the Obama administration. But readers who come to this book hunting for scandals and score settling will be disappointed; self-controlled and professional to the end, McChrystal makes no complaints about the manner in which his career ended and takes no shots at the presidents under whom he served."
38,"The Cambridge History of War. Vol. 4, War and the Modern World",https://www.foreignaffairs.com/reviews/capsule-review/2013-04-22/cambridge-history-war-vol-4-war-and-modern-world,"The Cambridge History of War. Vol. 4, War and the Modern World","This elegantly produced collection tells the story of modern warfare, beginning in the second half of the nineteenth century, a point described in the opening essay, by van de Ven, as a “hinge in time,” when the Napoleonic Wars were a memory and World War I could not yet be imagined. The shock of World War I’s carnage, but also the inability to get out of the political and operational mindsets that made it possible, dominates much of the book. The final essay considers “the era of American hegemony” and concludes in 2005, at an ambiguous point in the Iraq war. The volume’s comprehensiveness comes at the expense of depth. But the overall standard is high, and although the book covers much familiar ground, it puts forward some smart, original thinking about the social aspects of war.Loading...Please enable JavaScript for this site to function properly."
39,Nuclear Statecraft: History and Strategy in America’s Atomic Age,https://www.foreignaffairs.com/reviews/capsule-review/2013-04-22/nuclear-statecraft-history-and-strategy-americas-atomic-age,Nuclear Statecraft: History and Strategy in America’s Atomic Age,"Gavin is concerned that U.S. nuclear policy is distorted by myths about the past, and he believes that a better understanding of the history of the nuclear age would improve the contemporary approach. He worries that today’s policymakers have an inadequate grasp of nuclear history, from crises to arms control negotiations, and believes that with an improved understanding, they would somehow be better able to deal with current challenges, including calls for “global zero” -- a world without nuclear weapons. Gavin’s ambition is admirable, but he does not quite manage to fully demonstrate the influence of myths about the past nor does he succeed in adequately debunking them. Nevertheless, there is a lot of good material here, including an interesting chapter on U.S. President Richard Nixon and Secretary of State Henry Kissinger’s contributions to American nuclear strategy. And Gavin makes some sensible observations on the difficulty of ending the nuclear age, along with a persuasive argument about the need to prevent the use of nuclear weapons rather than abolishing them altogether.Loading...Please enable JavaScript for this site to function properly."
40,The Insurgents; War From the Ground Up; Blowtorch,https://www.foreignaffairs.com/reviews/capsule-review/2013-04-22/insurgents-war-ground-blowtorch,The Insurgents; War From the Ground Up; Blowtorch,"Much has already been written about the 2007 “surge” of U.S. forces in Iraq, which led to a marked improvement in the country’s security situation. A good deal of the attention has gone to General David Petraeus’ role in shaping the strategy, which was the culmination of an insurgency of sorts within the U.S. Army. In the wake of the Vietnam War, the army had developed an institutional allergy to counterinsurgency (or COIN), since it was considered to be something “other than war” and therefore not worthy of the army’s attention. The story of how Petraeus’ “COINdinistas” overcame that aversion to their thinking and changed army doctrine and practice is already familiar. But Kaplan has a gift for bringing to life what might otherwise seem like arcane strategic debates by linking them to the personalities and biographies of the main participants, and he vividly captures the drama of Petraeus’ struggle against a Pentagon establishment that Kaplan portrays as delusional and myopic."
41,Misunderstanding Financial Crises: Why We Don’t See Them Coming,https://www.foreignaffairs.com/reviews/capsule-review/2013-04-22/misunderstanding-financial-crises-why-we-dont-see-them-coming,Misunderstanding Financial Crises: Why We Don’t See Them Coming,"Why did economists fail to foresee the 2008 global financial crisis, especially considering that in retrospect there were numerous signs of financial fragility? In this engaging history, Gorton answers that question through an exercise in what might be called the epistemology of modern economics. He argues that economists were blindsided by events because they were preoccupied with elegant mathematical models that incorporated few elements of financial reality. Moreover, they had been lulled into complacency during the data-rich, prosperous era that preceded the crisis. And they had little knowledge of history; indeed, many harbored a conviction that history is irrelevant to the study of modern economies. But the book is much more than an indictment. Gorton provides an analytic history of financial crises in the United States, with occasional references to those in other countries, detailing their common traits and revealing what he calls the “plumbing” that shaped financial transactions in different eras.Loading...Please enable JavaScript for this site to function properly."
42,"The Great Rebalancing: Trade, Conflict, and the Perilous Road Ahead for the World Economy",https://www.foreignaffairs.com/reviews/capsule-review/2013-04-22/great-rebalancing-trade-conflict-and-perilous-road-ahead-world,"The Great Rebalancing: Trade, Conflict, and the Perilous Road Ahead for the World Economy","Pettis asserts that the world economy suffers from unsustainable imbalances that must be eliminated. China, Germany, Japan, and several smaller countries enjoy large current account surpluses, while the United States and many other countries run up trade deficits. Pettis applies basic macroeconomic theory to counter the common error of thinking that any single country can eliminate its imbalances on its own. In one sense, global trade is a zero-sum game: one country’s surplus is another country’s deficit. But regardless of that simple truth, Pettis has little hope that countries will be able to work together to ration-ally rebalance one another’s economies. Instead, Pettis foresees a period of reduced demand for goods and services around the world, a state of affairs that will tempt countries currently running trade deficits to protect their domestic industries at the expense of free trade. Perhaps his most striking forecast is that as China shifts its focus from investment to consumption during the coming decade, its annual GDP growth will average no more than three percent.Loading...Please enable JavaScript for this site to function properly."
43,The Unloved Dollar Standard: From Bretton Woods to the Rise of China,https://www.foreignaffairs.com/reviews/capsule-review/2013-04-22/unloved-dollar-standard-bretton-woods-rise-china,The Unloved Dollar Standard: From Bretton Woods to the Rise of China,"In McKinnon’s view, the dollar-based international financial system has become fragile, due in part to U.S. policies. But it can be strengthened, McKinnon believes, especially with help from China. He argues that the conventional emphasis on adjusting exchange rates among currencies to reduce trade imbalances is deeply misguided and will not work without requiring significant changes in macroeconomic policies. More surprising, he believes that such changes can reduce trade imbalances without causing significant differences in exchange rates, the prospect of which can affect market expectations and destabilize cross-border flows of capital. He urges the U.S. Federal Reserve to pay more attention to stabilizing the dollar’s effective exchange rate and suggests that the U.S. government should stop pressing China for a major revaluation of the yuan. He also believes that Washington and Beijing should coordinate their efforts, with the Americans tightening their fiscal policy and the Chinese loosening theirs while also trying to increase domestic spending.Loading...Please enable JavaScript for this site to function properly."
44,Bad Pharma: How Drug Companies Mislead Doctors and Harm Patients,https://www.foreignaffairs.com/reviews/capsule-review/2013-05-01/bad-pharma-how-drug-companies-mislead-doctors-and-harm-patients,Bad Pharma: How Drug Companies Mislead Doctors and Harm Patients,"This book levels a scathing attack on large pharmaceutical firms and the officials who regulate them. Goldacre, a British physician, articulately and extensively documents how large pharmaceutical firms have inched up as close as possible to committing outright fraud and occasionally have crossed the threshold. According to Goldacre, major drug companies have financed the ghostwriting of papers supposedly penned by reputable scholars in respectable scientific journals, systematically withheld experimental drug-testing data from public and professional scrutiny, and failed to run promised trials to detect side effects after drugs have been approved for sale. In the face of this unethical behavior, regulators on both sides of the Atlantic have been complacent and negligent. Goldacre believes that a strong dose of sunlight could eventually disinfect the industry, and he calls for full transparency regarding past ghostwritten articles and for the publication of all testing data, except in those few cases in which patient privacy would clearly be infringed. Not incidentally, such steps would also help national health-care programs and patients avoid wasting money on expensive drugs of dubious value.Loading...Please enable JavaScript for this site to function properly."
45,Plutocrats: The Rise of the New Global Super-Rich and the Fall of Everyone Else,https://www.foreignaffairs.com/reviews/capsule-review/2013-04-22/plutocrats-rise-new-global-super-rich-and-fall-everyone-else,Plutocrats: The Rise of the New Global Super-Rich and the Fall of Everyone Else,"Income and wealth in the United States today are less evenly distributed than at any time since the 1920s. One result is the emergence of a new class of plutocrats. The phenomenon is not limited to the United States: China, India, Mexico, Russia, the United Kingdom, and other states have witnessed similar changes. Freeland, a journalist and editor at Thomson Reuters, examines how this fairly diverse new class came to be and explores some of the consequences and potential implications of its rise. In a world of mass consumption, successful innovations can result in great wealth, as can any rapid social and political change, at least for those well placed or lucky enough to take advantage of new opportunities. More ominous, individuals can become fabulously wealthy at the expense of other citizens, by securing privileges from powerful government officials -- sometimes through influencing the decision-making process, sometimes through outright bribes or offers of lucrative future employment. Freeland worries about the increasing political influence of the superrich and the growing social distance between them and ordinary people. But she has surprisingly little to say about the most traditional route to plutocratic status: inherited wealth.Loading...Please enable JavaScript for this site to function properly."
46,Anglo-America and Its Discontents; Sinicization and the Rise of China,https://www.foreignaffairs.com/reviews/capsule-review/2013-04-22/anglo-america-and-its-discontents-sinicization-and-rise-china,Anglo-America and Its Discontents; Sinicization and the Rise of China,"Samuel Huntington’s seminal essay “The Clash of Civilizations?” revived the nineteenth-century view of civilizations as unitary groupings of peoples, tied together by tradition, ethnicity, religion, and primordial values. In Huntington’s view, these civilizations—most notably the West, China, and Islam—were not simply abstractions but actors that wielded power and that were destined to clash. In recent years, Katzenstein, a renowned scholar of international relations, has advanced a strikingly different vision of civilizations, contending that although civilizations exist and are important, they are not really actors. Rather, they are loose, pluralistic systems of belief and identity. Katzenstein objects to Huntington’s essentialist view of civilizations, but he also disagrees with liberal internationalists, who see the concept of civilizations as anachronistic. In Katzenstein’s view, civilizational divides do still exist, but they play out in diffuse and ambiguous ways within and between the major global cultural traditions."
47,Cyberpolitics in International Relations,https://www.foreignaffairs.com/reviews/capsule-review/2013-04-22/cyberpolitics-international-relations,Cyberpolitics in International Relations,"Cyberspace is creating new ways for individuals to interact, complicating old notions of sovereignty, stability, and security. People everywhere are gaining access to knowledge and to one another, but these growing connections are also creating new vulnerabilities. Choucri has put together a systematic guide to these issues, informed by international relations theory. She has mapped a world still in the making, illuminating the new political landscape of cyberspace and the ways it complicates states’ pursuits of power and wealth. The book examines the positive and negative implications of the revolution in communications technology: new ways for individuals to organize and give voice to fresh ideas, but also novel forms of crime, espionage, and war, along with new opportunities for authoritarian states to exercise control.Loading...Please enable JavaScript for this site to function properly."
48,"Divided Nations: Why Global Governance Is Failing, and What We Can Do About It",https://www.foreignaffairs.com/reviews/capsule-review/2013-04-22/divided-nations-why-global-governance-failing-and-what-we-can-do,"Divided Nations: Why Global Governance Is Failing, and What We Can Do About It","In this short but persuasive book, Goldin argues that the institutions of postwar global governance—the UN, the International Monetary Fund, and the World Bank—are increasingly incapable of managing the instabilities created by global interdependence. The 2008 financial crisis is emblematic of this problem: advances in technology, financial instruments, and banking collided with outdated regulatory institutions, bringing the world economy to the brink of collapse. Goldin identifies similar potential threats of systemic breakdown when it comes to cybersecurity, pandemic diseases, immigration, nuclear safety, and climate change. Each of these problems requires large coalitions of states to commit to sophisticated, long-term collective action and global problem solving. But the recent failures of major multilateral negotiations on trade and climate change have not generated much optimism. Goldin’s suggested path forward eschews new global institutions in favor of informal networks that bring governments, private groups, and experts together to form new coalitions. If globalization is to survive, it will need to be governed responsibly, with the participation of the many constituencies around the world that would benefit from more openness and interdependence.Loading...Please enable JavaScript for this site to function properly."
49,"War, Guilt, and World Politics After World War II",https://www.foreignaffairs.com/reviews/capsule-review/2013-05-01/war-guilt-and-world-politics-after-world-war-ii,"War, Guilt, and World Politics After World War II","For over half a century, Germany and Japan have struggled to put World War II behind them. Berger has produced one of the most sophisticated and sensitive treatments yet about how these two countries have contended with their troubled histories. Germany, with perhaps the most horrific legacy of state-sponsored brutality, has made many public expressions of remorse and contrition, adopting a relentlessly negative official narrative of its own past. Japan, in contrast, has tended to see itself as a victim as much as a victimizer. Berger shows that Japanese leaders have in fact acknowledged responsibility for the atrocities the country’s forces committed in the past and have tried to make amends. The trouble is that government apologies and admissions of responsibility are interpreted differently by different audiences. The book’s message to Japanese leaders is that for symbolic acts of reconciliation to succeed, they must simultaneously address the fears and grievances of Japan’s neighbors and undercut nationalist movements at home.Loading...Please enable JavaScript for this site to function properly."
50,How to Fix America,https://www.foreignaffairs.com/articles/2013-04-03/how-fix-america,How to Fix America,UNLEASH THE PRIVATE SECTOR Edward Conard
51,Bolívar's Botched Bequest,https://www.foreignaffairs.com/reviews/review-essay/2013-04-03/bolivars-botched-bequest,Bolívar’s Botched Bequest,"Bolívar: American Liberator BY MARIE ARANA. Simon & Schuster, 2013, 544 pp. $35.00."
52,The Persistence of Arab Anti-Americanism,https://www.foreignaffairs.com/reviews/review-essay/2013-04-03/persistence-arab-anti-americanism,The Persistence of Arab Anti-Americanism,"A decade ago, anti-Americanism seemed like an urgent problem. Overseas opinion surveys showed dramatic spikes in hostility toward the United States, especially in the Arab world -- a sentiment expressed all too clearly by massive crowds burning American flags and the growing prominence of Islamist extremists and terrorist groups. Many Americans, not surprisingly, saw this development as a serious threat. In a 2008 survey conducted by the Chicago Council on Global Affairs, when U.S. citizens were asked to rank the importance of Washington's goals, more placed a higher priority on restoring the country's standing in the world than on protecting jobs, combating terrorism, or preventing the spread of nuclear weapons."
53,Why the U.S. Army Needs Missiles,https://www.foreignaffairs.com/articles/united-states/2013-04-03/why-us-army-needs-missiles,Why the U.S. Army Needs Missiles,"Traditionally, the core purpose of the U.S. Army has been to fight and win the United States' wars. Since World War II, this has meant planning for overseas operations to defend friendly countries against invasion, seize and hold territory, and overthrow despotic regimes. But the protracted counterinsurgency campaigns in Afghanistan and Iraq, like the one in Vietnam a generation earlier, marked a departure from the army's preferred way of war. Today, with U.S. forces out of Iraq and leaving Afghanistan, an intense debate is under way about what kind of army the United States needs."
54,Why the U.S. Army Needs Armor,https://www.foreignaffairs.com/articles/north-america/2013-05-01/why-us-army-needs-armor,Why the U.S. Army Needs Armor,"Ever since World War II, the United States has depended on armored forces -- forces equipped with tanks and other protected vehicles -- to wage its wars. General Omar Bradley, the senior field commander of the U.S. ground forces that conquered Nazi Germany, noted in his official after-action report that tank warfare, especially when combined with airpower, proved essential in defeating the Wehrmacht. ""The air-armor team is a most powerful combination in the breakthrough and in exploitation,"" he wrote, adding, ""the use of this coordinated force, in combat, should be habitual."" In the decades that followed, the U.S. military frequently employed armored forces, relying on them during the Korean War, the Vietnam War, the Gulf War, the Afghan war, and the Iraq war."
55,The Church Undivided,https://www.foreignaffairs.com/world/church-undivided,The Church Undivided,"In terms of budget, personnel, and global reach, the Roman Catholic Church rivals the United Nations, and as far as having a track record of promoting tolerance and peace without resorting to force, it has no equal among states. Over Christianity’s 2,000-year history, its message of love, charity, and self-sacrifice has kept the religion popular and influential, even in the face of relentless attacks. The Soviet Union, for example, shut down churches and waged an aggressive antireligion campaign, but Christianity has outlasted communism."
56,Why American Education Fails,https://www.foreignaffairs.com/united-states/why-american-education-fails,Why American Education Fails,"In his landmark 1973 book, The Coming of Post-industrial Society, the sociologist Daniel Bell heralded the United States' transition from a labor-intensive economy that produced goods to a knowledge-based one geared toward providing services. No longer could success be achieved through manual, assembly-line work; it would require advanced skills and creativity. At least since then, American politicians and pundits have regularly stressed that education holds the key to the country's future. Everyone seems to agree that good schools are prerequisites for broad economic prosperity, individual social mobility, and a healthy civil society in which informed voters engage in the public issues of the day."
57,America's Energy Opportunity,https://www.foreignaffairs.com/articles/united-states/2013-04-03/americas-energy-opportunity,America’s Energy Opportunity,"An energy revolution is unfolding in the United States -- but unlike most past or promised revolutions, this one is not confined to a single fuel or technology. After falling for more than two straight decades after 1985, U.S. crude oil production has now risen for four consecutive years, and in 2012, it posted its largest one-year increase since the dawn of the oil industry more than 150 years ago. Meanwhile, in 2011, natural gas surpassed coal as the United States' biggest source of domestically produced energy, thanks to surging output and plunging prices. And all this growth in U.S. fossil fuel production has not prevented the rise of zero-carbon energy sources: the amount of electricity generated from cutting-edge renewables -- wind, solar, and geothermal -- has doubled since 2008, and prices have plummeted. Moreover, as technological innovations have made U.S. motor vehicles more fuel efficient, the country's oil consumption has fallen by nearly ten percent since 2005, reversing what previously seemed to be an interminable upward trend."
58,The Clinton Legacy,https://www.foreignaffairs.com/articles/united-states/2013-05-01/clinton-legacy,The Clinton Legacy,"In late January, only a few days after his second inauguration, U.S. President Barack Obama delivered a surprisingly fond farewell to his old political rival Hillary Clinton. Sitting for a joint interview with the outgoing secretary of state on 60 Minutes, Obama lauded their “great collaboration.” He continued: “I just wanted to have a chance to publicly say thank you, because I think Hillary will go down as one of the finest secretaries of state we’ve had.”"
59,Africa’s Economic Boom,https://www.foreignaffairs.com/articles/west-africa/2013-04-03/africas-economic-boom,Africa’s Economic Boom,"Can you hear me now? Swaziland, August 2010 (Reuters / Siphiwe Sibeko)"
60,The Irony of American Strategy,https://www.foreignaffairs.com/articles/united-states/2013-04-03/irony-american-strategy,The Irony of American Strategy,"The United States emerged from the Cold War with unprecedented absolute and relative power. It was truly first among unequals. Not surprisingly, its leaders were uncertain about what to do with such advantages, and for more than a decade following the dismantlement of the Berlin Wall, U.S. foreign policy was conducted without much in the way of an overarching strategy."
