,title1,page_url,title2,first_paragraph
19,The New Tsar: The Rise and Reign of Vladimir Putin,https://www.foreignaffairs.com/reviews/capsule-review/2016-04-15/new-tsar-rise-and-reign-vladimir-putin,The New Tsar: The Rise and Reign of Vladimir Putin,"What is it about Vladimir Putin that makes people want to write books about him—many more, it seems, than about any other currently serving leader or, indeed, any recent leader? Most of the authors of these books are journalists such as Myers; Russia seems to get into their blood, and Putin, an improbably striking character, is at the center of the country’s turbulent existence and effect. Myers retraces familiar ground: Putin’s childhood, KGB service in East Germany, entry into Leningrad politics, ascent in Moscow, and consolidation of power, and the various twists and dramas of his time in power, including the ongoing Ukrainian conflict. What Myers adds to this oft-told tale are revealing details, texture, and nuance made possible by the seven years he spent reporting from Russia for The New York Times. For readers looking for a full, highly readable account of Putin and the era he has shaped, this is the book."
20,On Stalin’s Team: The Years of Living Dangerously in Soviet Politics,https://www.foreignaffairs.com/reviews/capsule-review/stalins-team-years-living-dangerously-soviet-politics,On Stalin’s Team: The Years of Living Dangerously in Soviet Politics,"It might seem strange to describe a book about Joseph Stalin and his entourage as a sheer pleasure, but that’s what Fitzpatrick’s book is. Simple, honest, and direct, but subtle in tone, it manages to convey what was human and complex about something stark and inhuman. Fitzpatrick reconstructs the relations among Stalin and the small circle of lieutenants who remained close to him—and, with varying intensity, to one another—over a remarkable 30 years. These men were not merely rubber stamps for a dictator’s autocratic decisions; they exerted force within the spheres of their responsibility. (Stalin, of course, always had the last word.) In the early days of the Soviet era, they were buoyant with revolutionary energy. Later, they were driven apart during the Great Purge in the late 1930s, reenergized by World War II, and ultimately able to hold the Soviet system together after Stalin’s death in 1953. All remained loyal to Stalin until the very end, even when subjected to his wrath, and they all genuinely believed that he had merits far greater than theirs. One comes away from this book with a far better sense of what it must have been like within the inner sanctum as it went about its business: sometimes heroic, all too often monstrous."
21,"The Depths of Russia: Oil, Power, and Culture After Socialism",https://www.foreignaffairs.com/reviews/capsule-review/depths-russia-oil-power-and-culture-after-socialism,"The Depths of Russia: Oil, Power, and Culture After Socialism","Rogers, an anthropologist, is not as interested as most observers in how money, power, and politics mix in Russia and echo in its foreign policy. Rather, he focuses on how things work within oil corporations: how the new oil giants evolved out of Soviet carcasses; how they operate in symbiosis with the state; and, in particular, how they directly shape social and cultural institutions. He zeroes in on a single region, Perm, which drove the Soviet Union’s first oil boom, from 1929 until the 1970s; a single company, Lukoil, which inherited parts of the Soviet conglomerates, including a vast refining operation; and one key sphere of the subsidiary Lukoil-Perm’s social activity, the promotion of local cultural traditions. The intersection of oil, money, and power might be a sexier topic. But the ways in which politicians and corporate bosses redefine and blend roles on the ground—indeed, to the point that Lukoil-Perm assumed the lead in a grand campaign to make the city of Perm a “capital of culture,” competing with St. Petersburg—provide more insight into the real texture of everyday politics."
22,Velvet Revolutions: An Oral History of Czech Society,https://www.foreignaffairs.com/reviews/capsule-review/2016-04-15/velvet-revolutions-oral-history-czech-society,Velvet Revolutions: An Oral History of Czech Society,"Vanek and Mucke are Czech oral historians who have applied their craft to reveal how 300 Czechs from all walks of life—factory workers, teachers, electricians, doctors, soldiers—remember the communist era of their youth: their schools, workplaces, and friendships, as well as the political norms and hazards that shaped and abraded their lives. Their memories of what preceded 1989—“the crack,” as many people refer to the collapse of socialism—are mixed and human, full of simple pleasures: evenings at the pub, good and bad teachers, holidays, and the rhythms of the workday. They appreciate the new freedoms they now have—if they can afford them. But they frown on the anomie, materialism, self-absorption, and inequities of the postcommunist era and resent those who have found ways to game the new system. The striking thing is that notwithstanding the fundamental differences between the political system in which they spent most of their lives and that of the United States, their outlook on the past and the present appears not all that different from that of Americans of the same generation."
23,Beyond Crimea: The New Russian Empire,https://www.foreignaffairs.com/reviews/capsule-review/beyond-crimea-new-russian-empire,Beyond Crimea: The New Russian Empire,"Scarcely any aspect of Russian foreign policy has received more attention and less serious exploration than Russia’s maneuvering in former parts of the Soviet Union. Grigas takes a sizable step toward rectifying that imbalance by carefully tracing Moscow’s approach to so-called compatriots—ethnic Russians, Russian speakers, and those who simply identify with Russia—in these now independent states. Russian foreign policy is a Rorschach test, and Grigas’ interpretation will satisfy many—but not all. Grigas details how Russia uses hard power, soft power, and something in between: for example, bestowing Russian passports on compatriots who are citizens of other countries. Her purpose is to prove that Russia is trying to reconstitute an empire, drawing its identity and motivations from a script that traces back to the sixteenth century. Russia, she argues, begins its interventions in its neighbors’ affairs by making claims on behalf of allegedly threatened compatriots and then, step by step, resorts to cruder mechanisms. Finally, if conditions permit, Russia turns to subversion and military force, as it did in Georgia in 2008 and Ukraine in 2014."
24,The Red Web: The Struggle Between Russia’s Digital Dictators and the New Online Revolutionaries,https://www.foreignaffairs.com/reviews/capsule-review/red-web-struggle-between-russias-digital-dictators-and-new-online,The Red Web: The Struggle Between Russia’s Digital Dictators and the New Online Revolutionaries,"This could have been a narrowly told story of how the Internet came to Russia and now pervades the lives of most of its citizens. Instead, although the authors do trace the jury-rigged early Russian connections to the Web in the late 1980s, they tell a much broader tale. They delve into the Kremlin’s efforts to commandeer this new medium, the interplay between state-controlled media and the more freewheeling Internet, and the ingenuity of the young paladins who have kept information flowing over the Internet despite the best efforts of Russia’s security services. The authorities now eavesdrop on virtually every form of communication in the country, from e-mail to Skype. But the Kremlin has been unable to bring the Internet to heel and ensure that only the regime’s views proliferate. Soldatov and Borogan, two young journalists, dogged and nervy, are detectives, tracking down the players on all sides. They weave the results into something close to a high-tech adventure."
25,The Versailles Restaurant Cookbook,https://www.foreignaffairs.com/reviews/capsule-review/versailles-restaurant-cookbook,The Versailles Restaurant Cookbook,"To understand the influence of political strife on the recipes and ingredients in people’s ever-changing dining habits, academics now study “conflict cuisine.” Founded by Cuban immigrants in 1971 in Miami’s Little Havana neighborhood, the restaurant Versailles embodied conflict cuisine before the term became trendy. Like its namesake, Versailles is an elegant icon of an upended ancien régime, mixing nostalgia for a lost homeland with kitsch decor that recalls a style of 1950s Miami. For decades, Cuban Americans have gathered at the restaurant to plot their revenge against the man who stole their birthrights, Fidel Castro. No paladar (privately owned restaurant) in Cuba can match Versailles’ seating capacity of 400, as the Cuban government places a tight limit of 50 chairs on such establishments. Versailles is also an obligatory stop for politicians courting the Cuban American vote. Quincoces and Valls recognize that Cuban fare, rooted in Spanish traditions, is relatively simple, and the accessible recipes they offer cover all the basics: classic sofrito marinade (garlic, onion, tomato, bell peppers), ropa vieja (shredded flank steak), black beans and rice, a rich flan, and strong Cuban coffee. The light, informative text considers, among other things, the fiery debates over the true origins and proper contents of the Cuban sandwich, which typically includes some combination of roast pork, ham, Swiss cheese, pickles, and mustard."
26,Nicaragua and the Politics of Utopia: Development and Culture in the Modern State; Faith and Joy: Memoirs of a Revolutionary Priest,https://www.foreignaffairs.com/reviews/capsule-review/nicaragua-and-politics-utopia-development-and-culture-modern-state-faith-and,Nicaragua and the Politics of Utopia: Development and Culture in the Modern State; Faith and Joy: Memoirs of a Revolutionary Priest,"For a small country, Nicaragua has produced a remarkable literary and poetic tradition, one steeped in utopian politics. As the country’s most famous poet, Rubén Darío, famously remarked, “If small is the homeland, one dreams it great.” In his highly original book, Chávez seeks the literary and philosophical roots of three very different Nicaraguan regimes: the modernizing, authoritarian Somoza dictatorship (1937–79), the agrarian-socialist Sandinista revolution (1979–90), and the neoliberal capitalism of the post-Sandinista era (1990–2006). All three regimes were “utopian” in that their legitimizing rhetoric and imagery contained contradictory elements that were impossible to reconcile or fully realize and that obscured their less savory characteristics. Chávez carefully dissects official speeches and constitutional texts and expertly elucidates their literary and discursive origins. His critiques of two outstanding contemporary writers, Sergio Ramírez and Gioconda Belli, are especially well drawn, as he guides readers from their early anti-Somoza mythological stories and poems to their subsequent writings on political disillusionment. But Chávez is no cynic: on the contrary, he asserts that the drive to imagine a better, more hopeful future is profoundly and gloriously human."
27,A Fragmented Continent: Latin America and the Global Politics of Climate Change; American Crossings: Border Politics in the Western Hemisphere,https://www.foreignaffairs.com/reviews/capsule-review/2016-04-14/fragmented-continent-latin-america-and-global-politics-climate,A Fragmented Continent: Latin America and the Global Politics of Climate Change; American Crossings: Border Politics in the Western Hemisphere,"Taken together, these two books help reveal a paradox of Latin America: although its governments disagree sharply on many things, the region enjoys low levels of interstate violence. A Fragmented Continent expertly explores one issue that produces sharply divergent attitudes: climate change. American Crossings intelligently considers why Latin America is a region substantially at peace with itself."
28,Routledge Handbook of Latin America in the World,https://www.foreignaffairs.com/reviews/capsule-review/2016-04-14/routledge-handbook-latin-america-world,Routledge Handbook of Latin America in the World,"The foreign policies of Latin American states have been woefully understudied. This comprehensive collection of essays by senior international relations scholars is a magnificent corrective to that shameful lacuna. The contributors place their analyses within familiar theoretical frameworks, dive deeply into empirical evidence, and keep their essays—30 in all—lucid and succinct. The collection covers the foreign policies of every major Latin American country; regional multilateralism and economic integration schemes; and issues such as human rights, counternarcotics, global environmental governance, and migration. Oddly, there is only one brief (although solid) essay on U.S. foreign policy even though many of the contributions contemplate Latin American efforts to restrain U.S. power. Alas, the pace of change in the region is so fast that the enthusiasm some of the authors demonstrate for assertive left-leaning governments that seek autonomy from U.S. influence is already a bit behind the curve, as Argentina turns toward economic pragmatism, Cuba’s Raúl Castro embraces U.S. President Barack Obama, and Venezuela flounders. Nevertheless, this authoritative handbook should be enthusiastically received by anyone searching for high-quality material on Latin America’s role in the contemporary world."
29,EU Leadership in Energy and Environmental Governance: Global and Local Challenges and Responses,https://www.foreignaffairs.com/reviews/capsule-review/2016-04-14/eu-leadership-energy-and-environmental-governance-global-and,EU Leadership in Energy and Environmental Governance: Global and Local Challenges and Responses,"No single area of internal EU regulation is more essential to Europe’s global role today than energy policy. This is particularly true with regard to Russia. In recent years, EU officials in Brussels have become more active in regulating competition and funding infrastructure in the energy sector, with an eye toward limiting Russian leverage, which stems mostly from European countries’ dependence on Russian natural gas. Meanwhile, individual EU member states have continued to adapt to evolving energy markets, with policies whose substance depends largely on the extent of their energy dependence and their financial means. These developments have had a decisive impact on diplomacy with Russia and the crisis in Ukraine: it is ultimately the EU that decides whether pipelines and connectors are built. The complex and conspiratorial world of energy politics is tough to research. Although more detailed and ambitious works on the subject exist, this volume of EU-funded research offers a useful introduction to some of the key data and perspectives."
30,"Shadows of Revolution: Reflections on France, Past and Present",https://www.foreignaffairs.com/reviews/capsule-review/2016-04-14/shadows-revolution-reflections-france-past-and-present,"Shadows of Revolution: Reflections on France, Past and Present","Bell (who, like me, teaches at Princeton University) has emerged as a leading U.S.-based observer of France, the United States’ oldest ally. This book contains more than 40 of his essays published over the past 25 years, covering everything from the French Revolution, Napoleon, and the Vichy government to contemporary politics and culture. Most of these essays are book reviews that engage authors in critical dialogues and that originally appeared in The New Republic, the London Review of Books, and other periodicals. But Bell is not a typical academic turned high-end journalist: he does not simply summarize books or briefly mention them as a springboard for a bit of reportage or op-ed writing. Instead, he seeks to stimulate serious debate about the past. For him, the test of a good argument is its fidelity to contextual details as historical actors actually perceived them. Although Bell writes well, his reviews do not always make for easy reading, given the complexity of his approach. Still, the book offers unusually rewarding insights into the past and the many ways it continues to influence contemporary France."
31,"Export Empire: German Soft Power in Southeastern Europe, 1890–1945",https://www.foreignaffairs.com/reviews/capsule-review/2016-04-14/export-empire-german-soft-power-southeastern-europe-1890-1945,"Export Empire: German Soft Power in Southeastern Europe, 1890–1945","From the British Empire a century ago to China today, powerful countries have often employed economic and cultural influence to bind smaller states in dependent relationships. Gross shows how German businessmen and academics in the Weimar and Nazi periods used development projects, trade fairs, scholarly research, and educational exchanges to help entrench Germany’s role as the primary trade partner for many of its neighbors, establish itself as a development model, and fix its position atop central Europe’s hierarchy of states. Gross stretches the terms “informal imperialism” and “soft power” to encompass this type of behavior, which immediately evokes images of Nazi imperialism. Yet his most telling conclusion is that Germany’s informal influence during the interwar period had more in common with today’s relations among the United States, European countries, and smaller states than with Adolf Hitler’s military grasp for Lebensraum (living space) and a formal empire. In many ways, Hitler’s counterproductive military expansion and ethnic cleansing reversed the interwar policy of mutually beneficial inducement and persuasion. This book offers an interesting historical perspective on the active trade and investment policies of great powers today."
32,Government Favoritism in Europe,https://www.foreignaffairs.com/reviews/capsule-review/2016-04-14/government-favoritism-europe,Government Favoritism in Europe,"Public infrastructure projects and other types of government procurement almost everywhere in the world suffer from favoritism and corruption, if not outright criminality. The spoils always go to the people with the right connections, wealth, or the willingness to use or threaten violence. This is among the most difficult aspects of governance for scholars to study: those who talk don’t know, and those who know don’t talk. This slim volume summarizes detailed studies of favoritism in Bulgaria, Croatia, Hungary, Italy, Romania, Turkey, and Ukraine. A final chapter shows how criminal organizations in many countries—including Mafia-like groups in Bulgaria and Italy—infiltrate national and EU-level public spending projects. Each chapter is packed with a remarkably rich set of charts, graphs, and statistical analyses that capture how much corruption exists and how it works. These succinct and eye-opening quantitative estimates of what really goes on beneath the surface of government make for indispensable reading and should straighten out anyone who doubts that the powerful always find ways to reinforce their influence and wealth, even on the “cleanest” of continents."
33,Scotland Now: A Warning to the World,https://www.foreignaffairs.com/reviews/capsule-review/2016-04-14/scotland-now-warning-world,Scotland Now: A Warning to the World,"The recent rise of Scottish nationalism has exposed the ideological contradictions of British conservatism. Among British Conservatives are Burkean nationalists who reject Scottish nationalism, Thatcherites who warn Scots not to trim their public sector, extremists who criticize the pro-independence Scottish National Party (for being extremist, naturally), and believers in “one nation” conservatism in theory who are dividing the United Kingdom in practice by striking a cozy electoral bargain with Scottish nationalists. In politics, when partisans contemplate such contradictions, they tend to fulminate, and Gallagher is no exception: his book is twice as long as it need be, not least because it is bloated with sarcastic asides, accusations of cynical motives, and the persistent use of quotation marks to indicate irony. Gallagher manages to see everything except the one thing he cannot: the central role the Conservative Party has played in leading so many modern Scots to despise being part of the United Kingdom. Yet he adds something to the conventional view of the Scottish issue as merely an unfortunate disagreement between two well-meaning groups, idealistic nationalists and sensible unionists. He highlights that even without the independence movement, Scotland is becoming a populist one-party state. Governments in such places, he rightly warns, tend to be insular, intolerant, interventionist, and corrupt."
34,Mission Failure: America and the World in the Post–Cold War Era,https://www.foreignaffairs.com/reviews/capsule-review/2016-04-14/mission-failure-america-and-world-post-cold-war-era,Mission Failure: America and the World in the Post–Cold War Era,"Mandelbaum’s latest book offers a biting sketch of U.S. foreign policy during the Clinton, George W. Bush, and Obama administrations, skewering all three for their various mistakes. He argues that, bequeathed a rare gift of peace, prosperity, and relative international calm, the post–Cold War presidencies often wandered off into undisciplined adventures in humanitarianism and quixotic nation building, most of which turned out badly. Instead of squandering blood, treasure, and reputation on “foreign policy as social work” (as Mandelbaum put it in these pages two decades ago), Washington should have focused on other countries’ external behavior, not their internal politics. Mandelbaum’s blows hit their targets, as does his theoretical contention that the most important factor driving these policies was unprecedented relative power—the strong doing what they can once again, this time in a well-intentioned but clueless American mode. But since the author favors continuing “the American role as the chief custodian of the benign international order that . . .  emerged from the end of the Cold War,” it is not clear why the new era is truly distinctive, and the book would have benefited from less narration of familiar events and more discussion of the author’s preferred courses of action."
35,"The Unquiet Frontier: Rising Rivals, Vulnerable Allies, and the Crisis of American Power",https://www.foreignaffairs.com/reviews/capsule-review/2016-04-14/unquiet-frontier-rising-rivals-vulnerable-allies-and-crisis,"The Unquiet Frontier: Rising Rivals, Vulnerable Allies, and the Crisis of American Power","The Unquiet Frontier is a useful and thoughtful contribution to the most important debate in U.S. foreign policy and will be read with great care by President Barack Obama’s supporters and critics alike. Grygiel and Mitchell make the case that the revisionist powers of China, Iran, and Russia have been probing the most exposed and vulnerable points in the United States’ system of alliances and that the next U.S. president will face much more dangerous challenges unless he or she takes strong action to reassert American power. Supporters of the Obama administration’s approach hope that a reasoned and conciliatory U.S. response will promote the emergence of a stable order that requires less U.S. effort to uphold. Grygiel and Mitchell counter that far from settling into a cooperative new order, those revisionist powers will choose escalation, requiring the United States to run greater risks and incur larger costs to defend the existing world system. At the moment, Obama’s supporters are on the defensive; if the trend of rising instability persists through January 2017, expect the next U.S. administration to look long and hard at the ideas put forward in this book."
36,Exit Right: The People Who Left the Left and Reshaped the American Century,https://www.foreignaffairs.com/reviews/capsule-review/2016-04-14/exit-right-people-who-left-left-and-reshaped-american-century,Exit Right: The People Who Left the Left and Reshaped the American Century,"Converts are often odd, and Oppenheimer’s engaging study of six prominent left-wingers who wound up on the right illustrates the eccentricities that have made people such as Whittaker Chambers (Soviet sympathizer and spy turned anticommunist conservative), David Horowitz (Black Panther supporter turned right-wing crusader) and Christopher Hitchens (antiwar socialist turned Iraq war cheerleader) almost as irritating to their new associates as they were to their old ones. But the 70 years between Chambers’ work with the Soviet spy apparatus and Hitchens’ support for the Bush administration saw such profound changes in the structure of U.S. politics that Oppenheimer’s attempt to place these six conversion stories in a common frame is less illuminating than one might hope. (The writer and critic Norman Podhoretz, the political theorist James Burnham, and Ronald Reagan are also included.) The left from which Chambers and Burnham seceded during the Cold War was an organized political force seeking a revolutionary transformation of American life. The left that Hitchens abandoned was less organized and less coherent. The difference between leaving the two was a bit like the difference between forsaking the Catholic Church and going home early from a dinner party. Podhoretz was the last to leave the Old Left, and Horowitz the first to leave the New Left; a closer focus on the similarities and differences between their experiences would have shed more light on the shifts in American political and intellectual life over the last generation."
