,title1,page_url,title2,first_paragraph
59,The Age of Insecurity,https://www.foreignaffairs.com/united-states/age-insecurity,The Age of Insecurity,"Over the past decade, many marginally democratic countries have become increasingly authoritarian. And authoritarian, xenophobic populist movements have grown strong enough to threaten democracy’s long-term health in several rich, established democracies, including France, Germany, the Netherlands, Sweden, the United Kingdom, and the United States. How worried should we be about the outlook for democracy?"
60,The Big Shift,https://www.foreignaffairs.com/articles/united-states/2018-04-16/big-shift,The Big Shift,"As Americans struggle to make sense of a series of uncomfortable economic changes and disturbing political developments, a worrying picture emerges: of ineffective politicians, frequent scandals, racial backsliding, polarized and irresponsible news media, populists spouting quack economic remedies, growing suspicion of elites and experts, frightening outbreaks of violence, major job losses, high-profile terrorist attacks, anti-immigrant agitation, declining social mobility, giant corporations dominating the economy, rising inequality, and the appearance of a new class of super-empowered billionaires in finance and technology-heavy industries."
61,Perception and Misperception on the Korean Peninsula,https://www.foreignaffairs.com/articles/north-korea/2018-04-05/perception-and-misperception-korean-peninsula,Perception and Misperception on the Korean Peninsula,"North Korea has all but completed its quest for nuclear weapons. It has demonstrated its ability to produce boosted-fission bombs and may be able to make fusion ones, as well. It can likely miniaturize them to fit atop a missile. And it will soon be able to deliver this payload to the continental United States. North Korea’s leader, Kim Jong Un, has declared his country’s nuclear deterrent complete and, despite his willingness to meet with U.S. President Donald Trump, is unlikely to give it up. Yet Washington continues to demand that Pyongyang relinquish the nuclear weapons it already has, and the Trump administration has pledged that the North Korean regime will never acquire a nuclear missile that can hit the United States. The result is a new, more dangerous phase in the U.S.–North Korean relationship: a high-stakes nuclear standoff."
62,The Right Way to Coerce North Korea,https://www.foreignaffairs.com/articles/north-korea/2018-04-01/right-way-coerce-north-korea,The Right Way to Coerce North Korea,"When it comes to North Korea, U.S. President Donald Trump’s policies have been whiplash inducing. On February 23, he appeared to be gearing up for a conflict when he said that if sanctions against Pyongyang didn’t work, Washington would have to move to “phase two,” which could be “very, very unfortunate for the world.” But just two weeks later, Trump abruptly changed course and accepted an invitation to meet with North Korean leader Kim Jong Un—a decision that caught even his own White House and State Department by surprise."
63,Fresh Prince,https://www.foreignaffairs.com/articles/middle-east/2018-03-19/fresh-prince,Fresh Prince,"It is not often that a Ritz-Carlton becomes a detention facility. But last November, when a large slice of the Saudi elite was arrested on accusations of corruption, the luxury hotel in Riyadh became a gilded prison for hundreds of princes, billionaires, and high-ranking government officials. Behind this crackdown was the young crown prince, Mohammed bin Salman, also known as MBS, who is attempting to remake the kingdom’s economy and social life, and even the House of Saud itself."
