,title1,page_url,title2,first_paragraph
0,Is Democracy Dying?,https://www.foreignaffairs.com/issue-packages/2018-04-16/democracy-dying,What’s Inside,"Centralization of power in the executive, politicization of the judiciary, attacks on independent media, the use of public office for private gain—the signs of democratic regression are well known. The only surprising thing is where they’ve turned up. As a Latin American friend put it ruefully, “We’ve seen this movie before, just never in English.”"
1,Building a Capable State: Service Delivery in Post-Apartheid South Africa,https://www.foreignaffairs.com/reviews/capsule-review/2018-04-16/building-capable-state-service-delivery-post-apartheid-south,Building a Capable State: Service Delivery in Post-Apartheid South Africa,"During apartheid, South Africa built local administrations that delivered social services at First World levels to the small white minority, even as they ignored the large black majority. The challenge after apartheid ended, in 1994, was to extend the same quality and quantity of services to the entire population. This lucid and detailed review of local administrations since then argues that they have made a great deal of progress in housing, public transportation, and sanitation. (Local governments are not responsible for education and health, so the authors pay little attention to those areas.) The book depicts an impressive level of pragmatism, dedication, and vision among the decision-makers who achieved this progress. But, the authors argue, officials have not done enough to address major problems of racial and geographic inequality. And the authors’ overall optimism is tempered by their worries about the corruption of President Jacob Zuma’s administration; completing this unfinished agenda is now up to Zuma’s successor, Cyril Ramaphosa."
2,African Dominion: A New History of Empire in Early and Medieval West Africa,https://www.foreignaffairs.com/reviews/capsule-review/2018-04-16/african-dominion-new-history-empire-early-and-medieval-west,African Dominion: A New History of Empire in Early and Medieval West Africa,"For a long time, Western historians downplayed the influence that West Africa’s precolonial political traditions have had on the region’s modern culture, economics, and politics. Even today, scholars’ understanding of the great West African medieval states remains hampered by weak and sometimes contradictory evidence, essentially limited to a small number of Arab sources, some complementary Portuguese and Spanish material, and what’s left of an important oral tradition. The earliest and most powerful of the kingdoms that emerged in West Africa, based on trading networks along the Niger and Senegal Rivers, were the Ghana, Mali, and Songhai empires, which dominated the region in succession from the eighth century to the sixteenth century. Gomez’s ambitious new study uses the available evidence to construct a remarkably detailed understanding of the rise and fall of these empires. His book is particularly cogent on the cultural, political, and administrative lineages that linked them; the growth of Islam; and the institution of slavery. There are more readable introductions to the region’s history, but none that is better informed."
3,The Next Factory of the World: How Chinese Investment Is Reshaping Africa,https://www.foreignaffairs.com/reviews/capsule-review/2018-04-16/next-factory-world-how-chinese-investment-reshaping-africa,The Next Factory of the World: How Chinese Investment Is Reshaping Africa,"This book is short on hard data and long on generalizations, but it is nonetheless worth reading because it expresses a popular argument: that China’s growing commercial interest in Africa is fundamentally altering the continent’s business climate and creating the possibility of a manufacturing revolution there. Sun is not concerned with the substantial deals that the Chinese state has brokered with the governments of oil-rich countries, such as Angola. Instead, she focuses on the many Chinese entrepreneurs who are undertaking smaller ventures in Ethiopia, Kenya, Lesotho, and Nigeria. She argues that independent Chinese investors are spearheading the current rapid economic growth in those countries thanks to a willingness to take risks that Western businesses will not. Yet although she tells revealing anecdotes about individual firms, she never provides the kind of systematic data that would make her case convincing. The book is also frustratingly silent on what Chinese investors have done to overcome high labor costs and poor infrastructure, the main constraints on the competitiveness of African manufacturing."
4,Soldiers in Revolt: Army Mutinies in Africa,https://www.foreignaffairs.com/reviews/capsule-review/2018-04-16/soldiers-revolt-army-mutinies-africa,Soldiers in Revolt: Army Mutinies in Africa,"Most of the literature on African militaries focuses either on the officers or on the relationship between the brass and civilian politicians. Dwyer’s compelling study of mutinies in West Africa, which are growing increasingly common, is welcome because it concentrates on the rank and file and noncommissioned officers, the groups that are most likely to rebel. She shows that insurrections follow a different logic from coups, as mutinies are not typically motivated by a desire for regime change. Instead, soldiers start them to make demands about their material conditions and communicate their unhappiness with specific officers or policies. Dwyer suggests that two factors have increased the frequency of mutinies in recent years. First, the democratization of several countries in the region has spurred all Africans to voice public grievances, and soldiers are no exception. Second, she finds that mutinies are more likely in armies that are involved in international peacekeeping operations, because the extra pay they entail generates greater inequality between ranks and because they present substantially more risk to individual soldiers, which makes them more likely to question the military hierarchy."
5,Congo's Violent Peace: Conflict and Struggle Since the Great African War,https://www.foreignaffairs.com/reviews/capsule-review/2018-04-16/congos-violent-peace-conflict-and-struggle-great-african-war,Congo’s Violent Peace: Conflict and Struggle Since the Great African War,"Berwouts’ savvy history explores how the Democratic Republic of the Congo has changed since the official end of the war that devastated the country from the late 1990s to the early years of this century. Recent analyses of Congo have tended to discuss either the political dynamics in the capital or the persistent outbreaks of ethnic violence and human rights abuses in the country’s east, with its complex and ever-changing array of armed groups. Berwouts shows how the two are linked. Local ethnic conflicts over land and resources have been exacerbated by a combination of neglect and short-term political manipulation by the Congolese state. Other countries in the region, mostly notably Rwanda, have also stirred up trouble. The predatory, although largely incompetent, regime of President Joseph Kabila has survived for 17 years but failed to build a state capable of promoting development or stabilizing the eastern provinces. Berwouts ends with a pessimistic review of recent popular protests over Kabila’s attempts to grant himself a third term without holding elections. Today, Berwouts believes, Congo is once again facing a descent into violence."
6,China as a Polar Great Power,https://www.foreignaffairs.com/reviews/capsule-review/2018-04-16/china-polar-great-power,China as a Polar Great Power,"In this study of China’s efforts to become the only nation other than the United States capable of operating comprehensively in both the Arctic and Antarctica, Brady opens up a new frontier of insight into an area of international relations all but ignored by Western scholarship. She draws on a wide range of Chinese sources to offer eye-opening revelations about China’s burgeoning polar activities. Beijing regards the polar regions as vital domains for fishing and shipping and hopes to exploit their rich reserves of energy and minerals. It also plans to use its activities there to grow China’s global influence, something that Washington has encouraged by largely ignoring the issue. Beijing talks little about its polar activities and is deliberately ambiguous when it does, meaning that these moves have drawn little notice outside specialized professional communities. Yet as a component of an ambitious grand strategy laid out by President Xi Jinping, China’s development as a polar great power will shape how the changing global order is governed. Brady’s book provides the best place to start for understanding the genesis, motivations, and dynamics of China’s exploits in the ice."
7,End of an Era: How China's Authoritarian Revival is Undermining Its Rise,https://www.foreignaffairs.com/reviews/capsule-review/2018-04-16/end-era-how-chinas-authoritarian-revival-undermining-its-rise,End of an Era: How China’s Authoritarian Revival is Undermining Its Rise,"As Xi Jinping embarks on his second five-year term as China’s top leader, Minzner delivers a withering assessment of his first one, in a well-informed contribution to the flourishing declinist school of China analysis. Over the last five years, Xi has intensified his retreat from reform. A reversal of economic liberalization has led to widening income inequality, calcifying class lines, and an economic slowdown. Instead of advancing fairness in the legal system and transparency in media, Xi has tightened social control so that grievances intensify without finding outlets other than Internet rants, mob violence, and illegal protests. State control of religion drives many believers into underground sects. By concentrating an unprecedented amount of power in himself, Xi is destroying hard-won rules of the political game that contributed to regime stability. All this repression breeds resistance, and resistance breeds further repression, in a cycle that Minzner predicts will end badly."
8,China's Eurasian Century? Political and Strategic Implications of the Belt and Road Initiative,https://www.foreignaffairs.com/reviews/capsule-review/2018-04-16/chinas-eurasian-century-political-and-strategic-implications-belt,China’s Eurasian Century? Political and Strategic Implications of the Belt and Road Initiative,"Billions of dollars are flowing out of China, as part of the country’s Belt and Road Initiative, to build ports, railways, roads, pipelines, and telecommunications facilities across the Eurasian land mass (the “belt”) and along the coast of the Indian Ocean (the “road”). The physical infrastructure undergirds growing trade, financial, academic, and political networks. Chinese President Xi Jinping’s rhetoric about a wealthy China giving back to the world and win-win cooperation is not without foundation, as hungry governments, not just in the developing world but also in Europe, gratefully soak up Chinese investments. But Rolland’s helpful survey reveals the initiative’s strategic motives, which include providing outlets for China’s excess production capacity and generating a Eurasian center of gravity as a counterweight to U.S. influence in maritime Asia. Rolland speculates that Xi’s long-term vision is to create a world order in which Western-style rule of law and democracy promotion are replaced by deference to Chinese interests and the international application of Chinese “stability maintenance” techniques."
9,India Turns East: International Engagement and US-China Rivalry,https://www.foreignaffairs.com/reviews/capsule-review/2018-04-16/india-turns-east-international-engagement-and-us-china-rivalry,India Turns East: International Engagement and US-China Rivalry,"Since the early 1990s, most Indian strategists have viewed China as their country’s main security threat. One result has been New Delhi’s cooperation with Washington—halting and ambivalent though it is. Less well known is India’s Look East Policy, formally adopted in 1992, by which New Delhi has sought to increase its economic, diplomatic, and security ties with countries and institutions in East Asia and Southeast Asia. This useful survey finds that the policy has generated a number of joint declarations but only modest programs of defense cooperation, intelligence sharing, and arms sales with partners such as Japan, Singapore, and Vietnam. India signed a free-trade agreement with the Association of Southeast Asian Nations and pivoted from suspicion of to engagement with ASEAN’s associated institutions. But India’s attempts to strengthen ties with Australia and Myanmar have been hampered by both countries’ reluctance to antagonize China. Indeed, India itself does not want to confront China. Grare cautions that the Look East Policy does not offer the congruence with U.S. strategies that some Washington policymakers like to imagine."
10,Making Money: How Taiwanese Industrialists Embraced the Global Economy,https://www.foreignaffairs.com/reviews/capsule-review/2018-04-16/making-money-how-taiwanese-industrialists-embraced-global-economy,Making Money: How Taiwanese Industrialists Embraced the Global Economy,"One crucial element of Taiwan’s economic success, which began in the 1960s—and equally of its economic slowdown, which started in the 1990s—was the agility of its small and medium-sized “contract manufacturers,” firms that produce consumer products for U.S. brands such as Apple and Timberland but have no brand names of their own. By studying the Taiwanese entrepreneurs who built these firms, Hamilton and Kao shed light on the relationship between globalization and the Asian economic miracle. These entrepreneurs sprang out of the countryside in response to the needs of the growing U.S. consumer market. They drew on family and social networks for capital, labor, and parts suppliers and to help organize production. Whether making cell phones or footwear, the best of these firms have adjusted to changing market conditions, repeatedly innovating their product lines and production methods. This was a boon for Taiwan. But as the island developed, the costs of labor and parts went up, and many Taiwanese entrepreneurs moved their production to China. (Some firms are now leaving China for Southeast Asia and even, in some cases, the United States.) As these companies departed, the Taiwanese economy slowed. Nevertheless, Taiwanese-owned firms remain among the top contract manufacturers in the world."
11,"The Return of Bipolarity in World Politics: China, the United States, and Geostructural Realism",https://www.foreignaffairs.com/reviews/capsule-review/2018-04-16/return-bipolarity-world-politics-china-united-states-and,"The Return of Bipolarity in World Politics: China, the United States, and Geostructural Realism","Tunsjo challenges the prevailing view of U.S.-Chinese relations, arguing that even though China is not the military or economic equal of the United States, it is powerful enough to serve as what theorists call a second “pole” in the international system. That makes today’s international system not multipolar, as most analysts believe, but bipolar. But he argues that today’s bipolar system differs from that of the Cold War because of geographic differences between Europe and Asia. Chinese and U.S. forces do not face each other on land, the way that Soviet and U.S. forces did, so Tunsjo considers a direct superpower confrontation less likely than it was during the Cold War. Proxy wars are also less likely, because China’s security concerns are primarily regional rather than global. But he sees a high risk of conflict in maritime East Asia, where today’s superpowers both have vital interests. His views provide valuable nuance for the growing number of analysts who are worried about the strategic implications of China’s rise."
12,Authoritarian Advance: Responding to China's Growing Political Influence in Europe,https://www.foreignaffairs.com/reviews/capsule-review/2018-04-16/authoritarian-advance-responding-chinas-growing-political,Authoritarian Advance: Responding to China’s Growing Political Influence in Europe,"This pathbreaking report investigates the ways in which China seeks to shape politics and public opinion in Europe. The Chinese Communist Party uses governmental and ostensibly private wealth in overt and covert ways to influence political and economic elites, the media and public opinion, and civil society and academia. Some European states have begun to adopt a stance of “preemptive obedience” to Chinese interests on issues such as human rights. The authors name some of China’s “willing enablers,” including former British Prime Minister David Cameron, who took a post with a Chinese-sponsored infrastructure investment fund after leaving office, and former French Prime Minister Jean-Pierre Raffarin, who accepted a role in a Chinese cultural-exchange foundation. To protect the integrity of Western systems without violating their character as liberal democracies, the report recommends screening Chinese investments, banning foreign support for political parties, providing help to poorer EU members that are vulnerable to Chinese financial pressure, and promoting transparency for universities, media organizations, and politicians that accept Chinese support. The report also covers similar patterns in Australia and New Zealand, where Chinese influence efforts are even more advanced, and in the United States, where they are expanding rapidly."
13,The Ultimate Life Hacker,https://www.foreignaffairs.com/interviews/2018-04-16/ultimate-life-hacker,The Ultimate Life Hacker,"At the age of 12, Jennifer Doudna read James Watson’s The Double Helix and got hooked on science in general and genetics in particular. Four decades later, she is a molecular biology professor at the University of California, Berkeley, an investigator with the Howard Hughes Medical Institute, and a researcher at the Lawrence Berkeley National Laboratory. One of the discoverers of CRISPR, a powerful new technology for gene editing, Doudna tells the story of the current genetics revolution in her gripping new memoir, A Crack in Creation (written with Samuel Sternberg). She spoke with Foreign Affairs’ editor, Gideon Rose, in her office in Berkeley in February."
14,"Saudi, Inc.: The Arabian Kingdom's Pursuit of Profit and Power",https://www.foreignaffairs.com/reviews/capsule-review/2018-04-16/saudi-inc-arabian-kingdoms-pursuit-profit-and-power,"Saudi, Inc.: The Arabian Kingdom’s Pursuit of Profit and Power","Wald has written a competent history of the Saudi Arabian Oil Company (Saudi Aramco) and of how the House of Saud came to dominate the Arabian Peninsula in the 1920s. The book is built on interviews, U.S. government records, and the work of other historians, but not Saudi Aramco’s archives. Its most original parts deal with the Saudi government’s “long game” to gain full control of Aramco while avoiding outright nationalization. That project was completed in 1980, when, after decades of gradually increasing its influence over the company, the government acquired the entire firm. In the resulting arrangement, Aramco owned the expertise, but the kingdom owned the oil it produced. Throughout Aramco’s history, Saudi Arabia has always found a way to make money selling oil, shape world petroleum prices, and avoid lasting confrontation with the United States. Even the 1973 embargo of oil exports to the United States, imposed by the Arab members of OPEC in retaliation for U.S. support of Israel during the Yom Kippur War, did not do long-term damage to the U.S.-Saudi alliance."
15,The Muslim Brotherhood and the West: A History of Enmity and Engagement,https://www.foreignaffairs.com/reviews/capsule-review/2018-04-16/muslim-brotherhood-and-west-history-enmity-and-engagement,The Muslim Brotherhood and the West: A History of Enmity and Engagement,"Frampton exhaustively chronicles the history of the Muslim Brotherhood from its founding in 1928 to the Arab Spring of 2011. Before the 1970s, the West viewed Islam as a spent force, but then in the middle of that decade, militant jihadists became active in Egypt, and in 1979, the Islamic Republic of Iran was born. Subsequently, Western governments saw Islam as an integral part of politics, but they never solved the riddle of how to embrace it, and the United States never broke with any of its more secular authoritarian allies. As Frampton demonstrates, the United Kingdom and the United States never treated the Brotherhood as more than a possible tactical ally in the struggle against communism or as a bulwark against more extreme forms of Islam. There were exceptions, such as the British historian H. A. R. Gibb, who preferred the Brotherhood to military dictators in Egypt, but they were few and far between. Despite what many Egyptians believe, there is little evidence that the United States has actively sought to bring the Brotherhood to power."
16,Iraq and the Politics of Oil: An Insider's Perspective,https://www.foreignaffairs.com/reviews/capsule-review/2018-04-16/iraq-and-politics-oil-insiders-perspective,Iraq and the Politics of Oil: An Insider’s Perspective,"Vogler, a former ExxonMobil executive, recounts the seven years he spent on and off in Iraq between 2003 and 2015 working to rebuild the oil sector. Most of the book deals with his on-the-ground experiences, offering considerable detail about the main Iraqi and foreign actors, but it ends on a more provocative note. By 2014, Vogler had become convinced that the 2003 U.S. invasion of Iraq was driven in large part by a plan worked up by Ahmed Chalabi, the head of the Iraqi National Congress, and a cluster of neoconservative policymakers in the Bush administration. The aim of the plan was to reopen a pipeline from Kirkuk, in Iraq, to Haifa, in Israel, that had been closed since Israel’s founding in 1948 and which would provide Israel with a major source of oil and substantial transit fees. Ultimately, this quixotic scheme never saw the light of day. The most likely explanation is that the White House viewed it as a possible dividend of the invasion, but not as a major impetus for going to war."
17,Fifty Million Rising: The New Generation of Working Women Transforming the Muslim World,https://www.foreignaffairs.com/reviews/capsule-review/2018-04-16/fifty-million-rising-new-generation-working-women-transforming,Fifty Million Rising: The New Generation of Working Women Transforming the Muslim World,"Between 2000 and 2015, 50 million Muslim women joined the global work force, raising the total to 150 million, with a combined income of $1 trillion. Zahidi, a member of the Executive Committee of the World Economic Forum, is one of them. In this lucid presentation, she draws on 200 interviews to depict an inexorable march forward for Muslim women, who are set to make up over 30 percent of the global Muslim work force by 2030. Zahidi feels no need to mount an Islamic defense of women’s right to work and argues that for now, Muslim women should avoid directly confronting the patriarchy. For a time, they will have to do it all: absorb most of the domestic work and master the job market. The Internet, the gig economy, and the traditional extended family can all make the transition easier. So can governments, by improving Internet access for women, promoting education, providing more public transport, reforming workplace rules, and more."
18,We Crossed a Bridge and It Trembled: Voices from Syria,https://www.foreignaffairs.com/reviews/capsule-review/2018-04-16/we-crossed-bridge-and-it-trembled-voices-syria,We Crossed a Bridge and It Trembled: Voices from Syria,"This collection of hundreds of excerpts from interviews of refugees who have fled the violence that has gripped Syria since 2011 makes for sickening, although unsurprising, reading. The brutality, greed, and cynicism of the leading actors led one refugee to say, “I’ve reached a point in my life where I hate everything. I am disgusted by humanity.” Another, contemplating the rise of al Qaeda and the Islamic State (also known as ISIS), explained, “You are in dire need for a narrative that can justify the futility.” The excerpts follow the major stages of the violence as experienced by the refugees: the peaceful revolution, the government’s violent response, the meat grinder of aerial assault and prison torture, the flight abroad, and the process of starting anew. The observations of Assad supporters, religious extremists, and members of foreign proxies, such as Hezbollah, are missing. But that is unsurprising: refugees are not likely to be loyalists."
