,title1,page_url,title2,first_paragraph
37,"Illiberal Reformers: Race, Eugenics, and American Economics in the Progressive Era",https://www.foreignaffairs.com/reviews/capsule-review/2016-04-14/illiberal-reformers-race-eugenics-and-american-economics,"Illiberal Reformers: Race, Eugenics, and American Economics in the Progressive Era","Those puzzled by the ease with which contemporary progressive political movements have turned against liberal values such as free speech will find much material for reflection in Leonard’s lucid intellectual history of early twentieth-century progressivism. From the beginning, the Progressive movement saw itself as a rival of nineteenth-century liberalism, not simply in the sphere of economics (replacing laissez faire with a more regulated economy) but also in the arena of individual liberties and rights. The advances of the late nineteenth century had led many intellectuals to believe that educated experts could make better decisions than the uninformed could make for themselves. Progressives aimed at social, economic, and natural engineering on a vast scale. Immigration restrictions, prohibition, and forced sterilization of “undesirable” members of the gene pool would reshape the lower classes; meanwhile, economic regulation would maintain fairness by limiting the power of corporate trusts. Leonard’s commendable book illuminates one phase in the centuries-long American struggle between the quest for liberal values and the impulse to build a godly commonwealth on the back of a strong state."
38,The Civil Wars of Julia Ward Howe: A Biography,https://www.foreignaffairs.com/reviews/capsule-review/2016-04-14/civil-wars-julia-ward-howe-biography,The Civil Wars of Julia Ward Howe: A Biography,"Julia Ward Howe was born in 1819. Her father, Samuel Ward III, was one of New York City’s most successful bankers, and young Julia was educated by some of the country’s leading scholars. A beauty and an heiress, she fell in love with and married Samuel Howe, a charismatic American hero of the Greek War of Independence, progressive political activist, and internationally famous pioneer in the education of the blind. Her books of poetry were met with wide acclaim, and her husband stood by her even as she scandalized the American artistic community in Rome with her unconventional lifestyle and published thinly veiled poetic accounts of their marital troubles. Her poem “The Battle Hymn of the Republic” became one of the great anthems of the American Civil War and made her a national celebrity as she traveled the country advocating women’s suffrage and other causes. Showalter casts Howe’s story as a feminist struggle against patriarchal oppression. This seems a bit overdone: Howe had her frustrations, but few people of any gender have had as much scope for their talents or received as much applause for their accomplishments as this authentically gifted, but also quite privileged, American artist."
39,Blood Year: The Unraveling of Western Counterterrorism; United States of Jihad: Investigating America’s Homegrown Terrorists,https://www.foreignaffairs.com/reviews/capsule-review/2016-04-14/blood-year-unraveling-western-counterterrorism-united-states,Blood Year: The Unraveling of Western Counterterrorism; United States of Jihad: Investigating America’s Homegrown Terrorists,"These two books address very different sides of the same coin. Both are written by leading figures in the field: Kilcullen made his name as both a theorist and a practitioner of counterinsurgency, and Bergen has written extensively about radical Islamist groups. Kilcullen addresses the rise of the Islamic State (also known as ISIS), particularly in the Middle East, whereas Bergen concentrates on the phenomenon of Islamist radicalization inside the United States. Both subjects have taken on added urgency in the wake of recent events, notably the ISIS-related terrorist attacks last year in Paris and San Bernardino, California."
40,My Journey at the Nuclear Brink; The Case for U.S. Nuclear Weapons in the 21st Century,https://www.foreignaffairs.com/reviews/capsule-review/2016-04-14/my-journey-nuclear-brink-case-us-nuclear-weapons-21st-century,My Journey at the Nuclear Brink; The Case for U.S. Nuclear Weapons in the 21st Century,"Our ability to survive the nuclear age for so long is an impressive achievement, but it is hard to avoid the nagging feeling that at some point humankind’s luck will run out. Until nuclear weapons are somehow eliminated, we have little choice but to rely on deterrence and a taboo (of uncertain strength) against their use. Meanwhile, governments must make every effort to limit the number of nuclear-armed states, reduce the number of nuclear weapons that exist, and narrow the options for their use."
41,The Winter Fortress: The Epic Mission to Sabotage Hitler’s Atomic Bomb,https://www.foreignaffairs.com/reviews/capsule-review/2016-04-14/winter-fortress-epic-mission-sabotage-hitlers-atomic-bomb,The Winter Fortress: The Epic Mission to Sabotage Hitler’s Atomic Bomb,"At the heart of this book is the story of the heroic and successful efforts of a small group of Norwegian patriots who sabotaged a German-controlled hydroelectric plant in Vemork, Norway, in February 1943. At the time, the plant was the world’s only source of heavy water, a component of the uranium enrichment process. This was not the first or last attempt to deny Germany access to heavy water. In this authoritative account, Bascomb also describes how a few months before, there had been a calamitous mission undertaken by British commandos, which failed when their gliders crash-landed far from their target; the Germans later executed the surviving soldiers. In November 1943, nine months after the Norwegians’ successful mission, it became apparent that the Germans had started up production again, so the U.S. Army Air Forces bombed the plant. Finally, in 1944, there was a terminal act of sabotage, when two Norwegians sank a ferry carrying the last remaining containers of heavy water to Germany. Germany’s equivalent to the Manhattan Project might well have failed on its own, without these efforts, but it would have been too risky to assume as much. Bascomb offers a vivid and gripping narrative that conveys the heroism and dedication of the anti-Nazi operatives, especially in the face of severe weather conditions, and also delves into the ethics of resistance, which sometimes involves implicating or even killing innocent people."
42,Beyond the Tragedy in Global Fisheries,https://www.foreignaffairs.com/reviews/capsule-review/2016-04-14/beyond-tragedy-global-fisheries,Beyond the Tragedy in Global Fisheries,"Climate change, a relatively recent concern, dominates contemporary discussions of shared resources and “the tragedy of the commons.” Webster’s comprehensive, although somewhat jargony, book reminds readers of another tragedy—the overexploitation of ocean fisheries—and explores attempts to prevent or overcome it, a battle that people have waged for centuries. Every commercial fishing firm wants to catch as many fish as it can. But without restraints, fisheries ultimately collapse, particularly as fishing technology advances. Webster documents and evaluates conservation efforts, which sometimes succeed but mostly fail, usually owing to the political clout of major commercial fishing concerns looking out for their short-term economic interests. This track record does not set a happy precedent for attempts to limit global emissions of greenhouse gases."
43,Have Bacteria Won?,https://www.foreignaffairs.com/reviews/capsule-review/2016-04-14/have-bacteria-won,Have Bacteria Won?,"High-profile pandemics and the spread of drug-resistant microbes have fueled fears about humanity’s ability to contend with the scourge of viruses and bacteria. But Pennington answers the question posed by his title with a resounding no: the microbes have not “won.” He warns, however, that it would be an error to conclude that they have lost. Humans have made astounding progress during the past century in bringing tiny parasites under control, but the war against them—to use a metaphor the author dislikes—will continue indefinitely, thanks to their collective resilience. Some outbreaks are genuine, but many alleged microbial emergencies are mostly ginned up by the media, which find it expedient to misreport and exaggerate bacterial or viral threats, sometimes out of ignorance, sometimes willfully. The book offers brief but informative discussions of recent real and not-so-real pandemics."
44,"Rich People, Poor Countries: The Rise of Emerging-Market Tycoons and Their Mega Firms",https://www.foreignaffairs.com/reviews/capsule-review/2016-04-14/rich-people-poor-countries-rise-emerging-market-tycoons-and-their,"Rich People, Poor Countries: The Rise of Emerging-Market Tycoons and Their Mega Firms","The mass media are always happy to feed the public’s appetite for details about how the rich and famous live. Much rarer is the kind of careful analysis of the sources and consequences of great wealth that Freund offers in this book. She relies on Forbes’ annual list of billionaires and focuses on those who hail from developing countries. There were 705 developing-world billionaires in 2014, up from 102 in 2001. The vast majority of these ultrarich are self-made, rather than people who inherited their wealth. Most founded or managed new companies that grew rapidly in terms of sales and employment, thus contributing to the overall economic growth of the countries where they were established. But the emergence of billionaires has also contributed to the rise of income inequality in the countries of the developing world, which Freund views as a logical consequence of rapid economic growth and changing economic structures—even while, from a global point of view, inequality falls, as more and more people escape poverty or join the ranks of new middle classes."
45,Global Inequality: A New Approach for the Age of Globalization,https://www.foreignaffairs.com/reviews/capsule-review/2016-04-14/global-inequality-new-approach-age-globalization,Global Inequality: A New Approach for the Age of Globalization,"Milanovic, a former World Bank official and an authority on global inequality, attributes the recent rise of inequality within the United States and other countries to technological advancement and globalization, two trends that he argues are impossible to disentangle. But those trends have also produced a sharp decline in overall global inequality since 1980, by permitting rapid growth in poor countries, most notably China, which has helped narrow the gap between the world’s haves and its have-nots. Milanovic expects that process to continue, unless China, India, and other populous Asian countries seriously falter. He believes that growing inequality within countries will not threaten capitalism as a system for allocating economic resources but will pose a serious threat to liberal democracy. As middle classes everywhere get squeezed, the United States will become even more plutocratic, and nativistic populism will become more mainstream in Europe—a process that is already under way, aided in no small part by the influx of migrants, a feature of globalization that is likely to only intensify."
46,"From the Other Side of the World: Extraordinary Entrepreneurs, Unlikely Places",https://www.foreignaffairs.com/reviews/capsule-review/2016-04-14/other-side-world-extraordinary-entrepreneurs-unlikely-places,"From the Other Side of the World: Extraordinary Entrepreneurs, Unlikely Places","The core of this interesting book is a set of profiles of seven successful and innovative entrepreneurs, each one hailing from a different major country with an emerging economy. The United States looms large in their stories: some of them had experience studying or working in the United States, others drew on U.S. venture capital, and most were inspired by successful American start-ups. Based on detailed interviews with the entrepreneurs and their colleagues, Bayrasli reveals significant institutional obstacles that stand in the way of starting and sustaining new businesses in emerging markets, even in countries that officially aspire to modernization, growth, and the creation of nonagricultural employment: politically supported barriers to entry, a shortage of skilled workers, licensing requirements that facilitate bribery—and, for those who don’t play along with the unwritten rules, outright extortion and unjustified threats of criminal indictment. But the stories in this book demonstrate that talent and perseverance can overcome even those formidable roadblocks. Reducing the barriers might unleash astounding economic performance."
47,"The Seventh Sense: Power, Fortune, and Survival in the Age of Networks",https://www.foreignaffairs.com/reviews/capsule-review/2016-04-14/seventh-sense-power-fortune-and-survival-age-networks,"The Seventh Sense: Power, Fortune, and Survival in the Age of Networks","Some thinkers see history as constant or cyclical; others see it as evolutionary or directional. Ramo is in the latter camp, and his bold new book is an attempt to sketch the contours of the new “age of networks” he sees aborning. A few centuries ago, in his telling, the Enlightenment and the scientific revolution gave birth to the modern world, with its capitalism, democracy, global trade, and industrial power. Today, the spread of networks and constant, ever-faster connections is creating a new kind of order with new sources of strength. Power is both more concentrated and more distributed than ever before, traditional assets become irrelevant almost overnight, and all that is solid melts into air—or, rather, into pulses of information. Individuals, firms, and nations that can appreciate and master the new order will flourish; those that can’t will flounder. Skeptics may find this all a bit overwrought and bewildering; Ramo would consider such responses the hallmark of those destined to be left behind."
48,Connectography: Mapping the Future of Global Civilization,https://www.foreignaffairs.com/reviews/capsule-review/2016-04-14/connectography-mapping-future-global-civilization,Connectography: Mapping the Future of Global Civilization,"Khanna is not shy about making bold claims, and his exploration of today’s vast and expanding networks and pathways of transportation and communication leads him to declare that, in the future, “cities will matter more than states and supply chains will be a more important source of power than militaries.” That seems like a stretch. Still, with an eye for vivid details, Khanna has nevertheless produced an engaging geopolitical travelogue, unearthing the Internet cables, energy pipelines, and electrical grids that link regions together more closely than ever before and allow people to lead increasingly connected lives. In his view, connectivity is transforming conflict between states into competition for access to the world’s infrastructure of networks and markets. A world of nation-states, he argues, is becoming a world of nodes and transit hubs: a “global network civilization.” And yet the actual stories of globalization in the book still revolve around big players such as China, India, Russia, the United States, and Europe. The influence of these traditional geopolitical powers might ebb and flow, but it is hardly disappearing. In that sense, the new, more connected world does not seem all that different from the old, less connected one."
49,Societies Under Siege: Exploring How International Economic Sanctions (Do Not) Work,https://www.foreignaffairs.com/reviews/capsule-review/2016-04-14/societies-under-siege-exploring-how-international-economic,Societies Under Siege: Exploring How International Economic Sanctions (Do Not) Work,"Proponents of international sanctions regimes usually argue that by restricting economic interactions and thus creating popular discontent, sanctions can put pressure on governments to change their policies. But in closely examining the various ways in which sanctions affect the interests, resources, and strategies of different political groups, Jones finds that things don’t always turn out that way. In South Africa in the 1980s, an internationally enforced embargo ultimately fragmented the ruling bloc and empowered progressive political and business groups that pushed for an end to apartheid. In Iraq during the 1990s, Jones argues, sanctions seriously weakened Saddam Hussein’s ruling coalition, but his regime managed to hang on to power. In recent years in Myanmar (also known as Burma), sanctions actually strengthened the ruling bloc, at least for a time, as the regime found ways to push the costs onto nonstate groups. Given this mixed record, Jones finds it difficult to draw general conclusions. He speculates that countries with middle classes that enjoy some independence from the state are the mostly likely to respond to sanctions as intended. But Jones’ central message is that enthusiasm for sanctions should be tempered by an appreciation of their complex, unpredictable, and sometimes counterproductive effects. Past performance is no guarantee of future results."
50,State Capitalism: How the Return of Statism Is Transforming the World,https://www.foreignaffairs.com/reviews/capsule-review/2016-04-14/state-capitalism-how-return-statism-transforming-world,State Capitalism: How the Return of Statism Is Transforming the World,"Kurlantzick argues that a new era of state capitalism has dawned. The authoritarian governments of China and Russia are the best-known practitioners of modern-day statism, but in this masterful survey, Kurlantzick shows that a shift toward state capitalism is also occurring in major democratic developing countries, such as Argentina, Brazil, India, and Indonesia, where governments have taken controlling ownership stakes in many of the largest companies. As Kurlantzick demonstrates, this new state capitalism, unlike older versions, is generally compatible with outward-looking trade and investment policies. It can also help developing countries access globalized sectors such as telecommunications, banking, and energy. Kurlantzick’s analysis brings to mind Andrew Shonfield’s Modern Capitalism, the classic 1965 account of a shifting balance between public and private control in the postwar economies of Europe and the United States. Then, as now, governments sought to maintain stability while also taking advantage of opportunities in a rapidly evolving global capitalist system. Kurlantzick, however, sees slightly more ominous possibilities today, emphasizing the risk that countries will increasingly turn away from market-oriented models, embrace protectionism, and restrict political freedoms."
51,Democracy in Decline?; The Puzzle of Non-Western Democracy,https://www.foreignaffairs.com/reviews/capsule-review/2016-04-14/democracy-decline-puzzle-non-western-democracy,Democracy in Decline?; The Puzzle of Non-Western Democracy,"Liberal democracy is in trouble. The great wave of democratization that spread across the developing world at the end of the Cold War has long since crested. Today, it is the undertow of dashed expectations that seems to define the fate of modern democracy: political gridlock, economic stagnation, increasing inequality, fraying social contracts, reactionary nationalism, and rising authoritarianism. In their illuminating collection, Diamond and Plattner have assembled leading experts who offer mostly grim assessments of the situation. Diamond, in his own contribution, sifts through the data and reports that the democratic world is in “recession,” sharing the stunning observation that during the past three decades, fully 24 percent of the world’s democracies have broken down. Some have been the victim of military coups, but more often, democracies have experienced a slow degradation of political rights and legal procedures through electoral fraud and the rise of authoritarian leaders. Robert Kagan emphasizes the importance of geopolitical leadership as a stabilizer and promoter of democracy. But such leadership is difficult to provide when the main leader—the United States—is itself so troubled. Francis Fukuyama points to the failure of new democracies to build functioning modern states, which is an essential precondition for high-quality governance. The only good news that the contributors offer is that authoritarian states remain unstable and incapable of mastering the long-term challenges of modernizing societies and economies."
52,Bursting the Bubble,https://www.foreignaffairs.com/articles/united-states/2016-04-06/bursting-bubble,Bursting the Bubble,"Sanford Ungar (“The Study-Abroad Solution,” March/April 2016) convincingly argues that sending more U.S. college and university students to study abroad will “produce future generations of Americans who will know more and care more about the rest of the world.” But the way students spend their time abroad matters as much as whether they travel abroad in the first place."
53,Getting Rome Right,https://www.foreignaffairs.com/articles/europe/2016-04-06/getting-rome-right,Getting Rome Right,"Michael Fontaine’s review of Mary Beard’s SPQR (“What Rome Can Teach Us Today,” March/April 2016) contains several serious flaws. First, Fontaine writes that the phrase Senatus Populusque Romanus, or “the Senate and the People of Rome,” was “an advertisement for the link between Rome’s citizens and its elected leaders.” The term did name two distinct and separate categories of people whose collaboration through Rome’s complex political institutions marked its form of government. But the people did not elect the Senate, and the Senate was often in conflict with those who were elected to office by the citizens of Rome."
54,No Law of Anarchy,https://www.foreignaffairs.com/articles/russia-fsu/2016-04-06/no-law-anarchy,No Law of Anarchy,"Robert Kaplan (“Eurasia’s Coming Anarchy,” March/April 2016) correctly identifies the domestic weaknesses of Russian President Vladimir Putin’s regime. By arguing that these difficulties have produced “naked” aggression on Russia’s part, however, Kaplan suggests a relationship between domestic affairs and foreign policy that does not always hold."
55,We Are All Geoeconomists Now,https://www.foreignaffairs.com/articles/2016-04-06/we-are-all-geoeconomists-now,We Are All Geoeconomists Now,"Robert Blackwill and Jennifer Harris (“The Lost Art of Economic Statecraft,” March/April 2016) argue that the United States no longer uses economic instruments to accomplish geopolitical objectives. Nothing could be further from the truth. In fact, most major U.S. international economic initiatives from World War II until today were undertaken primarily for foreign policy reasons."
56,The Clean Energy Revolution,https://www.foreignaffairs.com/articles/united-states/2016-04-18/clean-energy-revolution,The Clean Energy Revolution,"As the UN Climate Change Conference in Paris came to a close in December 2015, foreign ministers from around the world raised their arms in triumph. Indeed, there was more to celebrate in Paris than at any prior climate summit. Before the conference, over 180 countries had submitted detailed plans to curb their greenhouse gas emissions. And after two weeks of intense negotiation, 195 countries agreed to submit new, stronger plans every five years."
57,The Age of Transparency,https://www.foreignaffairs.com/articles/world/2016-04-18/age-transparency,The Age of Transparency,"Transparency has long been a rare commodity in international affairs. But today, the forces of technology are ushering in a new age of openness that would have been unthinkable just a few decades ago. Governments, journalists, and nongovernmental organ­izations (NGOs) can now harness a flood of open-source information, drawn from commercial surveillance satellites, drones, smartphones, and computers, to reveal hidden activities in contested areas—from Ukraine to Syria to the South China Sea."
58,The Fusion of Civilizations,https://www.foreignaffairs.com/world/fusion-civilizations,The Fusion of Civilizations,"The mood of much of the world is grim these days. Turmoil in the Middle East, causing hundreds of thousands of deaths and millions of refugees; random terrorist attacks across the globe; geopolitical tensions in eastern Europe and Asia; the end of the commodity supercycle; slowing growth in China; and economic stagnation in many countries—all have combined to feed a deep pessimism about the present and, worse, the future."
59,The Fed and the Great Recession,https://www.foreignaffairs.com/articles/united-states/2016-04-18/fed-and-great-recession,The Fed and the Great Recession,"Today, there is essentially one accepted narrative of the economic crisis that began in late 2007. Overly optimistic homebuyers and reckless lenders in the United States created a housing price bubble. Regulators were asleep at the switch. When the bubble inevitably popped, the government had to bail out the banks, and the United States suffered its deepest and longest slump since the 1930s. For anyone who has seen or read The Big Short, this story will be familiar."
