,title1,page_url,title2,first_paragraph
61,The Austerity Delusion,https://www.foreignaffairs.com/europe/austerity-delusion,The Austerity Delusion,"Unable to take constructive action toward any common end, the U.S. Congress has recently been reduced to playing an ongoing game of chicken with the American economy. The debt-ceiling debacle gave way to the “fiscal cliff,” which morphed into the across-the-board cuts in military and discretionary spending known as “sequestration.” Whatever happens next on the tax front, further cuts in spending seem likely. And so a modified form of the austerity that has characterized policymaking in Europe since 2010 is coming to the United States as well; the only questions are how big the hit will end up being and who will bear the brunt. What makes all this so absurd is that the European experience has shown yet again why joining the austerity club is exactly the wrong thing for a struggling economy to do."
62,The Rise of Big Data,https://www.foreignaffairs.com/articles/2013-04-03/rise-big-data,The Rise of Big Data,"Everyone knows that the Internet has changed how businesses operate, governments function, and people live. But a new, less visible technological trend is just as transformative: “big data.” Big data starts with the fact that there is a lot more information floating around these days than ever before, and it is being put to extraordinary new uses. Big data is distinct from the Internet, although the Web makes it much easier to collect and share data. Big data is about more than just communication: the idea is that we can learn from a large body of information things that we could not comprehend when we used only smaller amounts."
63,The Polish Model,https://www.foreignaffairs.com/interviews/2013-04-03/polish-model,The Polish Model,"Radek Sikorski grew up in Bydgoszcz, Poland, where he led a student strike committee during protests against the communist regime in the spring of 1981. He was studying abroad when the Jaruzelski government declared martial law later that year, and he was granted political asylum in the United Kingdom from 1982 to 1989. After graduating from Oxford, he worked as a journalist, returning to Poland after its democratic revolution in 1989 and entering politics. He served as deputy minister of national defense in 1992, deputy minister of foreign affairs in 1998–2001, and minister of national defense in 2005–7; since late 2007, he has been Poland’s minister of foreign affairs. He spoke with Foreign Affairs editor Gideon Rose in March."
64,The Real Story Behind Executive Pay,https://www.foreignaffairs.com/articles/2013-04-03/real-story-behind-executive-pay,The Real Story Behind Executive Pay,"As the share of income taken home by top earners in the United States has risen over the past few decades, so, too, has popular concern about economic inequality -- something the Occupy Wall Street movement loudly reminded Americans about in 2011. Much of the outrage has centered on the compensation of the United States’ top corporate executives, who are said to be taking home ever-fatter paychecks, while the incomes of lower-level employees have stagnated. “American workers are having to make do with less,” an AFL-CIO official complained to The New York Times last year, “while C.E.O.s have never had it better.” (Europeans have also gotten worked up over these issues, with the EU proposing rules that would cap bankers’ bonuses.)"
65,India's Feeble Foreign Policy,https://www.foreignaffairs.com/articles/india/2013-04-03/indias-feeble-foreign-policy,India’s Feeble Foreign Policy,"For the last decade, few trends have captured the world’s attention as much as the so-called rise of the rest, the spectacular economic and political emergence of powers such as China and India. Particularly in the United States, India watchers point to the country’s large and rapidly expanding economy, its huge population, and its nuclear weapons as signs of its imminent greatness. Other observers fret about the pace of India’s rise, asking whether New Delhi is living up to its potential, whether the country’s shoddy infrastructure will hold it back, and whether it is strong enough to counter an increasingly ambitious China. All of this frenzied discussion, however, overlooks a simple fact: within India itself, the foreign policy elite shies away from any talk of the country’s rising status. As a senior official who has worked on India’s relations with Western countries recently told me, “There is a hysterical sense, encouraged by the West, about India’s rise.” A top-level official in India’s foreign ministry echoed the sentiment: “When do we Indians talk about it? We don’t.”"
66,Regulatory Moneyball,https://www.foreignaffairs.com/articles/united-states/2013-03-27/regulatory-moneyball,Regulatory Moneyball,"Chances are that you will never hear a crowd at a protest rally chant, “What do we need? Regulation! When do we need it? Now!” People want safe food, clean air, and clean water. But in the abstract, regulation is never a popular idea. In a tough economic environment, it might seem like a recipe for disaster. In the United States, businesses large and small have long argued that they are subject to excessive red tape and government oversight, and in the context of a serious recession, that concern has become acute. In light of the country’s general enthusiasm for freedom of choice, regulation is particularly vulnerable to political attack. I learned just how intensely many Americans oppose government regulation in 2009, when President Barack Obama nominated me to become the administrator of the White House Office of Information and Regulatory Affairs. The OIRA administrator is often described as the nation’s “regulatory czar.” That is a wild overstatement. But the term does give a clue to the influence and range of the office. OIRA is the cockpit of the regulatory state. The office oversees federal regulations involving clean air and water, food safety, financial stability, national security, health care, energy, agriculture, workplace safety, sex and race discrimination, highway safety, immigration, education, crime, disability rights, and much more. In general, the nation’s cabinet-level departments -- such as the Treasury Department, the Energy Department, and the Environmental Protection Agency -- cannot issue a significant rule unless OIRA approves. For me, heading OIRA was a dream job. I have spent much of my career writing about the proper role of regulation. Before my nomination, I had written in favor of “nudges”: simple strategies to affect behavior that do not force anyone to do anything and that maintain freedom of choice but that have the potential to make people healthier, wealthier, and happier. Examples include a requirement that automobile companies disclose the fuel economy of new cars, an educational campaign to discourage texting while driving, and an effort to encourage employers to enroll employees automatically in savings plans. Those who favor nudges recognize the importance of freedom of choice. They respect free markets and private liberty. They allow people to go their own way. At the same time, they emphasize that people may err and that, in some cases, most of us can use a little help. They insist that choices are made against a background, created by private and public institutions. Nudges are everywhere, whether we see them or not. I was eventually confirmed by the Senate, but only after a protracted fight. Progressives expressed disappointment that the president had chosen someone who favored cost-benefit analysis and who promoted modest, low-cost approaches to regulation. Conservatives warned that I was a radical leftist who would try to ban hunting, eliminate free speech, and steal human organs. (The Fox News Channel’s Glenn Beck called me “the most evil, most dangerous man in America.”) Notwithstanding the charges, one of my main goals was to ensure that data and evidence, rather than intuition and interest groups, would be the foundation of regulatory policy. On the rare occasions when members of my staff pointed out the views of interest groups, my response was, “That’s sewer talk. Get your mind out of the gutter.” I was joking, of course, but the joke had a point. I was less interested in the positions of interest groups than in figuring out the answers to basic questions about regulation: What do we actually know about the likely effects of proposed rules? What would be their human consequences? What are the costs and benefits? How can the government avoid reliance on guesses and hunches? What do we know about what existing rules are actually doing for -- or to -- the American people? How can we make things simpler? BILLY BEANE GOES TO WASHINGTON Relying on empirical evidence might seem obvious, a little like relying on sense rather than nonsense. But the temptation to favor intuition over information is strong. Think of Moneyball, Michael Lewis’ best-selling 2003 book, which was the basis for the hit film of the same title, starring Brad Pitt. Lewis tells the story of Billy Beane, the general manager of the Oakland Athletics baseball team. With the help of his statistics-obsessed assistant, Paul DePodesta, Beane brought the once-lowly Athletics into the top tier of baseball teams, and wound up transforming professional baseball, by substituting empirical data for long-standing dogmas, intuition, and anecdote-driven judgments. Lewis makes clear the difference between the two approaches in this exchange about a particular player between Beane, DePodesta, and a veteran baseball scout:"
