,title1,page_url,title2,first_paragraph
18,"Plutopia: Nuclear Families, Atomic Cities, and the Great Soviet and American Plutonium Disasters",https://www.foreignaffairs.com/reviews/capsule-review/2013-04-22/plutopia-nuclear-families-atomic-cities-and-great-soviet-and,"Plutopia: Nuclear Families, Atomic Cities, and the Great Soviet and American Plutonium Disasters","One of the Cold War’s more striking perversities never made it to public view. To hold their own in the nuclear arms race, both the United States and the Soviet Union built sealed-off cities to harvest plutonium. Brown focuses on the history of the two pioneering examples: the Richland community in eastern Washington State and Ozersk, in the southern Urals. The former was built early in World War II; the latter, toward the war’s end. Brown is a good writer, and she describes with precision the construction of the two sites (a difficult process in the U.S. case, an unbelievably horrid one in the Russian case), the hazardous occupations undertaken by their inhabitants, and the consciously contrived bubbles of socioeconomic inequality both places became. Over their multidecade existence, each pumped into their environs a volume of radioactive isotopes twice as large as that released by the Chernobyl disaster. They ravaged the health of their workers under the half-knowing eyes of superiors. But both cities offered their residents privileges they would not have enjoyed in any normal setting: tellingly, when given a choice to stay or leave, most preferred to stay and keep their material abundance at the expense of worrying about their health and that of their families.Loading...Please enable JavaScript for this site to function properly."
19,Russia and the West From Alexander to Putin: Honor in International Relations,https://www.foreignaffairs.com/reviews/capsule-review/2013-04-22/russia-and-west-alexander-putin-honor-international-relations,Russia and the West From Alexander to Putin: Honor in International Relations,"Tsygankov believes that the Russian sense of honor is the key to understanding the long history of the country’s relations with the West. By honor, he means both the virtues Russians see in their society and the respect others accord their country. Whether Russia cooperates with, defends itself from, or takes the offensive against the West is determined by Russia’s sense of honor, along with the degree of security that Russians feel, and not by Russia’s quest for power or the structure of the international system. Tsygankov examines this dynamic in different phases of Russian history, from the post-Napoleonic period to today. He takes international relations theory seriously and places himself squarely in the constructivist camp. His exegesis applies well to the Putin era. But for the larger picture, theory’s demand for tidiness forces a certain amount of cutting and splicing of history. Loading...Please enable JavaScript for this site to function properly."
20,Mr. Putin: Operative in the Kremlin,https://www.foreignaffairs.com/reviews/capsule-review/2013-04-21/mr-putin-operative-kremlin,Mr. Putin: Operative in the Kremlin,"Of the many biographies of Vladimir Putin that have appeared in recent years, this one is the most useful, particularly to foreign-policy makers, many of whom must work with a crude or muddled understanding of what makes the Russian leader tick. Hill and Gaddy paint him as a composite of many identities, including a statist bent on refurbishing Russian powers, a careful student and clever manipulator of Russian history, a “survivalist” preoccupied with girding for the worst-case eventuality, and an intelligence “case worker” who recruits, controls, and uses people. These identities melded well enough to satisfy the post-1990s angst of Russia’s political elite and paved the way for “Russia, Inc.,” a shrouded, imperious court that has commandeered the state’s formal institutions and which Putin leads as a combination of chief executive and tsar. But, the authors argue, Putin’s vision is endangered: his identities no longer mesh but instead clash, and Russia’s emerging new middle class has come to disdain what he has wrought. Something has to give. Loading...Please enable JavaScript for this site to function properly."
21,Russia: A Long View,https://www.foreignaffairs.com/reviews/capsule-review/2013-04-22/russia-long-view,Russia: A Long View,"Not many countries have produced an academic-cum-official who could or would write a book like this. Gaidar, a scholar-economist, was the architect of Russian economic reform in the Yeltsin era. He completed this genuine magnum opus in 2005, four years before his death, at age 53. In it, he traces all of economic history back to the late Stone Age and places the long path of Russian economic development in this extraordinary context. The analysis is remarkably sharp and succinct, devoid of self-exculpation, and informed by an astonishing array of Russian and Western sources. Readers with little knowledge of Russia will be stimulated by the book’s ambitious scope, and students of Russian history will be treated to a fresh perspective on critical issues, including an arresting explanation of the collapse of the Soviet Union. The last third of the book focuses on the road ahead, including the challenges Russia (and all other developed economies) will have to grapple with: shifting demographics, education, health care, social welfare, and defense spending. In a brief epilogue, Gaidar praises the steady economic hand of Vladimir Putin’s government but urges a less heavy political hand going forward.Loading...Please enable JavaScript for this site to function properly."
22,"The Soviet Cuban Missile Crisis: Castro, Mikoyan, Kennedy, Khrushchev, and the Missiles of November",https://www.foreignaffairs.com/reviews/capsule-review/2013-04-21/soviet-cuban-missile-crisis-castro-mikoyan-kennedy-khrushchev-and,"The Soviet Cuban Missile Crisis: Castro, Mikoyan, Kennedy, Khrushchev, and the Missiles of November","Soviet Premier Nikita Khrushchev “repaid me for my opposition [to placing Soviet nuclear-armed missiles in Cuba] by sending me to tell [Fidel] Castro that the missiles had to be removed,” the seasoned Soviet diplomat Anastas Mikoyan once quipped. This marvelous volume by Mikoyan’s late son, appearing only now in English, recounts the tough negotiations that followed between his father, the Cuban leadership, and the Kennedy administration over the weapons, the presence of which Washington had at one point been utterly unaware of and which risked making Cuba a nuclear power. The older Mikoyan, a remarkably skillful survivor in Bolshevik circles, came to perceive the youthful Cuban leadership (notably Castro and Che Guevara) as too emotional and idealistic, and he told them point-blank, “We see your readiness to die beautifully, but we believe that it isn’t worth dying beautifully.” The book’s appendix features 50 documents carefully selected from Mikoyan’s personal papers and Soviet archives that offer many fascinating glimpses of some leading personalities of the Cold War era.Loading...Please enable JavaScript for this site to function properly."
23,Oblivion: A Memoir,https://www.foreignaffairs.com/reviews/capsule-review/2013-04-22/oblivion-memoir,Oblivion: A Memoir,"The author’s father, a distinguished physician and prominent human rights activist, was gunned down in 1987 in Medellín, Colombia, by one of the right-wing death squads that operated with impunity in the country at that time. This poetic memoir is many things at once: a sensitive son’s recollections of growing up in a loving family; a proud homage to his generous father, who was devoted to his relatives, his many medical students, and his wider community and whom Abad describes as “Christian in religion, Marxist in economics, and liberal in politics”; and a moving contemplation of human tragedy and memory (“an opaque, cracked mirror”). Abad denounces the extreme political violence of the period, when military intelligence operatives joined with rich landowners to systematically eliminate “terrorists.” Struggling against the human instinct for vengeance, he instead affirms his father’s adherence to nonviolence and rational discourse. In the spirit of tolerance, Abad notes that on learning of his father’s martrydom, the Colombian Senator Álvaro Uribe, a conservative hard-liner who later became the country’s president, graciously asked his colleagues to observe a minute of silence in honor of the fallen patriot.Loading...Please enable JavaScript for this site to function properly."
24,"Farewell, Fred Voodoo: A Letter From Haiti",https://www.foreignaffairs.com/reviews/capsule-review/2013-04-22/farewell-fred-voodoo-letter-haiti,"Farewell, Fred Voodoo: A Letter From Haiti","The veteran Haiti observer Wilentz returned to Haiti after the devastating earthquake that struck the country in January 2010 to further ponder the causes of Haiti’s deep poverty and dysfunctional governments and to witness the massive reconstruction. Wilentz is at her best when describing the more exotic aspects of Haitian culture: its pagan religions, zombies, and werewolves. She also brilliantly savages the vulgar, exploitative journalism of some of her Western col-leagues. Wilentz very much wants to blame foreign interventions for Haiti’s misery, but she provides plenty of evidence that distrust, defensiveness, and duplicity on the part of Haitians themselves bear much of the blame. Her jaundiced assessments of the international development community suffer from her search for the selfless, the purely authentic, and the deeply knowledgeable—high bars that few can clear. Her heroes are the altruistic medical professionals who rushed to assist the injured and the sick in the aftermath of the quake. Yet as harsh as it might sound, modern medicine has also indirectly added to Haitian suffering: improvements in health care allowed more people to live longer but were disconnected from the kind of comprehensive family planning that might have tempered the country’s population growth in the decades before the disaster. As Wilentz herself notes, the population of Port-au-Prince soared from under 150,000 in 1950 to over two million by 2010, a demographic explosion the country could barely have contended with even in normal times, much less after hundreds of thousands of people flooded squalid relief camps following the earthquake.Loading...Please enable JavaScript for this site to function properly."
25,Economic Mobility and the Rise of the Latin American Middle Class,https://www.foreignaffairs.com/reviews/capsule-review/2013-04-22/economic-mobility-and-rise-latin-american-middle-class,Economic Mobility and the Rise of the Latin American Middle Class,"In this important, encouraging study, a group of World Bank economists smashes the long-standing image of Latin America as a stagnant region marred by a yawning rich-poor divide. The authors’ statistics demonstrate that during the last two decades, economic growth and effective programs to redistribute wealth have ushered in a large middle class, defined as people living in households with annual incomes higher than $14,600. One hundred and fifty million Latin Americans now fit that definition, an impressive 30 percent of the region’s population, according to the authors. In addition, another 38 per-cent now belong to a lower-middle class that is less educated but no longer poor. Thus, according to these statistics, Latin America is no longer predominantly poor: a hard-won transformation of historic proportions. Not content to simply report this remarkable progress, the study’s authors worry that this new middle class will join the region’s rich elites in neglecting those still struggling to improve their lots. They urge Latin American governments to draft a more sustainable social contract by making equality of opportunity an explicit goal, strengthening their social security systems, and raising tax revenues to finance high-quality public education and health services.Loading...Please enable JavaScript for this site to function properly."
26,Tough Taiwan,https://www.foreignaffairs.com/articles/taiwan/2013-04-22/tough-taiwan,Tough Taiwan,"In “Beyond the Pivot” (March/April 2013), Kevin Rudd suggests that Washington and Beijing should work toward establishing a new Shanghai Communiqué in order to improve and solidify their relationship. He argues that some analysts’ concerns that this type of dialogue could “reopen the contentious issue of Taiwan” are not valid because Taiwan’s relationship with the mainland is currently very good. Indeed, cross-strait relations have improved significantly since Taiwanese President Ma Ying-jeou took office in 2008. However, this does not mean that Taipei is willing to make concessions on issues of political autonomy and sovereignty. Taiwan will continue to safeguard its sovereignty, territorial integrity, and national dignity."
27,Good Service,https://www.foreignaffairs.com/united-states/good-service,Good Service,"In his interview with Foreign Affairs (“Generation Kill,” March/April 2013), Stanley McChrystal, the retired U.S. general, argued that the United States should compel all Americans to serve their country through some form of national service. Conscription, however, is not the answer to the United States’ challenges at home or abroad. Instead, Washington should build on the success of existing voluntary programs, such as the Peace Corps, to give more Americans the opportunity to advance U.S. foreign policy objectives by serving abroad."
28,General Relativity,https://www.foreignaffairs.com/articles/israel/2013-04-22/general-relativity,General Relativity,"Aluf Benn’s thoughtful review of my book Fortress Israel (“Israel’s Warlords,” March/April 2013) fails to grasp one essential aspect of the history of the Arab-Israeli conflict. Benn paints the Israel Defense Forces’ dominance of Israeli politics as immutable, arguing that since only the military can offer the government timely solutions in a crisis, Israel “inevitably” relies on the use of force. But it is a misperception of history to suggest that Israel has had no alternatives to military solutions. Diplomacy and negotiation have not been tactical responses to urgent contingencies. They have been part of a long-term strategy to avoid conflict."
29,Helmut Kohl: Eine politische Biographie  (A political biography),https://www.foreignaffairs.com/reviews/capsule-review/2013-04-22/helmut-kohl-eine-politische-biographie-political-biography,Helmut Kohl: Eine politische Biographie  (A political biography),"For most of his political career, Helmut Kohl was easy to underestimate. Yet political enemies did so at their peril. Ridiculed as a big, fat provincial with a suspiciously lightweight doctoral thesis, few clear ideals, and a ponderous speaking style, Kohl was nicknamed “the pear.” He was a political insider who cultivated tight personal relationships and accumulated bitter enemies, clambering slowly up the greasy pole of German politics with few achievements of true distinction. On reaching the top, in the early 1980s, he turned in a mediocre first term as chancellor. That all changed when the Soviet Union began to collapse. Kohl focused on reunifying Germany, strengthening the EU, and establishing a diplomatic agreement with Moscow. In this mammoth biography, destined to become the standard work on Kohl for some time to come, Schwarz portrays him as shrewd in politics but a bit naive on substantive matters. This combination still has relevance for contemporary European politics. For example, Kohl supported the establishment of the euro but did not fully consider its potential long-term effects. Europe is still living with the consequences.Loading...Please enable JavaScript for this site to function properly."
30,Political Conflict in Western Europe; The Politicization of Europe,https://www.foreignaffairs.com/reviews/capsule-review/2013-04-22/political-conflict-western-europe-politicization-europe,Political Conflict in Western Europe; The Politicization of Europe,"The political history of European countries is traditionally told in terms of a small number of significant, divisive issues. These issues emerged successively -- first religion, then class, and more recently “postmaterialist” values, such as the environment -- creating points of identification for voters and fault lines of conflict among political parties. They persist to this day and get layered on top of one another, defining the uniqueness of each country’s politics."
31,The People’s Car: A Global History of the Volkswagen Beetle,https://www.foreignaffairs.com/reviews/capsule-review/2013-04-22/peoples-car-global-history-volkswagen-beetle,The People’s Car: A Global History of the Volkswagen Beetle,"The Volkswagen Beetle is one of the enduring and iconic products of the past century, but it has meant different things to different people in different places and times. In telling its story, Rieger starts with Hitler’s ambition to create an inexpensive and functional “people’s car.” The job was turned over to Ferdinand Porsche, who produced the cute “bug” design the car has featured ever since. War production superseded civilian priorities, however, and the Beetle was delayed until after World War II, when British occupation authorities launched its production. In Germany, the car became a symbol of the country’s middle-class economic miracle. In the United States, it became a symbol of countercultural resistance to middle-class consumerism. As its popularity waned in developed countries, it found a foothold in Mexico, where it stood for middle-class solidity and values in the face of economic turmoil. When Volkswagen introduced a redesigned Beetle in 2011, it offered young and old alike a chance to return to imagined traditions many of them never knew.Loading...Please enable JavaScript for this site to function properly."
32,"Europe: The Struggle for Supremacy, From 1453 to the Present",https://www.foreignaffairs.com/reviews/capsule-review/2013-04-22/europe-struggle-supremacy-1453-present,"Europe: The Struggle for Supremacy, From 1453 to the Present","This book chronicles five centuries of diplomacy, alliances, and war -- all aimed, Simms argues, at asserting or blocking dominance of the European continent. The story begins with the maneuvering of absolutist monarchs before the Thirty Years’ War and ends with the enlargement of the European Union. Germany, with its central location, remains the main problem throughout: its weakness and division create a power vacuum, and its strength and unity pose a threat to all. Simms’ narrative is very much in the style of histories penned in past eras by the likes of A. J. P. Taylor, Leopold von Ranke, and Henry Kissinger, in which leaders pursue great-power rivalries through subtle diplomatic schemes and brutal military tactics. Less sure-footed is the analysis of leaders’ deeper motivations and of the sweeping changes in domestic politics and society that transformed Europe over that time. Yet the many insights and engaging anecdotes make this a fine read.Loading...Please enable JavaScript for this site to function properly."
33,Accelerating Democracy: Transforming Governance Through Technology,https://www.foreignaffairs.com/reviews/capsule-review/2013-04-22/accelerating-democracy-transforming-governance-through-technology,Accelerating Democracy: Transforming Governance Through Technology,"“How does Athens know what the Athenians know?” is the basic question of governance, McGinnis writes. How does a polity take advantage of the wealth of information and analysis in the minds of its citizens to develop and implement policy? In the age of the Internet and “big data,” McGinnis argues that the bureaucratic, centralized state of the Progressive Era is passé. Decentralization allows for more experiments in governance, whose results can be used to make better policy. Meanwhile, expert online commentary provides better and more interactive analysis than older mainstream media. Regulatory agencies will have to change the way they collect information and make decisions, he argues. On the one hand, they will have much better information to work with; on the other, they will be subject to much more intensive oversight and second-guessing by legislators and stakeholders. Not all readers will be convinced by every gee-whiz technological fix that McGinnis describes. Nevertheless, he shines an important light on a discussion that will only grow more lively as technology creates at once more opportunities and more challenges for government.Loading...Please enable JavaScript for this site to function properly."
34,A Nation of Takers: America’s Entitlement Epidemic,https://www.foreignaffairs.com/reviews/capsule-review/2013-04-22/nation-takers-americas-entitlement-epidemic,A Nation of Takers: America’s Entitlement Epidemic,"Last year, the campaign of the Republican presidential candidate Mitt Romney was damaged when a videotape surfaced showing him lamenting that 47 percent of the American people “believe that they’re entitled to health care, to food, to housing, you name it.” Eberstadt might have offered the candidate some sympathy. Like Romney, Eberstadt is not a fan of the entitlement state. From his perspective, entitlements create not only an enormous fiscal challenge but also a culture of dependency that undermines the foundations of the American ethos of enterprise. In his essay responding to Eberstadt’s arguments, Levin goes even further, arguing that the entitlement state is squeezing the life out of civil society and weakening the United States’ capacity for effective self-governance. In his own response, Galston does not dispute the math but argues that taking care of the less fortunate is a sign of improved, rather than decayed, social morality. Readers will draw their own conclusions, but people wanting a quick introduction to one of the most important policy debates in the United States today (and one with significant implications for global power politics, if Eberstadt’s analysis is correct) will do well to consult this useful work.Loading...Please enable JavaScript for this site to function properly."
35,What to Expect When No One’s Expecting: America’s Coming Demographic Disaster,https://www.foreignaffairs.com/reviews/capsule-review/2013-04-22/what-expect-when-no-ones-expecting-americas-coming-demographic,What to Expect When No One’s Expecting: America’s Coming Demographic Disaster,"Since the 1960s, foundations, governments, and international bodies have worried about a seemingly unstoppable “population bomb.” It turns out that they should have been worrying about a population bust -- a collapse in the rate at which women are having children, which started in the developed world but is quickly spreading to developing countries. This trend puts enormous fiscal pressure on China, Japan, the United States, and European countries, where pension and social welfare programs rely on a growing cohort of younger people to foot the bill. In Europe, the lack of native-born children has created the need for high levels of immigration, which has led to a range of serious social problems in many European countries. But even worse for such countries would be the labor shortages they might face if fertility continues to fall in developing countries. Last takes a vigorous look at the policy and political issues resulting from this still-underappreciated seismic shift in the human condition. Even those who do not share his basically conservative outlook on many fertility and family policy issues will find this a stimulating and enlightening read. Loading...Please enable JavaScript for this site to function properly."
36,The Great Divergence: America’s Growing Inequality Crisis and What We Can Do About It,https://www.foreignaffairs.com/reviews/capsule-review/2013-04-22/great-divergence-americas-growing-inequality-crisis-and-what-we,The Great Divergence: America’s Growing Inequality Crisis and What We Can Do About It,"Noah writes from what might be called a neoprogressive standpoint. Like the original progressives, he seeks to blend an emotional and moral commitment to the causes of the left with the intellectual rigor of the best available economic and social science research. As in the case of the original progressives, the result is a powerful, if sometimes flawed, perspective that is likely to influence the course of American debates on issues of economic policy and justice. Noah’s central contention is that government policy can and should do more to reverse the trend toward greater income inequality that has developed in the United States since 1979. Some of his policy prescriptions, such as substituting carbon taxes and value-added taxes for the deeply regressive payroll tax, could win bipartisan support; others would have to await much larger Democratic majorities than currently exist in Congress. Still, although the analysis in this relatively short and very accessible book is necessarily incomplete, and some of its contentions are more powerfully stated than convincingly argued, The Great Divergence is an excellent guide to the emerging center-left economic policy consensus likely to inform Democratic Party thinking and policymaking for some time to come."
