,title1,page_url,title2,first_paragraph
19,Rival Power: Russia in Southeast Europe,https://www.foreignaffairs.com/reviews/capsule-review/2018-04-16/rival-power-russia-southeast-europe,Rival Power: Russia in Southeast Europe,"Bechev introduces a sophisticated and cool-headed corrective to the crude image of Russian foreign policy favored by much of the Western press. He focuses on Russia’s relations with four areas of southeastern Europe: the post-Yugoslav republics, Bulgaria and Romania, Greece and Cyprus, and Turkey. Russia’s engagement with those countries has little to do with Slavic identity or a desire to fulfill imperialist dreams. Instead, its approach is highly pragmatic and focused on dealmaking, particularly on energy. The other countries are playing the same game. Moscow is eager to increase its influence and, especially at the moment, to damage that of the West, but in the end, the Kremlin is mindful that these countries are in Europe’s backyard, not its own. The concluding portion of the book focuses on three critical dimensions of Russia’s approach to the region: security relations, particularly with NATO members; the ups and downs of energy projects; and the nature and use of its soft power."
20,Stalinist Perpetrators on Trial: Scenes From the Great Terror in Soviet Ukraine,https://www.foreignaffairs.com/reviews/capsule-review/2018-04-16/stalinist-perpetrators-trial-scenes-great-terror-soviet-ukraine,Stalinist Perpetrators on Trial: Scenes From the Great Terror in Soviet Ukraine,"The story of Stalin’s terror is well known, except for one dimension: the fate of those among the tormentors who were themselves swept into the meat grinder. This “purge of the purgers,” as Viola terms it, came after Stalin called off the Great Terror in 1938. Those who had carried out the two mass operations in 1937–38 against former “kulaks” (supposedly well-off peasants), foreigners, and “anti-Soviet” and “socially dangerous” elements—sending almost 1.5 million people to either the gulag or execution—were themselves put on trial. In 1939, nearly a thousand of them were arrested; many were subjected to torture—the very crime for which a lot of them were being tried. After elaborate trials, they were either sentenced to death or the gulag or sent to the front during World War II. Viola draws from Ukraine’s secret police archives—which, unlike Russia’s, are open—to detail how the accused defended themselves, the testimony against them, and the outcomes. As well as lifting the cover from this less well-known part of the story, Viola explains in great detail the interaction between what was commanded from above and what flowed from forces at the ground level."
21,My Life as a Spy: Investigations in a Secret Police File,https://www.foreignaffairs.com/reviews/capsule-review/2018-04-16/my-life-spy-investigations-secret-police-file,My Life as a Spy: Investigations in a Secret Police File,"From 1973 to 1988, Verdery, an anthropologist, spent a total of nearly four years conducting field research in Nicolae Ceausescu’s Romania. Over that time, Romania’s security service amassed an impressive file on her, totaling 2,781 pages in eight volumes. She got ahold of it in 2008 and has spent much of the time since then dealing with its impact on her. The resulting book is an extraordinary exploration of her research, reexperienced through the eyes of those who surveilled her. Believing her to be a spy, the security services built up a wildly distorted picture of her, which she terms her “doppelgänger.” Rather than reflexively dismiss this double, she agonizes over its reality, its challenge to her identity, and its implications for her profession. The most dramatic portion of the book centers on her struggle to understand those who informed on her, particularly those she counted as close friends, a few of whom she has confronted face to face. Coming from such a distinguished academic, Verdery’s brutally honest description of herself, including as a naive and careless young scholar, is stunning. Few books reflect so frankly and so powerfully on the nature and complications of an academic career."
22,Anatomy of a Genocide: The Life and Death of a Town Called Buczacz,https://www.foreignaffairs.com/reviews/capsule-review/2018-04-16/anatomy-genocide-life-and-death-town-called-buczacz,Anatomy of a Genocide: The Life and Death of a Town Called Buczacz,"In this wrenching but beautiful history, Bartov follows the Jews of Buczacz, an eastern Galician town in what is now Ukraine, from the sixteenth century to World War II. The Jews were welcomed when they arrived in the area and prospered for many years. But they suffered their first mass slaughter during a Cossack and peasant uprising in 1648. The next massacre took place three decades later, at the hands of Ottoman forces. Despite these atrocities, the Jews remained a dominant group within the town’s elite. Partly for that reason, they were almost never free from the resentment and enmity of their Polish and Ukrainian neighbors. At the heart of the book are the tragic events of the twentieth century. Bartov recounts the fate of the Jews as German and Russian troops marauded through their town in World War I and during the successive German and Soviet invasions of World War II, ending with the final Soviet offensive of 1944–45. His account of this last nightmare is specific and personal. There are moments of humanity in the story, but they appear only as bright specks in a very dark stone."
23,Peacemakers: American Leadership and the End of Genocide in the Balkans,https://www.foreignaffairs.com/reviews/capsule-review/2018-04-16/peacemakers-american-leadership-and-end-genocide-balkans,Peacemakers: American Leadership and the End of Genocide in the Balkans,"Pardew was at the center of the U.S. diplomatic intervention in the former Yugoslavia from the time of the 1995 Dayton peace accords, which ended the Bosnian war and the accompanying genocide, to Kosovo’s independence, in 2008. As a diplomat, he played a key role in rebuilding the Bosnian military after the war; in negotiating the Ohrid Agreement in 2001, which averted a civil war in Macedonia; and in the failed effort to avoid the 1998–99 Kosovo war. He provides a compelling, detailed account of the diplomatic give-and-take with wily Balkan leaders (none more so than Serbian President Slobodan Milosevic), debates among Western negotiators, and the crosscutting pressures from Brussels and Washington. His portrait of Richard Holbrooke, the controversial but skilled American diplomat, at work during the Dayton negotiations is particularly powerful. Pardew puts the reader in the room during his encounters with several major actors, including Milosevic, both in Holbrooke’s company and, later, alone. He acknowledges some of the shortcomings of Washington’s policies in the Balkans, but he makes a strong case that U.S. diplomacy ended the Bosnian genocide and prevented further bloodshed."
24,Putinomics: Power and Money in Resurgent Russia,https://www.foreignaffairs.com/reviews/capsule-review/2018-04-16/putinomics-power-and-money-resurgent-russia,Putinomics: Power and Money in Resurgent Russia,"Miller challenges the popular notion that Russian President Vladimir Putin’s entire talent lies in using corruption to sustain a kleptocratic authoritarian regime. Putin and his loyalists certainly are corrupt, but he and the liberal technocratic economic team on which he relies have also skillfully managed Russia’s economic fortunes. As Miller recounts in this short and admirably clear book, Putin took over a debt-ridden, revenue-starved economy in 1999 and then forced the oligarchs to pay taxes, saved the windfall from soaring oil profits (and later used it to weather successive financial crises), paid off Russia’s debts, tamed inflation, and presided over rapid growth (fueled not only by oil profits but also by increased productivity). Russia, Miller argues, has a dual economy: one portion dominated by corrupt and inefficient state-owned enterprises, the other driven by a widening range of efficient and innovative private companies. He sketches a “hierarchy of Putinomics”: “first, political control; second, social stability; third, efficiency and profit.” The first two objectives are within reach, but the system’s inability to properly fund the country’s health-care and educational systems, fight corruption, or establish the rule of law threatens to sacrifice the third."
25,Resisting War: How Communities Protect Themselves,https://www.foreignaffairs.com/reviews/capsule-review/2018-04-16/resisting-war-how-communities-protect-themselves,Resisting War: How Communities Protect Themselves,"Caught in the crossfire between militant insurgents and government forces, unarmed civilians are often portrayed as helpless. Kaplan rejects this idea and finds that under certain circumstances, local communities can protect their members from civil strife. He bases his hopeful conclusion primarily on his extensive field research in rural Colombia; using secondary sources, he also finds local islands of peaceful civilian autonomy within conflict zones in Afghanistan, the Philippines, and Syria—suggesting that even in extreme circumstances, civilians can organize to keep themselves safe. Successful strategies include building early warning systems to allow people to escape the fighting, opening dialogues with armed groups, and threatening to publicize acts of extreme violence. To discourage retaliation, communities must avoid openly sympathizing with one side or the other. So Kaplan warns U.S. policymakers against counterinsurgency or democracy-promotion strategies that could put the intended beneficiaries at risk by undermining their claims to neutrality."
26,Making Peace in Drug Wars: Crackdowns and Cartels in Latin America,https://www.foreignaffairs.com/reviews/capsule-review/2018-04-16/making-peace-drug-wars-crackdowns-and-cartels-latin-america,Making Peace in Drug Wars: Crackdowns and Cartels in Latin America,"In this ambitious study, Lessing argues that governments cannot successfully pursue the three interconnected goals of combating narcotics trafficking, eliminating official corruption, and reducing drug-related violence all at the same time. The conclusion he draws from his three detailed case studies, of Brazil, Colombia, and Mexico, is that governments that launch all-out military campaigns provoke drug cartels to respond with their own brutal, escalatory attacks against the state, catching innocent bystanders in the crossfire. Such indiscriminate official crackdowns are misconceived because, as Lessing points out, the cartels do not aim to usurp state power—they are not political insurgents. They instead seek to dissuade the state from using overwhelming force to destroy them. A more rational approach for governments, he argues, is to adopt policies, such as offering lower prison sentences and imposing more calculated levels of repression, that give cartels incentives to behave more peacefully, even if that means tolerating drug trafficking and official corruption."
27,Stranger: The Challenge of a Latino Immigrant in the Trump Era; Latinos in the United States: What Everyone Needs to Know,https://www.foreignaffairs.com/reviews/capsule-review/2018-04-16/stranger-challenge-latino-immigrant-trump-era-latinos-united,Stranger: The Challenge of a Latino Immigrant in the Trump Era; Latinos in the United States: What Everyone Needs to Know,"Ramos, a Mexican immigrant and news anchor at Univision, writes that the role of a journalist is to challenge the powerful and speak for those without a voice. Thus, it was very much in character when, during the 2016 U.S. presidential campaign, he confronted the Republican candidate Donald Trump over his anti-immigrant posture, before Trump had one of his security guards expel Ramos from the room. Ramos’ book pulls no punches, denouncing Trump for stirring up racism to gain political power and for causing undocumented immigrants and their families to live in constant fear. (Ramos also criticizes President Barack Obama for failing to advance immigration reform.) Despite the rise of Trump, Ramos remains an optimist, proud to live in a country of freedom and opportunity and confident that the coming demographic transformation—by 2044, Latinos will make up a quarter of the U.S. population—will push aside xenophobia in favor of tolerance. Ramos fills out the book with his ruminations on the immigrant experience: the challenges of reconciling multiple identities and recalling fading memories."
28,God’s Country: Christian Zionism in America,https://www.foreignaffairs.com/reviews/capsule-review/2018-04-16/gods-country-christian-zionism-america,God’s Country: Christian Zionism in America,"As the American Jewish community grows increasingly divided over U.S. policy toward Israel, much of the academic and policy focus has shifted to the far larger number of American Christians who want the United States to pursue pro-Israel policies in the Middle East. This study of the history of pro- and anti-Israel ideas among American Christians from the Colonial period to the present day challenges the stereotypes that often distort discussions of Christian Zionism and offers useful observations about one of the most important political forces in American life. It is not, Goldman points out, only fundamentalist and dispensationalist Christians who support Israel. Nor is Christian support for Israel solely the product of a set of beliefs about Israel’s role in the approach of Armageddon. Pro-Zionist positions are widely shared across different strains of American Christianity. Mormons, who most fundamentalists and dispensationalists dismiss as misguided heretics, are among Israel’s staunchest backers. And many of Israel’s most prominent Christian supporters, including Martin Luther King, Jr., and the Protestant theologian Reinhold Niebuhr, were neither fundamentalist nor conservative."
29,"New World, Inc.: The Making of America by England’s Merchant Adventurers",https://www.foreignaffairs.com/reviews/capsule-review/2018-04-16/new-world-inc-making-america-englands-merchant-adventurers,"New World, Inc.: The Making of America by England’s Merchant Adventurers","Americans, claim Butman and Targett in this brisk and fascinating book, spend too much time thinking about the Pilgrims and not enough time thinking about the hardheaded businessmen who did much more to found the main English-speaking settlements in what is now the United States. They have a point. “I am not so simple to think,” wrote Jamestown’s Captain John Smith about England’s North American possessions, that “any other motive than wealth will ever erect there a commonweal.” The settlers who founded Plymouth Colony were much less important than their legend suggests. The more commercially oriented settlements of Boston and Massachusetts Bay soon eclipsed the struggling Pilgrim community. By overemphasizing the idealists and ignoring the pragmatists and opportunists in American history, patriotic historians often mislead their audiences. But that isn’t the whole story; in the seventeenth century, as now, people’s motives were often mixed. The Pilgrims were less otherworldly, and adventurous merchants were less cynical, than superficial observers might conclude."
30,Arthur Vandenberg: The Man in the Middle of the American Century,https://www.foreignaffairs.com/reviews/capsule-review/2018-04-16/arthur-vandenberg-man-middle-american-century,Arthur Vandenberg: The Man in the Middle of the American Century,"Until now, Republican Senator Arthur Vandenberg of Michigan has been best known to students of U.S. foreign policy through former Secretary of State Dean Acheson’s elegant, if acerbic, portrait of him as an isolationist blowhard seduced into supporting international engagement after World War II by Acheson’s flattery. Meijer’s biography punctures this caricature. Vandenberg, who had his full share of both the vices and the virtues of Midwestern Republicanism in the middle of the twentieth century, will not be remembered as a great figure in U.S. history. But his evolution from a prewar isolationist to a committed Cold Warrior reflected the dramatic changes in American thought that enabled the United States to make the post–World War II era such a peaceful and progressive one. His powerful articulation of a bipartisan approach to foreign affairs, summed up in his 1947 injunction to his fellow senators to “stop partisan politics at the water’s edge,” sounds quaint today, but few doubt that a return to even a limited bipartisan foreign policy consensus would strengthen the United States’ voice in world affairs."
31,Zbigniew Brzezinski: America’s Grand Strategist,https://www.foreignaffairs.com/reviews/capsule-review/2018-04-16/zbigniew-brzezinski-americas-grand-strategist,Zbigniew Brzezinski: America’s Grand Strategist,"Vaïsse’s biography of U.S. President Jimmy Carter’s national security adviser, Zbigniew Brzezinski, reminds readers just what an extraordinary phenomenon this Polish outsider was. By the late 1970s, when Brzezinski rose to prominence, the old well-heeled and well-bred WASP foreign policy establishment had imploded under the strain of the Vietnam War and yielded to a new elite from more diverse backgrounds. Both Brzezinski, whose father was a Polish diplomat stranded in Canada by the Nazi conquest of Poland and then the Soviet-backed communist takeover of 1945, and his friend and rival Henry Kissinger, whose family fled Nazi persecution in Germany, possessed a gift for strategic vision that few of their American-born contemporaries could match. Into a foreign policy community increasingly composed of technocrats, political scientists, and area specialists, Brzezinski and Kissinger brought a more generalist and historical perspective. Of the two, Kissinger has always been the better known and the more controversial. Vaïsse’s evenhanded appraisal of Brzezinski’s contributions to U.S. foreign policy will help redress the balance and will introduce a new generation of readers to a great American strategist."
32,Trumpocracy: The Corruption of the American Republic,https://www.foreignaffairs.com/reviews/capsule-review/2018-04-16/trumpocracy-corruption-american-republic,Trumpocracy: The Corruption of the American Republic,"Frum thinks that Donald Trump is a bad man and a worse president and that his presidency endangers the American republic. Those opinions aren’t particularly original or particularly rare, but this book distinguishes itself by its literary quality and its intellectual breadth. Most anti-Trump literature acknowledges the economic concerns of Trump’s supporters and suggests that establishment politicians need to address them. Frum goes significantly further. He shows awareness of, and even sympathy for, their cultural grievances and their sense of dislocation. The book would be even better, and perhaps less alarmist, if Frum had looked more closely at the history of populism in the United States. Although quack economics and racism frequently accompany populist uprisings, populism has sometimes served as a useful corrective to out-of-touch elites. The Trump phenomenon should drive political observers on both sides of the aisle to deepen their understanding of populism, not to pander or surrender to it but to think intelligently about how to channel populist energy toward constructive reform."
33,The West Point History of the American Revolution,https://www.foreignaffairs.com/reviews/capsule-review/2018-04-16/west-point-history-american-revolution,The West Point History of the American Revolution,"The essays in this authoritative collection illuminate the origins and conduct of the American War of Independence, with a particular focus on the transformation of the Continental army under George Washington into a professional and disciplined fighting force—a crucial achievement, even though Washington lost many of the battles he fought. After weighing all the factors that contributed to the revolutionaries’ eventual victory, including Great Britain’s long supply lines, Stephen Conway concludes that the foreign interventions by France, the Netherlands, and Spain mattered most. In one of his contributions, Watson examines the wider social and political contexts of the Revolution, as well as the role played by developments in weaponry and the art of war. The special value of this book lies in its splendid presentation: it features excellent illustrations, maps, timelines, and charts, as well as reproductions of key documents and letters."
34,"The Last Battle: Victory, Defeat, and the End of World War I",https://www.foreignaffairs.com/reviews/capsule-review/2018-04-16/last-battle-victory-defeat-and-end-world-war-i,"The Last Battle: Victory, Defeat, and the End of World War I","Hart’s history of the final year of World War I opens just after the major German offensive of 1918 had ground to a halt and as the Allies geared up for their own campaign. After years of grueling trench warfare had caused many to doubt that the conflict would ever end, the rapid success of the Allied offensive came as a surprise to those who led and fought in it. Hart enlivens his lucid account of this final battle with quotes from memoirs, letters, and diaries. He shows how increased professionalism and better tactics allowed British and French troops, fortified by the arrival of the U.S. Army, to push back the German forces. He also opens a window into the minds of individual soldiers, relating how they accepted the possibility of death and their relief at the eventual armistice. As one wrote: “Do you realise that we shall probably live to be old men!”"
35,Army of None: Autonomous Weapons and the Future of War,https://www.foreignaffairs.com/reviews/capsule-review/2018-04-16/army-none-autonomous-weapons-and-future-war,Army of None: Autonomous Weapons and the Future of War,"Scharre, a former U.S. Army Ranger, has thought more than most about the implications of autonomous weapons. He has spent time not only among their designers and operators but also with those so alarmed by the prospect of machines making life-and-death decisions that they wish to ban them—or, at the very least, impose strict limits on their use. In this comprehensive analysis, Scharre moves beyond the clichés of “killer robots” to explore the complexity of human-machine interactions, distinguishing systems that still partly rely on humans from those that are completely autonomous and highlighting the importance not only of machines’ capabilities but also of human fallibilities. Scharre recognizes the advantages of remote-control systems and doubts whether it would be possible to craft and enforce a ban. But he also warns against being “seduced by the allure of machines—their speed, their seeming perfection, their cold precision.” New technologies are most likely to reduce the harm caused by war if they incorporate the principles of proportionality and discrimination, which are already central to the established laws of armed conflict."
36,The Saboteur: The Aristocrat Who Became France's Most Daring Anti-Nazi Commando,https://www.foreignaffairs.com/reviews/capsule-review/2018-04-16/saboteur-aristocrat-who-became-frances-most-daring-anti-nazi,The Saboteur: The Aristocrat Who Became France’s Most Daring Anti-Nazi Commando,"This gripping account of the French resistance to the Nazi occupation is told through the remarkable experiences of Robert de La Rochefoucauld, a Frenchman from an aristocratic family who was a teenager at the time of the German invasion. After escaping to London via Spain, he was recruited by the Special Operations Executive, the British espionage and irregular warfare service, and returned to France to sabotage the German war effort and gather intelligence. His expertise in plastic explosives led to a number of early successes. But as his network of agents expanded, some betrayed him; others cracked under torture. Eventually, La Rochefoucauld himself was captured and brutally interrogated. Having failed to extract any information from him, the Germans sentenced him to death. The book’s most dramatic sequences describe his escape from the truck that was taking him to his execution and his subsequent journey back to London. He returned to France again just before D-Day, was caught again, and escaped yet again to carry out even more sabotage behind German lines."
