,title1,page_url,title2,first_paragraph
22,After Hitler: The Last Ten Days of World War II in Europe,https://www.foreignaffairs.com/reviews/capsule-review/2015-10-19/after-hitler-last-ten-days-world-war-ii-europe,After Hitler: The Last Ten Days of World War II in Europe,"This admirable book covers the last ten days of World War II in Europe, starting with April 30, 1945, the day of Hitler’s suicide, and concluding on May 9, by which point all German soldiers had surrendered. The book’s strength lies in Jones’ well-crafted account of the complex negotiations over the pace, manner, and location of the surrender. Admiral Karl Dönitz, Hitler’s anointed successor, believed that there were sufficient German fighters, still imbued with Nazi faith, to mount a rear-guard action to split the Allies. But most Germans, aware that the cause was hopelessly lost, sought to hand themselves over to the Americans, the British, or the Canadians—staying as far away as possible from the Russians. All the parties had an eye on how the conclusion of the war might shape the coming political struggles. Although Jones passes too lightly over the backstories of certain events, he skillfully uses diaries and other memoirs to vividly re-create dramatic moments: German civilians suddenly at the mercy of Soviet forces, British troops recoiling at the horror and degradation they found at Nazi concentration camps, and the camaraderie-filled first encounters between victorious troops from the East and the West."
23,International Organization in Time: Fragmentation and Reform,https://www.foreignaffairs.com/reviews/capsule-review/2015-10-19/international-organization-time-fragmentation-and-reform,International Organization in Time: Fragmentation and Reform,"All large organizations tend to become bureaucratized and stodgy over time. Institutional inertia sets in, and vested interests resist change. Yet the rapidly changing world requires constructive adaptation. The private sector relies on competition (and occasional recessions) to shake firms out of their traditional ways. The public sector relies on innovative officials, sometimes prodded by parliamentary or congressional oversight—an imperfect process, especially when it comes to international organizations. Hanrieder’s perceptive book details several failed attempts to reform the World Health Organization by aiming to reverse the organization’s fragmentation and to introduce greater coherence into its policies and practices. A functional WHO should be a wholly uncontroversial, consensus goal; after all, everyone favors good health and the containment of contagious diseases. Yet the WHO has become factionalized by region and in some places has lapsed into patronage and inefficiency, which have proved difficult to overcome. Hanrieder also looks at mostly unsuccessful reform efforts at UNESCO and the International Labor Organization. Despite the book’s excessive use of political science jargon, its discouraging analysis is valuable and applicable to many organizations."
24,The Public Wealth of Nations: How Management of Public Assets Can Boost or Bust Economic Growth,https://www.foreignaffairs.com/reviews/capsule-review/2015-10-19/public-wealth-nations-how-management-public-assets-can-boost-or,The Public Wealth of Nations: How Management of Public Assets Can Boost or Bust Economic Growth,"This significant book makes two simple but important points. First, government-owned assets typically exceed public debts, often by a large margin. Of the 33 countries for which estimates exist, only in Belgium and El Salvador does sovereign debt significantly exceed public assets. In all the other countries, assets exceed debt by at least 50 percent—and probably by much more than that, since assets are usually understated for various reasons. The second point is that public assets are typically poorly managed and therefore represent a promising source of new government revenue, if only states could figure out how to take better advantage of them. Detter and Folster draw on many concrete examples, especially from Singapore and Sweden, to show how governments can use public assets to increase revenue, reduce costs, and improve services. Restructuring and rationalizing public commercial enterprises to make them more efficient and revenue-minded would considerably reduce the pressure on constrained government budgets all over the world."
25,The Truth About Inflation,https://www.foreignaffairs.com/reviews/capsule-review/2015-10-19/truth-about-inflation,The Truth About Inflation,"Inflation is usually considered simple, straightforward, and undesirable; that, at least, is the view promoted by many central bankers and some economists. Donovan counters that inflation is anything but straightforward and contends that whether it is good or bad depends on one’s circumstances. His book is a careful and sober attempt to dispel the many myths and half-truths that surround discussions of inflation, starting with how it is actually measured and how different measures are relevant for the young and the old, the rich and the poor, lenders and borrowers, and savers and investors. Contrary to common fears, governments do not typically allow inflation to grow in order to reduce the real value of their debts, even if they occasionally can do so; they usually find other ways to reduce their debt burdens. The author draws heavily on the British experience with inflation, but the same myths—and the same refutations—apply to most developed nations."
26,The Economics of Inequality,https://www.foreignaffairs.com/reviews/capsule-review/2015-10-19/economics-inequality,The Economics of Inequality,"Piketty first published this book in French in 1997, long before he became famous. Translated into English for the first time, it offers an exceptionally clear, cogent, and coherent discussion of economic inequality. The analysis is necessarily technical in places, but Piketty carefully explains the technicalities. He draws heavily on data from France and the United States but also offers broader international comparisons. The book also takes some instructive excursions into topics such as savings and investment, education, affirmative action, unions, and the minimum wage. Mainly, however, Piketty is concerned with the debate between those who argue that serious attempts to redistribute income will result in everyone being worse off and those who claim that social justice requires redistribution in modern economies and can be achieved without inflicting widespread damage. Piketty is sympathetic to the social justice argument but recognizes that the economic details of redistribution are devilishly complicated and that efficient redistributive policies depend quite a bit on the context in which they are adopted and applied."
27,Other People's Money: The Real Business of Finance,https://www.foreignaffairs.com/reviews/capsule-review/2015-10-19/other-peoples-money-real-business-finance,Other People’s Money: The Real Business of Finance,"This important book is simultaneously a clear primer on modern financial systems and a scathing indictment of them. It acknowledges the essential role of finance in modern economies but levels three critical charges at modern financial systems: they are larger than necessary, they perform inefficiently or worse, and they transfer unjustifiably large sums of money to the financial sector from the rest of the economy. Financial sectors have become self-referential systems, preoccupied with trading within the sector rather than providing services to households and nonfinancial firms. Along with offering this detailed diagnosis, Kay suggests some prescriptions: separate deposit-taking institutions from those that handle most other financial activities; require that financial firms maintain adequate levels of capital, which would lower returns on equity and eventually lead to a market-driven reduction in largely superfluous financial trading; and impose strict liability on managers, since those who are richly rewarded should take the rap for any malfeasance that happens on their watch—and ignorance should be no defense."
28,War and Democratic Constraint: How the Public Influences Foreign Policy,https://www.foreignaffairs.com/reviews/capsule-review/war-and-democratic-constraint-how-public-influences-foreign-policy,War and Democratic Constraint: How the Public Influences Foreign Policy,"This groundbreaking study examines the degree to which public opinion in democratic countries constrains leaders when it comes to foreign policy decisions—and finds a great degree of variability. A vivid recent illustration came in the run-up to the Iraq war, when British Prime Minister Tony Blair was able to resist strong domestic opposition and commit troops to the U.S.-led invasion while other European governments were not. Baum and Potter argue that the combination of potent partisan opposition and open media makes it harder for leaders to ignore popular dissent when it comes to decisions about the use of force. The authors analyze enormous amounts of data ranging from 1965 until 2006 and find that countries where information flowed most freely—stimulated by partisan politics and open media—were the least likely to initiate conflict. They also report that countries with more political parties have tended to generate more public opposition to wars and to contribute fewer troops to “coalitions of the willing.” The book’s most striking message is that although a “democratic constraint” does exist, it is fragile: antiwar publics can often be outmaneuvered by their leaders."
29,The Post-American Middle East,https://www.foreignaffairs.com/articles/middle-east/2015-10-20/post-american-middle-east,The Post-American Middle East,"After generations of authoritarian stagnation punctuated by moments of domestic repression and interstate war, in recent years, the Middle East has begun to move. The rise of radical Islamism, the invasion of Iraq and its chaotic aftermath, the uprisings of the Arab Spring and their bloody issue, and now a sustained drop in oil prices and successful negotiations with Iran—together these have opened up what could be an unsettling new era for all involved. What are the contours of this new Middle East? Will Washington continue to pull back from actively managing the region, or will it develop an appetite for renewed intervention? And how will developments reshuffle alignments and allegiances? These are the questions this package tries to answer, delving deep into the current turmoil and its implications for U.S. policy. To start, Steven Simon and Jonathan Stevenson argue that the U.S. shift to an “offshore balancing” approach, shunning ground operations and state building in the region, has been driven by a sensible recognition that Washington has dramatically reduced scope for successful intervention these days. But Daniel Byman says that counterterrorism from a distance is not enough and that renewed attempts at state building are necessary. Michael Mandelbaum thinks that in order to deter Tehran from going nuclear, the Iran deal should be supplemented by an explicit threat of U.S. military action in response to significant cheating, and Cyrus Amir-Mokri and Hamid Biglari explain the economic policy changes the Islamic Republic needs to enact in order to reap lasting benefits from the lifting of international sanctions. Ali Khedery reports on the ongoing disintegration of Iraq, arguing that decentralization presents the least bad alternative for the country’s future, and Stephen Walt and Jared Cohen offer strategies for dealing with the Islamic State (also called ISIS) on the ground and in cyberspace, respectively. And Ilan Goldenberg and Melissa Dalton, Michael Wahid Hanna, and Natan Sachs trace the contours of the new dynamics between the United States and the Gulf Cooperation Council, Egypt, and Israel, respectively. The old Middle East has been seriously shaken; where it persists or has been restored, such as in Saudi Arabia and Egypt, it limps on without confidence or permanence. The new Middle East remains a work in progress; from Iraq and Syria to Libya and Yemen, nobody knows how things will look when the dust settles. And whether, after the nuclear deal kicks in, Iran will choose conflict, integration, or a mixture of the two remains a mystery. Stay tuned."
30,Imperialism Past and Present,https://www.foreignaffairs.com/reviews/capsule-review/2015-10-19/imperialism-past-and-present,Imperialism Past and Present,"Empires have existed since ancient times, but the term “imperialism” came into use only in the 1860s, when it was coined to describe the extraordinary burst of worldwide competition among European powers for control of markets and territory. With the post–World War II spread of national independence movements in Asia and Africa, the age of empire seemed to end, and the term “imperialism” became less a descriptor than an epithet. Saccarelli and Varadarajan seek to recover the idea of imperialism as a system of global domination. In their view, imperialism remains a constant and abiding force, evolving to fit the era. Since the end of the Cold War, they argue, the United States has pursued “neo-imperialism,” made manifest in Washington’s wars and interventions in Afghanistan, Iraq, Libya, and elsewhere. The authors are surely right that global structures of power and domination did not disappear when the Cold War ended. But the book does not advance a coherent theory of imperialism that connects the dynamics of capitalism to contemporary European or U.S. foreign policies."
31,Sovereignty: The Origin and Future of a Political and Legal Concept,https://www.foreignaffairs.com/reviews/capsule-review/2015-10-19/sovereignty-origin-and-future-political-and-legal-concept,Sovereignty: The Origin and Future of a Political and Legal Concept,"Grimm provides a learned but accessible history of the concept of sovereignty, framing it as a story of centuries of contestation over who or what possesses the right to rule. He is particularly good at situating the great theorists of sovereignty—Bodin, Grotius, Hobbes, Locke, Rousseau, Vattel, and Hegel—in their historical contexts. Along the way, Grimm illuminates the three great “revolutions” that brought the concept of sovereignty into the twentieth century: the rise of the state as an abstract entity, independent of religion or a specific monarch; the idea of popular sovereignty, manifest in the constitutional rule of law; and the globalization of sovereign territorial rule based on state formation. Like most other histories of sovereignty, Grimm’s is deeply Eurocentric. He only hints at the political explosiveness of the idea of sovereignty representing the “legal independence of states,” which was enshrined in the Westphalian settlement of 1648 and created a political logic in which the relationship between states was based on coordination rather than subordination. That subversive idea set the stage for the crumbling of empires and the spread of the Westphalian state system during the twentieth century."
32,The Country of First Boys,https://www.foreignaffairs.com/reviews/capsule-review/2015-10-19/country-first-boys,The Country of First Boys,"Sen has always been an economist with a humanistic sensibility, exploring the fraught possibilities of human advancement through the spread of markets while maintaining a commitment to global social justice. The essays collected here cover a wide range of topics—poverty, war, trade, development, freedom, education—sometimes offering sweeping arguments about modernity and social change and at other times looking for insights in small places, such as a school for girls in India. Sen rejects the view of “antiglobalizers,” who claim that international trade inherently stacks the deck against weak and poor countries. Sen argues that the poor would be even worse off in closed societies, without access to technology, trade, and the political benefits of living in an open world. The challenge, Sen argues, is to organize the global political economy so that it will more widely distribute the benefits of globalization. Indeed, this is Sen’s most compelling message: markets are here to stay, but they can and should be embedded in wider systems of social support and protections that can bring the world closer to a more just—or at least more tolerable—global order."
33,The Question of Intervention: John Stuart Mill and the Responsibility to Protect,https://www.foreignaffairs.com/reviews/capsule-review/2015-10-19/question-intervention-john-stuart-mill-and-responsibility-protect,The Question of Intervention: John Stuart Mill and the Responsibility to Protect,"Since the 1990s, in the wake of humanitarian emergencies, violent civil wars, and terrorist attacks, the tension between the norm of state sovereignty and the need to prevent atrocities has become more intense, forcing the UN and great powers to repeatedly ponder what circumstances, if any, justify international intervention. In this magisterial study, Doyle provides the most thoughtful and searching exploration yet of this dilemma. The book builds on John Stuart Mill’s classic 1859 essay on the norm of nonintervention and the prudential terms for its violation. Doyle finds Mills’ analysis flawed but sufficiently compelling to use as a starting point for the construction of a moral logic for liberal interventionism. He sifts through a rich array of cases from the nineteenth century to the present day to ascertain the costs and consequences of intervention, identifying circumstances that justify exceptions to and overrides of the nonintervention principle. Affirming the progress represented by the UN's “responsibility to protect” doctrine, which was formally articulated in 2005, Doyle makes the case for limited, cautious, and multilateral interventions that require both a license and a leash."
34,"The Mind of the African Strongman: Conversations With Dictators, Statesmen, and Father Figures",https://www.foreignaffairs.com/reviews/capsule-review/2015-10-20/mind-african-strongman-conversations-dictators-statesmen-and,"The Mind of the African Strongman: Conversations With Dictators, Statesmen, and Father Figures","Cohen, a veteran U.S. Foreign Service officer who became assistant secretary of state for African affairs in the George H. W. Bush administration, has written a book of vignettes about the 16 African heads of state with whom he had personal contact during his long career. Many of his portraits are unflattering, but Cohen is capable of real empathy, even when he is quite aware of a leader’s failings. An amusing set of anecdotes about President Léopold Sédar Senghor of Senegal—including one revolving around an improbable meal shared by Cohen, Senghor, and the American boxer Muhammad Ali—ends with the observation that Senghor was largely ignorant of the Senegalese countryside and did little to improve the welfare of his rural countrymen. Particularly interesting portraits emerge of Muammar al-Qaddafi of Libya, Robert Mugabe of Zimbabwe, and Mobutu Sese Seko of Zaire. Diplomatic historians will value the book’s substantive details. Other readers will be tickled by some of Cohen’s revelations: he reports, among other things, that Mobutu’s favorite ride at Disneyland, which the dictator visited in 1970, was one that featured an imitation Congo River, replete with electronic crocodiles."
35,Dictators and Democracy in African Development: The Political Economy of Good Governance in Nigeria,https://www.foreignaffairs.com/reviews/capsule-review/2015-10-20/dictators-and-democracy-african-development-political-economy,Dictators and Democracy in African Development: The Political Economy of Good Governance in Nigeria,"Observers usually point to a standard set of factors to explain the failures of Nigeria, which has too often underperformed since winning its independence in 1960: poor leadership, ethnic heterogeneity, and the perverse effects of oil wealth. In this sweeping history of Nigerian politics and public policy, LeVan rejects those conventional explanations, arguing instead that the country has been undermined by the prevalence of “veto players,” which he defines as political and institutional actors—such as the legislature, powerful networks within the military, and regional pressure groups—that can block policy reform in order to gain private concessions for themselves. The more power veto players have enjoyed, the less Nigeria has been able to achieve desirable economic outcomes. LeVan’s thesis raises some questions, such as why the number of veto players varies across Nigeria’s postcolonial history. But he has written a provocative and insightful analysis of the Nigerian political economy that rings true."
36,Understanding Namibia: The Trials of Independence,https://www.foreignaffairs.com/reviews/capsule-review/2015-10-20/understanding-namibia-trials-independence,Understanding Namibia: The Trials of Independence,"Since it achieved independence from South Africa in 1990, Namibia has generally been considered one of Africa’s more stable democracies, with regular multiparty elections, a progressive constitution, and seemingly robust personal freedoms. Melber, a veteran member of the country’s entrenched governing party, the South West Africa People’s Organization (SWAPO), casts a much more critical look at Namibia’s record. He argues that SWAPO has become too dominant, too willing to use state resources to maintain its grip on power, and too thin-skinned. His criticism of the country’s economic policies is even harsher. He complains that the state has done little to reduce the high levels of inequality bequeathed by the pre-independence white minority-rule government. SWAPO’s management of the country’s significant land, mining, and marine resources has mostly served to create a new, black oligarchy. Melber ends his compelling account by pondering the future. In a country where a majority of the population is under 30 years old, the swapo leadership increasingly looks like a gerontocracy. But Melber believes its hold on power is secure for now."
37,"Africa’s New Oil: Power, Pipelines, and Future Fortunes",https://www.foreignaffairs.com/reviews/capsule-review/2015-10-20/africas-new-oil-power-pipelines-and-future-fortunes,"Africa’s New Oil: Power, Pipelines, and Future Fortunes","Hicks considers whether African countries that have recently become oil producers will fall victim to the “resource curse”: the combination of corruption, poor economic growth, and environmental disaster that oil wealth has led to elsewhere. Her focus is Chad. Around 15 years ago, in exchange for financial support from the World Bank, Chad agreed to a number of restrictions on the use of its oil revenues, promising to use its newfound wealth to improve the welfare of its population. But Chad broke its pledges and ultimately turned to China, which offered help in developing Chad’s oil sector with far fewer strings attached. Hicks’ detailed account, which also looks at the role of oil in Ghana, Kenya, Niger, and Uganda, provides reasons for both optimism and pessimism. On the one hand, increasingly well-informed media and civil society organizations in those countries have ensured that oil contracts, revenues, and environmental problems are discussed much more frankly and knowledgeably than in the past. On the other hand, decision-making in these new oil sectors remains top-down and thus vulnerable to corruption."
38,"Democracy in Africa: Successes, Failures, and the Struggle for Political Reform",https://www.foreignaffairs.com/reviews/capsule-review/2015-10-20/democracy-africa-successes-failures-and-struggle-political-reform,"Democracy in Africa: Successes, Failures, and the Struggle for Political Reform","The wave of democratization that washed over Africa in the early 1990s resulted in the spread of multiparty electoral competition and the emergence of a number of imperfect democracies in which citizens enjoyed greater political liberties than they had before. But it produced few countries in which presidents did not continue to enjoy extraconstitutional advantages come election time. In this short but thorough book, Cheeseman recounts the breakdown of authoritarian governance in the 1980s, the emergence of opposition movements and parties, the process of reforms, and the obstacles to democratic consolidation. One particularly thoughtful chapter focuses on institutional arrangements that different countries have used to address ethnic tensions. Cheeseman uses lively case studies to support his main arguments and delves into the recent academic literature on this topic to assess current trends and make predictions about the future. He eschews much of the pessimism about African democracy that is fashionable today, instead offering a lucid and balanced account of both achievements and failures."
