,title1,page_url,title2,first_paragraph
0,We Need to Talk About Germany,https://www.foreignaffairs.com/articles/germany/2019-08-15/we-need-talk-about-germany,We Need to Talk About Germany,"Robert Kagan’s thought-provoking essay (“The New German Question,” May/June 2019) addresses the important issue of how a collapse of the European Union and the liberal international order might affect Germany and its role within Europe. He concludes that such a breakdown would bring back the pre–World War II “German question,” which European integration and the Atlantic alliance were in part meant to resolve."
1,How Democratic Is Hungary?,https://www.foreignaffairs.com/articles/hungary/2019-08-15/how-democratic-hungary,How Democratic Is Hungary?,"In his essay “Democracy Demotion” (July/August 2019), Larry Diamond laments the decline in prominence of U.S. democracy promotion. It is refreshing to have an American expert lift a mirror to the United States, writing that the country “has to repair its own broken democracy” before it can take up again the mantle of democracy promotion internationally. But Diamond betrays his biases when, expressing concern about “the wave of illiberal populism that has been sweeping developed and developing countries alike,” he claims that Hungarian Prime Minister Viktor Orban “has presided over the first death of a democracy in an EU member state.”"
2,Autocracy Now,https://www.foreignaffairs.com/issue-packages/2019-08-13/autocracy-now,What’s Inside,"Historical eras tend to have characteristic leadership types: the fledgling democrats of the 1920s, the dictators of the 1930s and 1940s, the nationalist anticolonialists of the 1950s and 1960s, the gerontocrats of the 1970s, the fledgling democrats (again) of the 1980s and 1990s. Now we’re back to dictators."
3,Bad News,https://www.foreignaffairs.com/reviews/review-essay/2019-08-12/bad-news,Bad News,"In 2004—an ordinary, healthy year for the newspaper business—The Washington Post earned $143 million in profit. Five years later, in 2009, the paper lost $164 million amid a shift from paid print to free digital consumption, the erosion of its classified and local advertising businesses, and the global financial crisis. The collapse of its business model forced round after round of cutbacks, staff buyouts, and layoffs. That year, the Post shut all its domestic reporting bureaus outside the Washington area, including those in Chicago, Los Angeles, and New York."
4,The Population Bust,https://www.foreignaffairs.com/reviews/review-essay/2019-08-12/population-bust,The Population Bust,"For most of human history, the world’s population grew so slowly that for most people alive, it would have felt static. Between the year 1 and 1700, the human population went from about 200 million to about 600 million; by 1800, it had barely hit one billion. Then, the population exploded, first in the United Kingdom and the United States, next in much of the rest of Europe, and eventually in Asia. By the late 1920s, it had hit two billion. It reached three billion around 1960 and then four billion around 1975. It has nearly doubled since then. There are now some 7.6 billion people living on the planet."
5,Party Man,https://www.foreignaffairs.com/china/party-man,Party Man,"When Joe Biden met Xi Jinping in 2011, China’s leader in waiting hit the U.S. vice president with a volley of questions about U.S. politics. How did the system work? What was the relationship between the White House and Congress? How should Beijing interpret the political signals coming out of Washington? For Biden and his advisers, these were welcome questions after nearly a decade of frustration in dealing with Xi’s predecessor, the colorless, impenetrable Hu Jintao."
6,Can America Still Protect Its Allies?,https://www.foreignaffairs.com/articles/world/2019-08-12/can-america-still-protect-its-allies,Can America Still Protect Its Allies?,"Since the end of World War II, U.S. strategic thinking has been dominated by the doctrine of deterrence. At its most simple, deterrence refers to one state’s ability to use threats to convince another that the costs of some action—say, invading one of its neighbors—will outweigh the benefits. Such was the logic behind the Cold War concept of mutual assured destruction: if either the United States or the Soviet Union used nuclear weapons, the other would respond with nuclear strikes of its own, resulting in the total devastation of both. By making the costs of war intolerably high, both sides hoped to keep the peace."
7,Winning the Peace in Iraq,https://www.foreignaffairs.com/iraq/winning-peace-iraq,Winning the Peace in Iraq,"For Americans who came of age near the turn of the current century, the war in Iraq was a generation-defining experience. When the United States invaded the country in 2003, toppling the government of Saddam Hussein in a matter of weeks, many saw the war as a necessary or even noble endeavor to stop the spread of weapons of mass destruction, which Saddam was allegedly developing—and bring democracy to parts of the world that had long suffered under the weight of tyranny."
8,The Dictators’ Last Stand,https://www.foreignaffairs.com/articles/world/2019-08-12/dictators-last-stand,The Dictators’ Last Stand,"It has been a good decade for dictatorship. The global influence of the world’s most powerful authoritarian countries, China and Russia, has grown rapidly. For the first time since the late nineteenth century, the cumulative GDP of autocracies now equals or exceeds that of Western liberal democracies. Even ideologically, autocrats appear to be on the offensive: at the G-20 summit in June, for instance, President Vladimir Putin dropped his normal pretense that Russia is living up to liberal democratic standards, declaring instead that “modern liberalism” has become “obsolete.”"
9,Why America Loses Wars: Limited War and US Strategy From the Korean War to the Present,https://www.foreignaffairs.com/reviews/capsule-review/2019-08-12/why-america-loses-wars-limited-war-and-us-strategy-korean-war,Why America Loses Wars: Limited War and US Strategy From the Korean War to the Present,"Since 1945, the United States’ experience of war has been a frustrating one, full of stalemates, setbacks, and only occasional victories. In this lively and opinionated book, Stoker pins a major part of the blame on muddled thinking about “limited war.” He is a scholar of Carl von Clausewitz and frequently turns to the Prussian general as his authority. Stoker believes that in wartime, leaders should first and foremost set proper political objectives (and reappraise them when necessary) and not let the means they are prepared to use dictate the ends. Time and again, from Korea to Vietnam to the war against the Islamic State (or ISIS), U.S. leaders have been either too vague about what they are seeking to do or unwilling to devote the requisite resources to achieve it. Theorists, such as Thomas Schelling, have contributed to the muddle by their readiness to talk about war as a form of bargaining. Stoker’s analysis of the United States’ failures is convincing, but his argument that better thinking would enable political leaders to set clear objectives and pursue them to victory is less so."
10,The War for Gaul: A New Translation,https://www.foreignaffairs.com/reviews/capsule-review/2019-08-12/war-gaul-new-translation,The War for Gaul: A New Translation,"Julius Caesar’s war stories are so associated with Latin textbooks that they tend to get forgotten as contributions to military history. Originally dispatches sent back to the Senate in Rome, they explained how well Caesar was doing in his battles with a variety of rugged foes. They aimed to boost Caesar’s reputation as a great general and support his bid for power, but they also serve as useful records of events, if not quite the unvarnished truth. O’Donnell has produced a vigorous, modern, and uncluttered translation, removing sections added to the commentaries by later authors and adding few footnotes. He encourages readers to focus on the candor and cruelty with which Caesar describes his victories and his negotiations with foreign leaders. In a jaunty introduction, O’Donnell demonstrates how to appreciate the book as a major contribution to martial literature while deploring its morals. This is, he declares, “the best bad man’s book ever written.”"
11,Three Books on World War II,https://www.foreignaffairs.com/reviews/capsule-review/2019-08-12/three-books-world-war-ii,Three Books on World War II,"Although a vast literature has covered every aspect of World War II, the war’s length, scope, and intensity mean that authors still manage to find new angles on the same material. Holland adopts a bottom-up approach to the familiar story of the June 1944 Normandy landings and the subsequent fighting on the continent. He shows how the commanders laid their plans and responded to new developments, and he conveys well the sheer scale of the logistical effort and the cleverness of the Allied deception plan. At the heart of the book are the stories of individual people caught up in great events: a teenage German soldier crouching in a bunker watching the Americans land while his confused superiors try to make sense of the invasion, Allied paratroopers dropping into hostile territory, resistance fighters sabotaging German communications, exhausted pilots flying sortie after sortie with little expectation that they would survive much longer, infantrymen scouring the roads and fields for ambushes, a nurse coping with the wounded. The sheer weight of the Allies’ firepower and their command of the air (the Allies flew 14,674 sorties on D-Day; the Luftwaffe flew 80) might make the result seem inevitable in retrospect, but amphibious landings had failed before, and Holland brings to life what a grueling, vicious, and terrifying battle this was."
12,Free Trade and Prosperity: How Openness Helps the Developing Countries Grow Richer and Combat Poverty,https://www.foreignaffairs.com/reviews/capsule-review/2019-08-12/free-trade-and-prosperity-how-openness-helps-developing-countries,Free Trade and Prosperity: How Openness Helps the Developing Countries Grow Richer and Combat Poverty,"Panagariya puts forth a trenchant case against import tariffs and other forms of trade protectionism in developing countries. He carefully reviews both the economic theory of import substitution (government-led efforts to replace imported goods with domestically produced ones) and the empirical evidence from the past six decades showing which trade policies have fostered economic growth in developing countries. A vigorous supporter of free trade, he criticizes those who advocate import substitution as a path to development. He concedes that rapid economic growth often raises income inequality even as it almost always slashes poverty, but he cautions that some policies aimed at reducing inequality, including import substitution, may thwart growth and thus leave most people worse off."
13,Titans of the Climate: Explaining Policy Process in the United States and China,https://www.foreignaffairs.com/reviews/capsule-review/2019-08-12/titans-climate-explaining-policy-process-united-states-and-china,Titans of the Climate: Explaining Policy Process in the United States and China,"This collaboration between an American scholar-official and a Chinese counterpart seeks to demystify how their respective governments make and execute policy and explores the two countries’ differing motivations, procedures, and constraints. The authors focus on environmental policy, especially the 2014 agreement between China and the United States, the two largest emitters of greenhouse gases, that set out a joint plan to mitigate climate change by 2030. The deal, which included China’s first-ever commitment to halt the growth of its emissions, made possible the Paris agreement on climate change the following year. U.S. President Donald Trump has pledged to withdraw the United States from the Paris agreement (a decision that will take effect in late 2020), but in the decentralized United States, the effect of the withdrawal will be muted, as over two-thirds of the states and many cities, probably with the support of a majority of U.S. citizens, will carry on with their climate change policies."
14,Evolution or Revolution: Rethinking Macroeconomic Policy After the Great Recession,https://www.foreignaffairs.com/reviews/capsule-review/2019-08-12/evolution-or-revolution-rethinking-macroeconomic-policy-after,Evolution or Revolution: Rethinking Macroeconomic Policy After the Great Recession,"This thought-provoking and accessible collection of reflections by economists, central bankers, and government officials explores how the unusual circumstances that have characterized the global economy since 2007 should change economists’ understanding of macroeconomic policy. One obvious point is that economists should pay much more attention to the financial system and its influence on production and employment, as well as to the policies that might strengthen the system against external shocks and destabilizing internal dynamics. Many of the contributors also argue that over the past decade, economies in Europe and North America have relied too much on monetary policy to shore up weak growth and not enough on government taxing and spending to boost demand. They note that allowing capital to flow freely across borders, as it now does in many parts of the world, creates severe problems for emerging-market countries trying to manage their monetary policies and currency exchange rates. One disappointing omission is the lack of a discussion of the influence of accounting rules on corporate behavior and economic stability."
15,"Open: The Progressive Case for Free Trade, Immigration, and Global Capital",https://www.foreignaffairs.com/reviews/capsule-review/2019-08-12/open-progressive-case-free-trade-immigration-and-global-capital,"Open: The Progressive Case for Free Trade, Immigration, and Global Capital","Amid a growing backlash against international economic interdependence, Clausing makes a strong case in favor of foreign trade in goods and services, the cross-border movement of capital, and immigration. This valuable book amounts to a primer on globalization, explaining without jargon both its benefits and its costs. The former, in her view, greatly outweigh the latter, but she also offers constructive proposals to reduce globalization’s downsides. Clausing’s field of expertise is tax avoidance and evasion by multinational corporations, which employ hordes of well-paid lawyers to take advantage of loopholes in national tax laws and swarms of lobbyists to help create and maintain those loopholes. Clausing argues that the tax reform passed by the U.S. Congress in 2017 contains many moves in the wrong direction."
16,Firefighting: The Financial Crisis and Its Lessons,https://www.foreignaffairs.com/reviews/capsule-review/2019-08-12/firefighting-financial-crisis-and-its-lessons,Firefighting: The Financial Crisis and Its Lessons,"This collaboration by the three U.S. government officials who led the fight in the United States against the financial crisis of 2008 presents a mature and revealing assessment of the genesis and dynamics of the meltdown—and of the government’s ultimate success in halting it, although not before a painful recession had set in. One of the most interesting points is that they did not want Lehman Brothers to collapse in September 2008, despite some claims to the contrary, but lacked the legal authority to prevent it. The authors also argue that the many bailouts of other financial institutions worked, as they stopped a panic that could have been much worse. In the end, taxpayers recovered much more than they paid out, and executives and shareholders lost heavily, as they should have in a capitalist system—a point that undercuts fears that the bailouts would generate moral hazard and thus lead management and shareholders to take more risks in the future. Bernanke, Geithner, and Paulson believe that the U.S. economy is much better positioned to avoid a financial crisis today than it was in 2007 but that the federal government is now less well equipped to deal with one when it eventually occurs."
17,Nationalism: A Short History,https://www.foreignaffairs.com/reviews/capsule-review/2019-08-12/nationalism-short-history,Nationalism: A Short History,"Greenfeld, the author of massive historical-sociological studies of the rise of nationalism, capitalism, and modernity, here distills the story of nationalism into a short and captivating historical drama. She traces the origins of “national consciousness” to sixteenth-century England, when the new Tudor monarchy was attempting to rebuild—and legitimate—the political order following the destruction of the aristocracy in the dynastic wars of the previous century. The old self-understanding of England as a social hierarchy was replaced with an image of “the nation,” made up of a single English people. Greenfeld argues that the notions of social equality—secular, democratic, and egalitarian—that dominated this English-led “revolution in consciousness” played out across the rest of the world in the following centuries. The Protestant Reformation, the American and French Revolutions, the rise of commercial capitalism, the coming of modern science, the emergence of modern Chinese and Japanese nationalism—all have their place in Greenfeld’s grand narrative. Greenfeld argues that nationalism’s appeal flows from the dignity that a vibrant national consciousness bestows on a nation’s members. The task for those seeking to preserve the liberal democratic way of life is to reclaim nationalism’s progressive orientation."
18,Leadership and the Rise of Great Powers,https://www.foreignaffairs.com/reviews/capsule-review/2019-08-12/leadership-and-rise-great-powers,Leadership and the Rise of Great Powers,"Yan takes on a classic question: Why do great powers rise and fall? With an eye to explaining recent Chinese success in challenging U.S. dominance, he advances a theory he calls “moral realism.” Borrowing from ancient Chinese philosophers, Yan argues that when governments define a moral worldview, they are more likely to successfully take over from their declining peers. Much of the book details how states can project moral strength in world affairs, which, for Yan, means offering sober and consistent definitions of the national interest, protecting international norms, and establishing credibility in alliances. Yan argues that since the end of the Cold War, China has been more successful—or “efficient”—in this project than the United States and thus has steadily gained ground on its rival, although he admits that China has yet to develop a set of postliberal values that can compete for global influence. It’s not entirely clear whether Yan’s theory is distinctively Chinese, but he is surely correct that U.S.-Chinese competition will turn not just on hard power but also on each country’s ability to command the moral high ground."
19,The World’s Most Prestigious Prize: The Inside Story of the Nobel Peace Prize,https://www.foreignaffairs.com/reviews/capsule-review/2019-08-12/worlds-most-prestigious-prize-inside-story-nobel-peace-prize,The World’s Most Prestigious Prize: The Inside Story of the Nobel Peace Prize,"Since it was first awarded, in 1901, the Nobel Peace Prize has been given annually to a kaleidoscopic assortment of activists, politicians, diplomats, moral leaders, and organizations—from Theodore Roosevelt and Jane Addams to Amnesty International and the European Union. Lundestad, a longtime director of the Norwegian Nobel Institute, argues that despite the diversity of figures and causes, the honorees tend to reflect a “Norwegian approach” to international politics, a mix of realism, idealism, and liberal internationalism that emphasizes practical efforts to promote democracy, human rights, humanitarianism, disarmament, and international cooperation. In its early years, the prize went primarily to European and American men, but the committee has since broadened its reach, honoring women, non-Western groups, and activists engaged in local and nontraditional peacemaking, such as environmentalism and campaigns against sexual violence. Many view the Nobel Peace Prize as an expression of Western liberal values. The Chinese government protested bitterly in 2010 when the award was given to Liu Xiaobo, a Chinese human rights activist. But Lundestad makes an eloquent case that the prize has a universal appeal, grounded in humanitarian and nonviolent ideals on which no country or civilization holds a monopoly."
20,Democratic Capitalism at the Crossroads: Technological Change and the Future of Politics,https://www.foreignaffairs.com/reviews/capsule-review/2019-08-12/democratic-capitalism-crossroads-technological-change-and-future,Democratic Capitalism at the Crossroads: Technological Change and the Future of Politics,"Beginning in the 1980s, Boix argues, revolutions in communications and the globalization of trade and production undermined the old class compromises at the heart of Western liberal democracy. Highly educated professionals have seen their incomes soar, and previously well-paid manufacturing workers, the old backbone of the middle class, are now struggling to survive. Boix places this crisis in perspective, illuminating the fraught relationship among technology, capitalism, and democracy over the last two centuries. The book focuses on watershed moments, starting with the birth of the Industrial Revolution in cities such as Manchester, where low factory wages, poor living conditions for workers, and rising wealth for owners brought political struggles over state protection and the extent of democracy. The golden age of capitalism and democracy emerged in the early twentieth century in places such as Detroit, where new technologies of mass production raised labor productivity, boosted wages, brought down inequality, and enabled vibrant liberal democracies. Today, another technological revolution is generating radical income inequality and destabilizing political life. Yet Boix rejects technological and economic determinism. Industrial societies, he believes, can still regain control of the future."
21,The Oxford Handbook of the Ethiopian Economy,https://www.foreignaffairs.com/reviews/capsule-review/2019-08-12/oxford-handbook-ethiopian-economy,The Oxford Handbook of the Ethiopian Economy,"Over the last two decades, Ethiopia has emerged as one of the fastest-growing economies in the world. This has proved a boon for analysts, many of whom have seized on Ethiopia’s success as vindication of their particular philosophy of economic development. The editors of this massive volume on the Ethiopian economy have commendably sought to include as many viewpoints as possible while emphasizing empirical approaches. The book covers the major issues, including macroeconomic policy, the development of the social welfare system, agriculture, and industrial policy. Although the different theoretical explanations for Ethiopia’s successes and failures rarely confront one another in the book, the volume as a whole reveals a pragmatic and flexible government trying to solve developmental problems with the resources it has available. Ethiopia has made mistakes, but unlike many other African countries, it has generally avoided repeating them and has tended to eschew ideology in favor of what works on the ground. The state has taken an interventionist stance, but it usually pays attention to market signals and the welfare of its population."
22,Combatants: A Memoir of the Bush War and the Press in Uganda,https://www.foreignaffairs.com/reviews/capsule-review/2019-08-12/combatants-memoir-bush-war-and-press-uganda,Combatants: A Memoir of the Bush War and the Press in Uganda,"In 1984, Pike, then a London-based journalist fresh out of college, used expatriate Ugandan connections to arrange access to the camps of the National Resistance Army in the central Ugandan bush, where the group was fighting a guerrilla war against the regime of Milton Obote, under the leadership of a 40-year-old Yoweri Museveni. Pike’s reports in the British press, which documented atrocities perpetrated by the Ugandan government and cast the NRA in a favorable light, helped the group gain credibility in the West. In 1986, when Museveni came to power, he invited Pike to edit the government newspaper, the New Vision, promising him editorial independence. For two decades, Pike ran the paper, turning it into Uganda’s newspaper of record, before the regime’s growing authoritarianism forced him out. Pike tells the story well, mixing his personal experiences with an analysis of the last 30 years of Ugandan history. He follows his detailed account of the nasty civil war of the 1980s with a perceptive look at the Museveni regime, from its early informal idealism to the ossified personal dictatorship of today."
