,title1,page_url,title2,first_paragraph
56,The Internet Freedom League,https://www.foreignaffairs.com/world/internet-freedom-league,The Internet Freedom League,"The early days of the Internet inspired a lofty dream: authoritarian states, faced with the prospect of either connecting to a new system of global communication or being left out of it, would choose to connect. According to this line of utopian thinking, once those countries connected, the flow of new information and ideas from the outside world would inexorably pull them toward economic openness and political liberalization. In reality, something quite different has happened. Instead of spreading democratic values and liberal ideals, the Internet has become the backbone of authoritarian surveillance states all over the world. Regimes in China, Russia, and elsewhere have used the Internet’s infrastructure to build their own national networks. At the same time, they have installed technical and legal barriers to prevent their citizens from reaching the wider Internet and to limit Western companies from entering their digital markets."
57,The India Dividend,https://www.foreignaffairs.com/articles/india/2019-08-12/india-dividend,The India Dividend,"For two decades, Washington has had high hopes for India on the global stage. Gigantic, populous, and resource rich, India is, by all appearances, a superpower in waiting. And as the world’s largest democracy, it promises—according to those hopes—to be a crucial U.S. partner at a time of rising competition from authoritarian challengers."
58,The Old World and the Middle Kingdom,https://www.foreignaffairs.com/articles/china/2019-08-12/old-world-and-middle-kingdom,The Old World and the Middle Kingdom,"Europe is beginning to face up to the challenges posed by a rising China. From the political debates roiling European capitals over the Chinese telecommunications giant Huawei’s involvement in building 5G mobile networks to the tense EU-China summit earlier this year, recent events have shown that European leaders are growing uneasy in a relationship that until recently both sides saw as immensely beneficial. They worry about the political influence China has gained, especially over the EU’s smaller members, and its growing economic clout and technological prowess. They are starting, tentatively, to push back."
59,The Vigilante President,https://www.foreignaffairs.com/articles/philippines/2019-08-12/vigilante-president,The Vigilante President,"In his final year in law school at a Catholic men’s college in Manila, Rodrigo Duterte shot a classmate who made fun of his thick accent. The young “Rody,” as Duterte was then known, was the son of a provincial governor on the southern Philippine island of Mindanao. Like many of the progeny of the Philippine political elite, he had enjoyed a privileged upbringing. He grew up surrounded by guns and bodyguards, flew his father’s plane when he was in his hometown, and hung out with the sons of local notables in his Jesuit-run boys’ school. In Manila, however, Duterte’s accent, typical of those from the country’s southern periphery, marked him as an unsophisticated provinciano. Hence the classmate’s teasing."
60,The Return of Doomsday,https://www.foreignaffairs.com/articles/russian-federation/2019-08-06/return-doomsday,The Return of Doomsday,"The year is 2020. The Russian military is conducting a large exercise in Kaliningrad, a Russian exclave on the Baltic Sea that borders the NATO member states Lithuania and Poland. An observer aircraft from the Western alliance accidentally crosses into Russian airspace and is shot down by a surface-to-air missile. NATO rushes air squadrons and combat vessels into the region. Both sides warn that they will consider using nuclear weapons if their vital interests are threatened."
61,The Sources of Chinese Conduct,https://www.foreignaffairs.com/articles/china/2019-08-12/sources-chinese-conduct,The Sources of Chinese Conduct,"In February 1946, as the Cold War was coming into being, George Kennan, the chargé d’affaires at the U.S. embassy in Moscow, sent the State Department a 5,000-word cable in which he tried to explain Soviet behavior and outline a response to it. A year later, the text of his famous “Long Telegram” was expanded into a Foreign Affairs article, “The Sources of Soviet Conduct.” Writing under the byline “X,” Kennan argued that the Soviets’ Marxist-Leninist ideology was for real and that this worldview, plus a deep sense of insecurity, was what drove Soviet expansionism. But this didn’t mean that outright confrontation was inevitable, he pointed out, since “the Kremlin has no compunction about retreating in the face of superior force.” What the United States had to do to ensure its own long-term security, then, was contain the Soviet threat. If it did, then Soviet power would ultimately crumble. Containment, in other words, was both necessary and sufficient."
62,Competition Without Catastrophe,https://www.foreignaffairs.com/articles/china/competition-with-china-without-catastrophe,Competition Without Catastrophe,"The United States is in the midst of the most consequential rethinking of its foreign policy since the end of the Cold War. Although Washington remains bitterly divided on most issues, there is a growing consensus that the era of engagement with China has come to an unceremonious close. The debate now is over what comes next."
63,Erdogan’s Way,https://www.foreignaffairs.com/articles/turkey/2019-08-12/erdogans-way,Erdogan’s Way,"Recep Tayyip Erdogan is the most baffling politician to emerge in the 96-year history of Turkey. He is polarizing and popular, autocratic and fatherly, calculating and listless. Erdogan’s ideology shifts every few years, and he appears to make up his road map as he goes along. He is short-tempered: he grabs cigarette packs from citizens to try to force them into quitting, scolds reporters who ask tough questions, and once walked off the stage after an angry exchange with the Israeli president at the World Economic Forum in Davos. But he can also be extremely patient. It has taken him 16 years to forge what he calls “the new Turkey,” an economically self-reliant country with a marginalized opposition and a subservient press."
64,The Transformer,https://www.foreignaffairs.com/articles/hungary/2019-08-12/transformer,The Transformer,"In the summer of 1989, the Soviet Union was beginning to falter, and its grasp on Eastern Europe was slipping. But in Hungary, the Soviets were hardly gone yet: Moscow still maintained around 70,000 soldiers, 1,000 tanks, and 1,500 armored vehicles there. Janos Kadar, who had built and led the repressive, Soviet-aligned regime that had run the country for the past three decades, had resigned the previous year, as the economy sputtered and Kadar himself struggled with cancer. But the regime centered on Kadar’s Hungarian Socialist Workers’ Party remained intact and still presided over an immense security apparatus and a network of armed militias."
65,Putin the Great,https://www.foreignaffairs.com/articles/russian-federation/2019-08-12/putin-great,Putin the Great,"On January 27, 2018, Vladimir Putin became the longest-serving leader of Russia since Joseph Stalin. There were no parades or fireworks, no embarrassingly gilded statues unveiled or unseemly displays of nuclear missiles in Red Square. After all, Putin did not want to be compared with Leonid Brezhnev, the bushy-browed septuagenarian whose record in power he had just surpassed. Brezhnev, who ruled the Soviet Union from 1964 to 1982, was the leader of Putin’s gritty youth, of the long stagnation that preceded the empire’s collapse. By the end, he was the butt of a million jokes, the doddering grandfather of a doddering state, the conductor of a Russian train to nowhere. “Stalin proved that just one person could manage the country,” went one of those many jokes. “Brezhnev proved that a country doesn’t need to be managed at all.”"
