,title1,page_url,title2,first_paragraph
23,African Catholic: Decolonization and the Transformation of the Church,https://www.foreignaffairs.com/reviews/capsule-review/2019-08-12/african-catholic-decolonization-and-transformation-church,African Catholic: Decolonization and the Transformation of the Church,"The Catholic Church is often described as one of the key instruments of French colonialism, working in cahoots with the administrators of France’s colonies in central and western Africa to legitimate French rule to its parishioners. That may have been true in the early years of the French empire, but Foster tells the much more complex and interesting story of the decolonization era, when the church slowly but surely came to grips with the inevitability of independence and the need to Africanize itself. Foster emphasizes the influence of African Catholic intellectuals, such as the Senegalese Alioune Diop, who argued that the church needed to become more universalistic and less European. The Vatican’s changing attitudes were partly the result of sheer pragmatism; after African states’ independence, retaining an all-French roster of bishops and cardinals on the continent would have been a nonstarter. But Foster argues that the church of the post–World War II era was independently undergoing major doctrinal changes, affected at least in part by the end of colonialism. Her research uncovers conclusive evidence, for example, of Diop’s influence on Pope John XXIII in the lead-up to the Second Vatican Council."
24,"How Autocrats Compete: Parties, Patrons, and Unfair Elections in Africa",https://www.foreignaffairs.com/reviews/capsule-review/2019-08-12/how-autocrats-compete-parties-patrons-and-unfair-elections-africa,"How Autocrats Compete: Parties, Patrons, and Unfair Elections in Africa","In recent years, several regimes have emerged that combine authoritarianism with genuinely competitive multiparty elections. In this tightly argued book, which focuses on Cameroon, Kenya, and Tanzania but has implications for all authoritarian countries that nevertheless regularly hold elections, Morse argues that such regimes generally rely on organizational strength and legitimacy to win at the ballot box—but when they lack those attributes, they turn to violence, repression, and vote rigging to stay in power. Morse’s work helps explain the resilience of regimes such as those in Mozambique and Tanzania, where well-organized and relatively legitimate dominant political parties have maintained control over systems that are far from fully democratic, while only rarely relying on repression or fraudulent elections. Interestingly, Morse also shows that international pressure matters. When foreign governments and international organizations are willing to condone nondemocratic practices and continue their economic support, authoritarian regimes prove more stable."
25,"Digital Democracy, Analogue Politics: How the Internet Era Is Transforming Politics in Kenya",https://www.foreignaffairs.com/reviews/capsule-review/2019-08-12/digital-democracy-analogue-politics-how-internet-era-transforming,"Digital Democracy, Analogue Politics: How the Internet Era Is Transforming Politics in Kenya","This survey of the growing role of social media in Kenyan society and politics does not offer a straightforward answer to the implicit question in its subtitle. Nonetheless, it develops some keen insights into the effects of the Internet in Kenya. With more than seven million of its citizens on Facebook and over a million on Twitter, Kenya may well be sub-Saharan Africa’s most online country. Nyabola describes a sophisticated community of users who have found agency through the Internet, whether in criticizing CNN for what they see as its Eurocentric coverage or in publicizing corruption and incompetence by Kenyan officials. The Kenyan government, Nyabola reveals, is deeply ambivalent about the Internet, attracted to it as a symbol of modernity but wary of the hard-to-control political spaces it creates. Nyabola’s conclusions are far from optimistic. She documents how the Internet allowed foreign actors, such as the British political consulting firm Cambridge Analytica, to manipulate voters during the 2017 Kenyan elections and explores how social media may come to undermine Kenyan democracy."
26,The PM Years,https://www.foreignaffairs.com/reviews/capsule-review/2019-08-12/pm-years,The PM Years,"In this hefty second volume of his autobiography, the two-time Australian prime minister settles scores with Julia Gillard, a fellow Labor Party politician who in 2010 ousted him in what Rudd calls a “cynical coup.” Their struggle propelled Australia toward the kind of poisonous politics that is afflicting so many democracies today. Besides Gillard and “the faceless men of the [Labor Party] factions,” Rudd blames his ouster on the Rupert Murdoch–owned media, which opposed his progressive policies, and on mining interests who he believes colluded with Gillard and her allies to prevent the imposition of a new tax. The book also details Rudd’s many accomplishments on issues such as Australia’s response to the 2008 financial crisis, climate change, indigenous affairs, infrastructure, same-sex relationships, and health care. Unusually for a political memoir, the book is unguardedly emotional. This, together with Rudd’s elephantine memory, brings the reader as close to the daily texture of life in politics as it is possible for an outsider to get."
27,In Plain Sight: Impunity and Human Rights in Thailand,https://www.foreignaffairs.com/reviews/capsule-review/2019-08-12/plain-sight-impunity-and-human-rights-thailand,In Plain Sight: Impunity and Human Rights in Thailand,"This deeply researched history focuses not so much on the human rights violations that have occurred in Thailand during its frequent episodes of military rule but on the mechanisms by which the perpetrators have avoided accountability. These have included legalizing the arbitrary detention of purported “enemies of the nation,” “hooligans,” and persons considered a “danger to society”; author­izing summary executions when necessary to “defend the nation”; giving the police the discretion to do anything they want in the name of eliminating communism; holding blameless any person acting in the line of duty; dismissing cases as falling outside the jurisdiction of the courts or for insufficient evidence; and declaring amnesties. The legal techniques have varied, but their purpose has stayed the same: to protect the monarchistic elite and its agents. Haberkorn argues that repression is all the more effective when the authorities openly twist the law to protect the perpetrators. The more blatant the impunity, the stronger the message that victims have no hope of redress."
28,The Great Successor: The Divinely Perfect Destiny of Brilliant Comrade Kim Jong Un,https://www.foreignaffairs.com/reviews/capsule-review/2019-08-12/great-successor-divinely-perfect-destiny-brilliant-comrade-kim,The Great Successor: The Divinely Perfect Destiny of Brilliant Comrade Kim Jong Un,"As the younger son of his father’s third wife, Kim Jong Un was an unlikely heir to the North Korean throne, but from the regime’s perspective, he turned out to be a brilliant choice. He has taken over his grandfather and father’s dynastic cult of personality; reportedly killed, imprisoned, or brought to heel the senior advisers he inherited; maintained the system of hereditary political castes and the gulag; tightened the country’s borders; heightened surveillance of ordinary citizens; restored some economic dynamism; fostered a small moneyed class of supporters; pushed forward missile and nuclear weapons testing; evaded global sanctions; resisted Chinese pressure; and run rings around two U.S. presidents. To figure out how Kim has done it all, Fifield tracked down his aunt and uncle, who run a dry cleaning shop in the United States; interviewed his schoolmates from Switzerland; spoke with the business partner of Kim’s assassinated half brother, Kim Jong Nam; and visited North Korea 11 times. The North Korean system, Fifield concludes, is strong enough to last for a long time. The biggest questions concern the state of the economy and Kim’s health. If he survives to hand power to a fourth generation, the man Fifield labels “the most Machiavellian figure of our time” will have achieved a remarkable feat."
29,The Costliest Pearl: China’s Struggle for India’s Ocean,https://www.foreignaffairs.com/reviews/capsule-review/2019-08-12/costliest-pearl-chinas-struggle-indias-ocean,The Costliest Pearl: China’s Struggle for India’s Ocean,"The Indian Ocean is scattered with islands, some small, some large, some inhabited, some not, but all strategically significant and all more or less militarized. They range from the Comoros and Madagascar, near the African coast, to the Maldives and Diego Garcia, south of India, to the Andaman and Nicobar Islands and the Cocos Islands, off the coasts of Myanmar and Indonesia, respectively. Lintner recounts centuries of competition among pirates, fishermen, slave traders, mercenaries, money launderers, colonists, and the occasional North Korean adviser to an island dictator. In recent times, the Indian and U.S. navies have dominated the ocean. But under its Belt and Road Initiative, Beijing has been building ports at a rate that suggests China may have ambitions to join them as a major Indian Ocean power. Lintner’s decades of reporting from all over Asia lend him shrewd insight into the region’s geography and politics. The book does not substantiate his claim that the risk of war is greater in the Indian Ocean than in the South China Sea, but it shatters any complacency the Indian navy and its partners might have about their ability to dominate these waters without challenge."
30,"The East Turkestan Independence Movement, 1930s to 1940s",https://www.foreignaffairs.com/reviews/capsule-review/2019-08-12/east-turkestan-independence-movement-1930s-1940s,"The East Turkestan Independence Movement, 1930s to 1940s","The crisis in Xinjiang, where Chinese authorities have locked up an estimated one million or more Uighurs in “reeducation camps” in an attempt, they claim, to eliminate terrorism, is an object lesson in William Faulkner’s aphorism “The past is never dead. It’s not even past.” Neither the Uighur population nor the Chinese authorities have forgotten the short-lived Islamic Republic of East Turkestan of 1933 to 1934 or the longer and more institutionalized East Turkestan Republic of 1944 to 1946. Both grew out of the Uighur enlightenment movement, whose leading thinkers believed that Han rulers had treated the Uighurs unfairly ever since their region was incorporated into China in the late nineteenth century. Wang uses original documents in many languages to bring the current crisis into historical focus. The two Uighur independence movements were led by pro-Soviet Uighur intellectuals who had received modern educations. Although they were ethnic nationalists, they used elements of Islam to forge a fragile common identity with other classes and ethnic groups, including the more numerous, nomadic Kazakhs. The two short-lived episodes of self-rule showed what the government of an independent East Turkestan might look like and that such a country would not survive without Russian support, which in both historical cases proved neither strong nor lasting."
31,Staggering Forward: Narendra Modi and India’s Global Ambition,https://www.foreignaffairs.com/reviews/capsule-review/2019-08-12/staggering-forward-narendra-modi-and-indias-global-ambition,Staggering Forward: Narendra Modi and India’s Global Ambition,"Karnad, a prominent Indian conservative strategist, deflates Narendra Modi’s image as a nationalist strongman and risk-taker, at least as far as foreign policy is concerned. He diagnoses the Indian prime minister as an authoritarian who is nevertheless averse to the kind of bold change needed to move India beyond its current status of “great power lite.” To realize India’s proper role, Karnad thinks, the country must drop its misguided obsession with Pakistan and focus on China; it should, however, avoid aligning with an overweening and unreliable United States and forge links with other powers, such as Australia, Japan, and the countries of Southeast Asia. India should develop the ability to produce advanced weapons systems domestically, strengthen its influence in Bhutan and Nepal, build military bases on Indian Ocean islands, and adopt a nuclear first-use policy to deter Chinese aggression. New Delhi should even play “the Tibet and Uyghur cards,” a disruptive proposal that Karnad does not spell out in detail. India’s entrenched and uncoordinated security bureaucracy is unlikely to adopt these ideas. But Karnad makes a bracing case that if it does not, India will continue to play a “small stakes game anchored in short policy horizons.”"
32,A Thousand Small Sanities: The Moral Adventure of Liberalism,https://www.foreignaffairs.com/reviews/capsule-review/2019-08-12/thousand-small-sanities-moral-adventure-liberalism,A Thousand Small Sanities: The Moral Adventure of Liberalism,"In this spirited manifesto, Gopnik paints a sweeping portrait of modern liberalism’s founding principles and accomplishments and makes the case for the theory’s continued relevance in today’s struggle to build decent and inclusive societies. Gopnik traces liberalism’s origins to the Enlightenment and the early modern humanistic tradition. It was rooted in a belief—articulated by thinkers such as David Hume and Adam Smith—in the inherent sociability of people and the human capacity for mutual respect. Liberal society is grounded not in blood and soil, nor in traditional authority, but rather in an idea of “shared choice,” a vision of a political community held together by crosscutting values: liberty, equality, and toleration. For Gopnik, liberalism is best understood not as a formal doctrine, a set of abstract principles, or a group of fixed political institutions, but as a way of life. Across the centuries, liberal thought has been united by “the liberal temperament,” an embrace of pluralism and reform and a skepticism of utopias. Liberalism’s great project, as Gopnik eloquently argues, is the unending struggle to build a society with both liberty and equality at its core."
33,Super Continent: The Logic of Eurasian Integration,https://www.foreignaffairs.com/reviews/capsule-review/2019-08-12/super-continent-logic-eurasian-integration,Super Continent: The Logic of Eurasian Integration,"This book is the definitive statement of Calder’s long-standing thesis that technological and economic changes are integrating the Eurasian “super continent,” as foreseen over a century ago by the British strategist Halford Mackinder. Beneath the churn of political events, this integration is driven not only by the familiar dynamics of globalization but also by such less noted factors as the growing efficiency of transport logistics and the digitization of customs procedures. U.S. pressure on China and Russia is pushing the two countries together, and complementary economic strengths are drawing Germany closer to China. China is promoting integration through its Belt and Road Initiative, seeking to aid its giant state-owned enterprises, which are desperate to reach beyond their saturated home market. Integration could be slowed by an economic crisis or an ethnoreligious conflict in China or by ambivalence in other countries about Chinese influence, but it would take a cataclysm to stop it. Calder thinks that China will seek not U.S.-style hegemony but a new kind of influence in which the benefits of integration are more widely distributed among countries, which he labels “distributive globalism.” If so, he recommends that the United States cooperate with countries such as India and Japan, and even to some extent with China, to promote pluralism within the zone of Chinese influence."
34,In a Time of Monsters: Travels Through a Middle East in Revolt,https://www.foreignaffairs.com/reviews/capsule-review/2019-08-12/time-monsters-travels-through-middle-east-revolt,In a Time of Monsters: Travels Through a Middle East in Revolt,"Sky spent three years in Iraq as a British civil servant seconded to senior U.S. military figures, including Generals David Petraeus and Raymond Odierno. In 2015, she produced an insightful book, The Unraveling, chronicling her service. In this new book, she shifts from participant to spectator. The results are disappointing. Starting in 2011 with the early Arab Spring, Sky recounts her travels across several regions, from Galicia in Spain to the mountains of Kyrgyzstan, often guided by diplomats and other acquaintances from her time in Iraq. Sky admits that finding direction and purpose after she left Iraq was not easy and says that her excursions across the Middle East gave her new shots of adrenaline. Yet what the reader is meant to take away from the stories remains a mystery."
35,After the Caliphate: The Islamic State and the Future of the Terrorist Diaspora,https://www.foreignaffairs.com/reviews/capsule-review/2019-08-12/after-caliphate-islamic-state-and-future-terrorist-diaspora,After the Caliphate: The Islamic State and the Future of the Terrorist Diaspora,"In this book, Clarke aims to cover what he calls “global jihadism,” although he primarily focuses on al Qaeda and the Islamic State (or ISIS). His account ends several months before ISIS lost the last of its territory with the fall of Baghouz, in Syria, in March of this year, but Clarke’s main message is that the jihadists will regroup in Iraq and Syria and that al Qaeda and ISIS will lead the way. What is more controversial, he argues that the launching of a caliphate by ISIS, in 2014, will in the end prove far more significant than its destruction. He does not add much to the existing literature on jihadism, and although he offers some intriguing figures, he does not explain them. There are some 230,000 jihadists worldwide, he says, but only 19,000 people on government terrorist watch lists. ISIS recruited around 43,000 fighters from 120 countries; between 6,000 and 11,000 of them may be left. In all, Clarke estimates that some 70,000 jihadists have been killed in recent years."
36,"Yemen in Crisis: Autocracy, Neoliberalism, and the Disintegration of a State",https://www.foreignaffairs.com/reviews/yemen-crisis-autocracy-neoliberalism-and-disintegration-state,"Yemen in Crisis: Autocracy, Neoliberalism, and the Disintegration of a State","This useful survey reflects Lackner’s 40 years of experience studying Yemen. She examines the country’s descent into chaos, from the golden period of the 1980s, when oil rents and out-migration were high, through the growing kleptocracy under President Ali Abdullah Saleh in the 1990s and early years of this century, to the civil war that began in 2015 and the resulting humanitarian catastrophe. Along the way, she analyzes Yemen’s tribes, its varieties of Islam, its economy, and the mismanagement of its water resources. She dismisses the claim that Iran is supporting the Houthis in the civil war, but she fails to provide sufficient evidence to support her skepticism. She also blames neoliberal policies promoted by the International Monetary Fund for Yemen’s growing inequality. Her account ends before the assassination of Saleh at the hands of the Houthis in 2017. Since then, no one of his Machiavellian caliber has emerged to replace him. Four years of a Saudi-led, U.S.-backed assault by pro-government forces have devastated Yemen’s infrastructure and people, but Lackner is clear that the Houthis do not offer an attractive alternative government and doubts that the current UN-led negotiations can bring a sustainable peace."
37,Two Books on Genocide,https://www.foreignaffairs.com/reviews/capsule-review/2019-08-12/two-books-genocide,Two Books on Genocide,"These two books are gut-wrenching chronicles of human depravity that show how ordinary people can become barbarians. Both describe, in numbing detail, decades of pillage, rape, starvation, and torture. Morris and Ze’evi tie together the three waves of killing that swept across the Christian population of Anatolia (in modern-day Turkey) from 1894 to 1924. First, the Ottoman Empire, under Sultan Abdulhamid II, massacred hundreds of thousands of Armenians. Then, in 1914, the Young Turks, who had marginalized the sultan after the revolution of 1908, launched their own, far larger Armenian genocide. Finally, after 1919, the Republicans under Kemal Ataturk began killing and deporting the remaining Christians, many of whom were Greek. Over the three decades, between 1.5 million and 2.5 million Armenians, Assyrians, and Greeks were murdered. Morris and Ze’evi convey well the horror of the killings. In a cave where the bodies of at least 100 Greeks were found, they write that “all apparently had first had their hands and feet cut off, after that they were either burnt alive in the cave or had their throats cut.”"
38,Putin’s Counterrevolution,https://www.foreignaffairs.com/reviews/capsule-review/2019-08-12/putins-counterrevolution,Putin’s Counterrevolution,"Democratic institutions, even weak ones, do not wither and die overnight. Leaders bent on undermining free elections or co-opting the judiciary often require years of methodical plotting and legislative chicanery to achieve their goals. And such changes often unfold far from the eye of the general public. In this comprehensive historical study, Aleksashenko does a great service by documenting the decades-long institutional erosion and consolidation of authoritarian rule in Putin-era Russia. The author hits his stride in his discussion of the state’s intervention in the economy. Many previous works have described the consequences of the Kremlin’s takeover of the lucrative oil industry. But the state’s hand has extended into many other sectors, as well. Through detailed interviews and careful work with primary sources, Aleksashenko shows how the Putin regime has taken on oligarchs, pressured international investors, built gigantic state-owned enterprises, and bailed out failing firms. The book offers a definitive account of how, since the late 1990s, the balance of power in Russia has shifted decisively in favor of government officials over private firms. The regime’s economic dominance helps explain its lack of interest in reforms that would protect the property rights or political freedoms of potential challengers."
39,"Russian Nuclear Orthodoxy: Religion, Politics, and Strategy",https://www.foreignaffairs.com/reviews/capsule-review/2019-08-12/russian-nuclear-orthodoxy-religion-politics-and-strategy,"Russian Nuclear Orthodoxy: Religion, Politics, and Strategy","The role of the Russian Orthodox Church in post-Soviet Russian society has been much discussed in recent years, but Adamsky is the first to examine the church’s place in the nuclear military-industrial complex. He details how a formerly persecuted church made itself indispensable to Russia’s nuclear forces by providing them with ideological legitimation as they faced a catastrophic loss of funding and social prestige in the early 1990s. Three decades later, the church has become a prominent presence throughout the entire military, but the nuclear branch stands out as the most imbued with clericalism. Priests regularly minister to its service members, joining their flock on operational missions. The church has built houses of worship on all of Russia’s nuclear bases, Orthodox icons grace nuclear weapons platforms, and commanders have increasingly incorporated religious ideas into their strategic thinking. Adamsky convincingly shows that this began as a grass-roots process, whereby those of lower military rank recognized priests as a source of the kind of pastoral and psychological support they sorely needed in a high-stress work environment. Only later did the regime take notice and seek to systematize the phenomenon from above. The result is an unprecedented nuclear-religious culture, whose emergence has significant strategic implications, including the introduction of theological concepts into Russian military planning."
